47	Regrets that absolutely no mention is made of steps to implement gender mainstreaming in the priorities of the Annual Growth Survey 2013; considers that significantly increasing women's participation in the labour market is key to achieving the Europe 2020 headline target for the employment rate; calls on the Commission and the Member States to adopt the necessary measures to promote higher employment rates among women, such as affordable care and child care, adequate maternity, paternity and parental leave schemes and flexibility in working hours and places of work;
48	Calls on the Member States to improve the environment for businesses, especially for SMEs, and calls on the Commission and the European Council to step up efforts to improve the Single Market, to enhance the digital economy and to focus on smart regulation in order to reduce unnecessary red tape; welcomes the Single Market Act II and calls for swift and full implementation thereof;
49	Calls the Commission to make single market governance a key priority, since it contributes substantially to reaching the targets of the European Semester, namely sustainable economic growth and employment; takes the view that the Commission's country-specific recommendations should, at the same time, offer the Member States more practical solutions for improving the functioning of the single market, so that stronger public support and political commitment are created to encourage the completion of the single market;
50	Welcomes the recognition of the importance of access to finance for SMEs, as they are the cornerstone of employment and job creation within the EU and have significant potential for addressing youth unemployment and the gender imbalance; urges the Member States to make access to finance for SMEs an absolute priority in their national growth plans; urges the Member States to provide easy access to the European Funds dedicated to that end;
51	Recognises the importance of the increased lending capacity of the EIB and recommends that this be aligned with the EU's priorities focused on eliminating regional disparities; calls on the Commission to ask the Member States to use part of their Structural Fund allocations to share the EIB loan risk and provide loan guarantees for SMEs and microenterprises, thus achieving a boost of economic activity across all sectors and regions, guaranteeing further employment opportunities and overcoming the lack of access to credit currently hampering SMEs;
52	Calls on the Member States to promote and support entrepreneurship, including social entrepreneurship, and business start-ups, particularly through business development programmes and access to financing;
53	Calls on the Commission to ensure that social entrepreneurship is strongly supported under the Multi-Annual Framework 2014-2020, as this area has obvious high potential for new jobs and innovative growth;
54	Urges the Commission to fully mobilise EU instruments and financial support to achieve the Europe 2020 Strategy objectives; calls on the Member States to make full use of the Structural Funds in order to enhance employability and combat structural, long-term and youth unemployment effectively.
55	Notes that cohesion policy, as a key EU investment tool that plays an important role within the Europe 2020 Strategy and that accurately targets local, regional and national investment needs, contributes not only to reducing disparities between regions, but also to the economic recovery of the Member States and to the effective delivery of sustainable growth and job creation in the Member States and in the Union as a whole; observes that this makes the cohesion policy one of the best available instruments for making the recovery job-rich, as the Commission foresees in the AGS 2013; takes the view, in this regard, that any cut in the cohesion policy budget would have strong negative consequences for the Europe 2020 goals, and insists, therefore, that in the new programming period an adequate level of resources be allocated to cohesion policy, at least on the level as that agreed for the current programming period 2007-2013, and that it continues to cover all EU regions;
56	Welcomes the Commission's acknowledgment in the AGS 2013 that administrative capacities need to be stepped up to ensure speedier distribution of as yet unspent Structural Fund resources; points out that such efforts should be focused on authorities at the national, regional and local levels; emphasises that speedier disbursement of as yet unspent Structural Funds resources can help strengthen the liquidity of the market;
57	Calls on the Commission and the Member States to ensure that regional policy continues to play an important part in the development of national programmes within the European Semester and represents a key tool for reaching the established objectives, with regard to social policies and employment, in the medium to long term;
58	Considers it essential for cohesion policy to contribute to reducing internal competitive disparities and structural imbalances through its option of adaptability to the specific conditions and needs identified on the local, regional and national levels; welcomes, in this regard, the Commission's initiative of reprogramming, where possible, as yet unspent Structural Fund resources in favour of energy efficiency, youth employment and SMEs, as they will play an important role in reaching the EU 2020 objectives; asks to be kept duly informed on the implementation of this initiative at national levels;
59	Calls on the Member States to take measures to facilitate the transition of young people from education and training to the labour market; points, in this connection, to the success of ‘dual vocational training’ in certain Member states, which has provided the highest employment rate among young people in the European Union;
60	Considers it crucial to help young people to acquire skills more effectively, which requires greater cooperation and communication between companies, governments and education providers;
61	Welcomes the Commission's announcement that it is to present a youth employment package; calls on the Member States to promote and develop, in close cooperation with the social partners, a Youth Guarantee, with the aim of offering every young person in the EU a job, an apprenticeship, additional training or combined work and training after a maximum period of four months' unemployment; considers that Union funding, especially the ESF, should play a key role in co-financing Youth Guarantee Schemes; calls on the Commission to provide Member States and regions with technical assistance to implement such schemes and make good use of the ESF in order to develop Youth Guarantee Schemes; emphasizes that the national sectoral partners in close cooperation with local and regional authorities should play a key role in the implementation of Youth Guarantee Schemes;
62	Notes that Youth Guarantee Schemes should be accompanied by a quality framework in order to ensure the quality of these schemes and that training, apprenticeships and jobs offered include appropriate working conditions and comply with health and safety standards; considers that, in this framework, all young people should receive a personalised assessment of their needs, and be provided with tailored and personalised services;
63	Welcomes the Commission's suggestion that a multilateral surveillance of the implementation of the Youth Guarantee schemes be established through the ‘Employment Committee’ and asks for Parliament to be associated;
64	Welcomes the Commission's initiative of proposing a Council Recommendation on Youth Guarantee Schemes; calls on the Member States and regions to promote entrepreneurship and self-employment among young people and to implement specific targeted business development support programmes for young people;
65	Stresses that, in January 2012, the European Council put forward a pilot action to help the eight Member States with the highest levels of youth unemployment to re-allocate some of their EU structural fund allocations to tackle youth unemployment; regrets that in May 2012 the Commission significantly lowered the estimations on available funds for reallocation from EUR 82 billion to EUR 29 800 million and thereby reduced the scope of the pilot actions; deplores the fact that only a small portion of these funds have so far been redirected to help young people find a job;
66	Welcomes the proposal for greater use to be made of the European Social Fund for youth employment measures in the programming period 2014-2020; calls for the use of ESF funds for youth-related measures to be focused especially on apprenticeships/traineeships and entrepreneurship; welcomes the redeployment of unspent Structural Fund monies from the EU's 2007-13 financial period for the purpose of tackling the high youth unemployment rate and promoting small and medium-sized enterprises;
67	Stresses the importance of improving monitoring skills in specific sectors and/or regions and remedying these skills mismatches as swiftly as possible; calls the Commission and Member States to cooperate in the elaboration of the EU Skills Panorama in order to provide a comprehensive view of EU skills needs;
68	Calls on the EU and Member States to foster cooperation and synergies between the education-training sector and enterprises to anticipate skills' needs and adapt education and training systems to the needs of the labour market with the objective of providing the workforce with the necessary skills, based on changing working environments and the individual needs of an ageing workforce, and facilitating the transition from education and training to work;
69	Calls on the Member States to provide, as a priority, for investments in education, training, the promotion of entrepreneurial skills and lifelong learning for all age groups, not only through formal learning but also through the development of non-formal and informal learning; warns of the long-term social and economic costs of cuts in education and training budgets as they hamper the exit from the crisis and reduce the competitiveness of the Member States' economies;
70	Highlights the fact that making use of new learning opportunities and making the most of knowledge, skills and competences acquired outside formal education can play an important role in enhancing employability; underlines the importance of non-formal and informal validation; welcomes the Commission proposal for a Council recommendation inviting the Member States to establish validation systems by 2015, linked to the European Qualification Framework, including the possibility of obtaining a full or partial qualification on the basis of non-formal or informal learning;
71	Encourages the effective implementation of the National Qualifications Framework as a tool promoting the development of lifelong learning; reiterates its call on the Commission to make the European Skills Passport a reality in order to ensure transparency and promote workers' crossborder mobility;
72	Stresses the need to improve the quality, competence and status of teachers as a sine qua non condition for a high-performing European education and training system; calls on the Commission and the Member States to devote the necessary efforts and resources to this aim;
73	Believes that labour market reforms should be aimed at increasing productivity and competitiveness and, at the same time, safeguarding job quality; calls on the European Council to pay attention to job quality in its 2013 policy guidance, in particular in relation to workers' access to a core set of labour rights, as enshrined in the Treaties, and without prejudice to the Member States' legislation;
74	Believes that structural labour market reforms should introduce internal flexibility to maintain employment in times of economic disruption, and ensure job quality, security in employment transitions, unemployment benefit schemes based on activation requirements and linked with reintegration policies that maintain work incentives while ensuring sufficient income, contractual arrangements to combat labour market segmentation, anticipate economic restructuring, and ensure access to lifelong learning;
75	Calls on the Member States to combat the existence and proliferation of precarious job conditions and false self-employment and to ensure that people with temporary or part-time contracts or who are self-employed have adequate social protection and access to training;
76	Calls on Member States to improve employment legislation where necessary and with a view to promoting stable employment relationships, supporting and developing conditions for offering more flexible working arrangements together with adequate social security levels, especially for older and younger workers, and promoting workers' voluntary mobility through mobility support schemes;
77	Calls on the Commission and the Member States to address the low level of labour market participation of disadvantaged groups, including people belonging to minorities (e.g	Roma) and people with disabilities, and to respect decent living wages at all times;
78	Calls on the Member States to increase the coverage and effectiveness of active labour market policies, in close cooperation with social partners, mutually supported by activation incentives, such as welfare-to-work programmes, and adequate benefit systems in order to maintain employability, support people back into work and safeguard decent living conditions;
79	Calls on the Member States to anticipate restructuring processes with the aim of saving jobs, fostering internal and external mobility and minimising the possible negative effects of restructuring processes; calls on the Member States effectively to implement national law and existing EU directives, such as the Collective Redundancies Directive, the Transfer of Undertakings Directive and the Information and Consultation Framework Directive, with due respect for the principle of subsidiarity; considers that EU funds should play an important role in avoiding, minimising or palliating possible negative effects of restructuring processes;
80	Calls on the Commission and the Member States to ensure the effective enforcement of the Directive 2000/78/EC on establishing a general framework for equal treatment in employment and occupation;
81	Calls on the Commission and the Member States, in order to deepen European labour market integration, to take steps to improve mobility within and across labour markets by removing legal and administrative barriers to free movement of workers within the EU such as the transitional labour market restrictions for workers from Romania and Bulgaria and by improving the social security rights and working conditions of workers making use of their right to free movement; calls on the Member States to increase their use of EURES in order to enhance the matching of jobs and job-seekers across borders;
82	Draws attention to the increase in poverty and unemployment among all age groups; calls on the Commission and the Member States, therefore, to adopt new commitments to address this situation, especially with regard to in-work poverty, poverty among people with limited or no links to the labour market, including long-term unemployed older workers and poverty among older people;
83	Calls on the Member States to ensure that negative effects of fiscal consolidation on gender equality, female employment and poverty are reversed by adopting a gender mainstreaming approach in national budgets, addressing stronger gender-specific recommendations to Member States, and disaggregating the Europe 2020 headline targets and the corresponding national targets by gender;
84	Calls on the Member States to improve the adequacy and effectiveness of social protection systems and to ensure that these continue to act as buffers against poverty and social exclusion; notes, at the same time, that the European Social Model requires modernisation in the direction of ‘activating welfare states’, that invest in people and provide instruments and incentives with a view to creating sustainable jobs and growth as well as preventing social distortions;
85	Calls on the Member States to implement active inclusion strategies and adequate and affordable high-quality services and pathway approaches to quality employment, with a view to preventing the marginalisation of low-income and vulnerable groups;
86	Calls on the Member States to specify in their National Reform Programmes how EU funds will be used to support the attainment of national poverty targets and other social, employment and education targets ensuring the achievement of the Europe 2020 targets;
87	Calls on the EU and the Member States to ensure that any health system reform focuses on improving quality, ensuring adequacy, affordability and universal access and guaranteeing sustainability;
88	Believes that targeted hiring subsidies to new recruitments among disadvantaged groups are an effective way of raise their labour participation levels;
89	Calls on the Member States and the Commission to ensure that fiscal consolidation is compatible with the employment and social dimension of Europe 2020;
90	Is concerned about the social impact of the crisis on poverty among women; calls on the Commission to assess the effects of fiscal consolidation on gender equality and female employment;
91	Calls on the Member States to develop measures to reduce in-work poverty, such as fostering sufficient labour market participation levels in households and facilitating upward transitions for those in low-paid or precarious jobs; calls on the Member States to combat in-work poverty by pursuing labour-market policies which aim at ensuring living wages for those in work;
92	Calls on the Commission to come before the competent committees of Parliament to present the AGS each year at the beginning of November, starting 4-5 November 2013, so as to allow sufficient time for Parliament to present its views in subsequent European Semesters;
93	Calls on the European Council and the Member States to ensure that national and regional parliaments, social partners, public authorities and civil society are closely involved in the implementation and monitoring of policy guidance under the Europe 2020 Strategy and economic governance process, in order to ensure ownership;
94	Calls on the European Council and the Commission to integrate the monitoring and evaluation of employment, social and education goals of the Europe 2020 Strategy more effectively in the European Semester 2013;
95	Reiterates its call for increased democratic legitimacy for the European Semester; calls on the European Council to take up the concerns and proposals expressed by the European Parliament when adopting its 2013 policy guidance;
96	Calls for Parliament to be appropriately involved in the European Semester in order to represent citizens' interests and increase the legitimacy of the social policies to be conducted by the Member States;
97	Wishes to see the role of the national parliaments strengthened with regard to their involvement in the process of economic and social policy-making in the framework of the European Semester, in order to increase the legitimacy of the decisions taken;
98	Calls for the involvement of social partners and civil society in order to increase the adequacy and effectiveness of social policies;
99	Instructs its President to forward this resolution to the Council, the Commission and the governments and parliaments of the Member States.
