A	whereas Article 208 of the Treaty on the Functioning of the European Union establishes the reduction and, in the long term, the eradication of poverty, as defined in the European Consensus on Development, as the primary objective of EU development policy, and whereas the Union shall take account of the objectives of development cooperation in the policies that it implements and which are likely to affect developing countries;
B	whereas the European Union's commitment to ensure policy coherence for development (PCD), in accordance with the conclusions of the European Council in 2005,was recently reaffirmed in its conclusions on PCD;
C	whereas there are clear inconsistencies in the EU's trade, agriculture, fisheries, climate, intellectual property rights, migration, finance, arms and raw materials policies which affect development goals; whereas PCD can contribute to poverty reduction by finding fundamental synergies among EU Policies;
D	whereas the new development policy framework presented in the Agenda for Change aims for policy coherence not only within the Union but also with regards to the Union and its Member States by advocating joint-programming and emphasising the role of the EU as coordinator, convener and policy maker;
E	whereas a post-2015 international framework for development cooperation has the potential to play a catalytic role in addressing important development and other global challenges and could help to fulfil individuals' rights and needs;
F	whereas, despite the improvements, as in case of the EU, direct or indirect subsidies for agricultural products continue to have a negative effect on food security and the development of a viable agricultural sector in developing countries;
G	whereas the EU is committed to reaching the UN target of 0.7 % of gross national income (GNI) in official development assistance (ODA) by 2015;
H	whereas the Court of Justice of the European Union (CJEU) issued a judgement in November 2008 whereby the European Investment Bank (EIB) operations in developing countries must prioritise development over any economic or political objective;
I	whereas a large number of studies have shown that there are between USD 850 billion and USD 1 trillion per year of illicit financial flows out of developing countries, which severely hinders the fiscal revenue of developing countries and consequently their self-development capacities;
J	whereas the Agenda for Change (COM(2011)0637), in its aim to increase the impact of EU development assistance, reiterates that the objectives of development, democracy, human rights, good governance and security are intertwined;
K	whereas public procurement accounts for 19 % of world GDP, or almost 40 times the amount provided by the EU and the Member States in ODA; whereas, as such, it has huge potential to be a tool of implementing sustainable government policies both in the EU and in its ODA recipient countries;
L	whereas malnutrition kills an estimated 2.6 million children each year and, if unchecked, will put almost half a billion children at risk of permanent damage in the next 15 years; whereas about one-third of the pre-school age children in the world currently suffer from underweight (too little weight for their age) or stunting (too short for their age); whereas malnutrition costs countries 2-4 % of their GDP, and costs an individual an estimated 11 % of his or her lifetime earnings, while, at the same time, tested, cost-effective interventions in nutrition exist and would represent a sound investment;
M	whereas, by 2030, the demand for energy and water is expected to rise by 40 % and the demand for food by 50 %, and whereas population growth, together with a rising middle class in emerging and developing nations, will put huge pressure on natural resources – especially water, energy and land – and on the environment;
N	whereas the concepts of human development and human security share four fundamental perspectives: they are people-centred, they are multi-dimensional, they have broad views on human fulfilment in the long-term and they address chronic poverty(3);
O	whereas the external dimension of the two new DG Home Affairs funds, and the Migration and Asylum component of the new Global Public Goods and Challenges Thematic Programme of the Development Co-operation Instrument (DCI), cover, as anticipated in the declared priorities, similar thematic areas although from different perspectives;
P	whereas clinical trials that are no longer accepted by Western European ethics committees are approved by the local ethics committees in countries such as India, China, Argentina and Russia; whereas, in particular, the ethical principles which are of utmost importance for developing countries, as reflected in the Declaration of Helsinki, are ignored by companies and regulatory authorities(4);
Q	whereas culture is, in all its dimensions, a fundamental component of sustainable development because it is, through tangible and intangible heritage, creative industries and various forms of artistic expressions, a powerful contributor to economic development, social stability and environmental protection;
R	whereas studies show that if women are educated and can earn and control income, a number of good results follow: maternal and infant mortality declines, women and child health and nutrition improve, agricultural productivity rises, climate change can be mitigated, population growth slows, economies expand and cycles of poverty are broken(5);
S	whereas information and communication technologies (ICT) have the potential to help mitigating climate change not only by reducing their own share of greenhouse gas emissions but also by using them to reduce emissions in other sectors and to address systemic change and rebound effects, e.g	by dematerialisation and online delivery, transport and travel substitution, monitoring and management applications, greater energy efficiency in production and use, and product stewardship and recycling;
T	whereas the 2007 DAC Peer Review of European Communities noted that 'good understanding of the appropriateness of budget support in the local context is important';
U	whereas education can play a pivotal role not only in environmental sustainability, health and economic growth, and in the achievement of the MDGs in general, but also in peace-building; whereas, perhaps more than any other sector, education can provide the highly visible early peace dividends on which the survival of peace agreements may depend if education systems are inclusive and geared towards fostering attitudes conducive to mutual understanding, tolerance and respect, thereby making societies less susceptible to violent conflict;
1	Welcomes the EU's efforts towards PCD; underlines that PCD is not only a legal obligation, but that designing accountable, transparent, human-rights-based, and inclusive policies is a chance for the EU to establish equal and sustainable partnerships with developing countries that go beyond development cooperation; stresses as well that PCD-aligned policies give governments and societies of developing countries the chance, and the responsibility, to generate successes on their own;
2	Believes that PCD must be based on the recognition of the right of a country or a region to define by democratic means its own policies, priorities and strategies to protect its populations' livelihoods in line with the UN International covenant on Economic, social and Cultural rights;
3	Welcomes the eight areas of action for the years 2011-2014 chosen by the Commission in its proposal for a new policy on corporate social responsibility (CSR); underlines the importance of binding CSR obligations and of encouraging employers to apply social standards which are more ambitious than current statutory provisions, including the possibility to develop and obtain a designation such as a social label; calls on the Commission to support the Member States in carefully monitoring the implementation, and ensuring the legal enforcement, of these obligations, and insists that the upcoming initiative on CSR reflects the obligations towards PCD and moves towards binding CSR standards;
4	Stresses that PCD is not merely a technical issue, but primarily a political responsibility, and that Parliament, as co-legislator and as a democratically elected institution, has a key responsibility for translating the commitments into concrete policies;
5	Insists that the European Consensus on Development, including its definition of PCD, remains the doctrinal framework for the EU’s development policy, and that any attempt to revise or replace it in the context of the ‘Agenda for Change’ should involve the institutions that permitted its creation;
6	Recalls that any new political orientation in the context of the 11th EDF emanating from the Agenda for Change must be compatible with the spirit and the letter of the Cotonou Agreement;
7	Stresses that transparency in all areas is instrumental in achieving PCD as it can not only prevent unintended incoherence but is also effective where there are clashes of interest;
8	Calls for the introduction of structured annual meetings between representatives of national parliaments of EU Member States and the European Parliament to ensure consistency in the spending of development aid;
9	Points to the importance of knowledge building and expertise with regard to the complex issue of PCD; asks, therefore, the Commission to ensure that provisions are made to focus some DG Research programmes on issues relevant to PCD; recommends as well the elaboration and promotion of a strategy on development research in order to engage with DG Research and other research DGs, as well as other relevant bodies external to the Commission, e.g	the OECD and the World Bank;
10	Insists that the questions regarding the economic, environmental and social impacts of policies inside and outside of the EU laid down in the Impact Assessments Guidelines from 2009 are answered in the Commission's impact assessments as well as in the impact assessments to be made by Parliament; asks the Commission also to complete the impact assessments in advance of the corresponding policy proposal in order to ensure that civil society organisations (CSOs) and other relevant stakeholders can participate in the process, thereby also creating an added value in terms of capacity;
11	Underlines that the Impact Assessment Board of the Commission and the similar institution to be set up by Parliament need adequate expertise in development policies in order to live up to their responsibility to verify the quality of impacts assessments in terms of PCD;
12	Suggests that a reference to PCD be included in reviews and ex-post evaluations of EU policies if adequate; takes the view that any evaluation exercise of programmes carried out under the European Development Fund (EDF) or the DCI should include an assessment of its consequences for PCD;
13	Welcomes the inclusion of specific PCD commitments in the Danish Presidency's work programme and asks the next Presidencies to follow up on that example;
14	Welcomes the Commission's third biennial report on PCD 2011, but agrees with the Council on the need to include an independent assessment of progress, including qualitative and quantitative consequences and costs of policy incoherence in future reports; suggests that future reports should also include a comprehensive overview of PCD-related results of the country-level dialogues, in order to make the voices of citizens of developing countries heard;
15	Calls on the Member States and their national parliaments to promote PCD through a specific working programme with binding timetables, in order to improve the European PCD work programme;
16	Agrees with the Commission that in the preparation of the next rolling PCD Work Programme, a wider discussion with the European External Action Service (EEAS) and Member States and all relevant stakeholders, for example NGOs and CSOs, is needed; agrees that fewer indicators, together with more precise and better monitoring, can lead to a more operational framework and easier monitoring;
17	Asks the High Representative and the European External Action Service (EEAS) to confirm their important roles in making PCD a reality;
18	Suggests making PCD a clear priority for the EEAS and the Delegations by further strengthening the EU's policy dialogue with CSOs, local parliaments and other stakeholders, by asking them to gather evidence on lack of either inconsistency or coherence, by improving the PCD references in programming documents and making them operational, and by developing a training programme, together with DG DEVCO, for all new EEAS staff to ensure that they are able to understand and apply PCD; points out that adequate resources to fulfil this task must be allocated to the Delegations and the headquarters;
19	Underlines that EU delegations have a central role in designing and managing budget support, and that their resources should be ensured correspondingly;
20	Recalls the paramount importance of Article 12 of the ACP-EC Partnership Agreement and the obligation for the Commission to regularly inform the Secretariat of the ACP Group of planned proposals which might affect the interests of the ACP States; calls on the Commission to inform Parliament when such procedures are undertaken;
21	Welcomes the Commission's proposal to deepen the cooperation with the European Parliament and national parliaments on PCD by engaging in more exchanges with them on the subject and by accompanying them in acquiring specific analytical capacity to contribute to promoting PCD in the EU; proposes that these exchanges between national parliaments, the European Parliament and the Commission should come in the form of structured annual meetings which include clear objectives along with task-monitoring activities with the goal of strengthening PCD in the EU;
22	Considers that public procurement should be effectively used to achieve the overall EU objectives of sustainable development and, therefore, that the future public procurement directives should enable sustainability criteria to be integrated throughout the procurement process;
23	Welcomes that the Commission, in its Communication on ‘Trade, Growth and Development: Tailoring Trade and Investment Policy for Those Countries Most in Need’, commits itself to support small producers and promote fair, organic and ethical trade initiatives, but regrets the lack of commitment to mainstream fair trade principles across EU policies;
24	Deplores the publication of two separate reports on trade in general and on trade and development by the Commission which was counterproductive from the viewpoint of PCD;
25	Regrets that GDP per capita is made the sole eligibility criterion for the GSP scheme, as this could run counter to the EU's development objectives; recalls its resolution of 8 June 2011 on ‘GDP and beyond – Measuring progress in a changing world’(6), which makes reference to the Human Development Index;
26	Recalls the inconsistencies produced in the context of European Partnership Agreements, namely: a) that some countries are urged to sign an agreement before its exact terms are mutually agreed, b) that the Commission proposes to delete 18 countries from Annex I to the Market Access Regulation, and c) that human rights issues are not sufficiently addressed during negotiations;
27	Takes the view that the OECD guidelines for multi-national enterprises should become binding standards in EU investment treaties for business and industry, ensuring that investment treaties include clauses on transparency and on the fight against illicit capital flows, along with full reporting on environmental and social issues by companies; points out that investment agreements should improve the rights and duties of governments to regulate economic activities in sensitive policy areas such as the environment and foster decent work in the broader public interest and in the longer-term interest of future generations;
28	Deplores that the share of EU Aid for Trade (AfT) to LDCs declined to 16 % in 2010 (EUR 1,7 billion, as against EUR 8,7 billion to non-LDCs) from 22 % in 2009(7); calls on the Commission to inform Parliament about the annual and/or multi-annual share of the EDF funds spent as AfT;
29	Proposes that the Commission creates new momentum for sustainable public procurement at the international level, and that the resulting framework of the revision of the public procurement directives should give contracting authorities the policy space to make informed pro-development procurement choices;
30	Calls on the Commission actively to promote, within the WTO, the suggestion of some donors to narrow the scope of the Aid for Trade Initiative in order to make it more monitorable, efficient and focused on key elements of the trade and development nexus, in order to make it more effective and to secure donors' financing;
31	Draws attention to the publication of a revised IPR Strategy vis-à-vis third countries which should, from a development point of view, ensure adequate access to medicines and provide effective incentives for pharmaceutical research by making use of the TRIPs Agreement’s flexibilities in appropriate cases, such as health emergencies, and by making the Strategy compatible with the parallel agenda for ‘affordable access to medicine’; stresses as well that the link to the food security agenda is very important in this context, e.g	to ensure the protection of plant varieties and acknowledge the importance of diverse agricultural systems and traditional seed supply systems;
32	Proposes the implementation of preferential trade rules that enhance green agricultural technology transfers in the WTO and in bilateral trade agreements with developing countries;
33	Welcomes the creation in 2010,within the sustainable development team in Directorate-General for Trade, of a focal point for coordinating fair trade-related activities, which are an important example of how EU trade and development policy can be made more coherent and mutually supportive;
34	Points out that fair trade between the EU and developing countries entails paying a fair price for the resources and agricultural products of the developing countries, i.e	a price which reflects the internal and external costs, while guaranteeing ILO's core labour standards for working conditions as well as international standards on environmental protection;
35	Reiterates its call to address in an effective way the problem of conflict minerals and other resources related to conflict in developing countries that have resulted in the death and displacement of millions of people;
36	Believes that developing countries should protect their economy and proceed to selective market openings, as was the case in Europe;
37	Asks the Commission to further integrate internationally agreed labour and environmental standards into instruments like the EPAs and FTAs;
38	Welcomes the fact that the relevance of smallholder farming for combating hunger is recognised by the EU and that adaptation measures are priorities in the food security agenda; underlines that support for women smallholder farmers is especially relevant;
39	Reiterates that development concerns should be built into the entire process of decision making on the EU's agricultural policy, and calls for the establishment of flanking measures similar to the sugar-protocol accompanying measures (SPAM), if necessary;
40	Repeats its call for regular and independent assessments and evaluations of the EU's agricultural and trade policies, paying special attention to impacts on local and smallholder producers, and building on evidence submitted by governments, farmers' organisations, civil society organisations and other stakeholders in developing countries which are EU trading partners;
41	Urges the EU to strengthen EU-ACP supply chains and to support the strengthening of supply chains within the ACP countries themselves as both markets have developed in mutual dependence; suggests fostering the use of modern market management instruments in developing countries, such as transparency provisions, capacity building, technical regulations, or support with regard to contract negotiation, e.g	in the context of the Joint EU-Africa Strategy;
42	Proposes to set up transnational twinning partnerships between Natura 2000 areas and similar agricultural ecological management areas in developing countries with the aim of: a) exchanging know-how on management of such areas by local authorities, local leaders and local farming communities to ensure that future management is sustainable, both ecologically and economically, and practicable, b) building capacity through twinning of the economic viability of business chains in these areas to contribute to sustainable food security in these areas, and c) implementing research to assist in the protection of agricultural diversity and biodiversity to assure the long-term survival of valuable and threatened species and habitat; proposes as well the establishment of a transnational twinning centre for learning and development of know-how between Natura 2000 areas and similar areas in third countries;
43	Points out that timely information on changes in standards applied to agricultural products, or the application of alternative equivalent standards to imports by the EU, is essential to efforts in developing countries to facilitate long-term planning and ensure competitiveness on the basis of quality;
44	Calls on the Commission to develop an integrated approach to nutrition, set up a dedicated trust fund to address the problem of malnutrition in developing countries, and mobilise the necessary resources to deliver the basic interventions that could prevent the vast majority of malnutrition, especially in the critical 1 000-day window between conception and age 2, which include encouraging optimum feeding and caring practices such as breastfeeding to avoid contaminated water, proper introduction of varied foods for infants, fortification of basic staples and vitamin supplementation; believes that such a trust fund would enable the leveraging and pooling of resources from Commission and Member States, and possibly other donors, and would enable better visibility of EU action in saving lives;
45	Deplores the fact that only approximately EUR 418 million, or around 3,4 % of the total Commission development aid budget of EUR 12 billion per year, is currently allocated to direct nutrition intervention; believes that efforts to tackle malnutrition must be multi-disciplinary, engage multiple stakeholders and be in line with the national priorities of affected countries;
46	Considers that the size of the EU market for fish, and the geographical range of activities by EU-flagged and EU-owned vessels, impose a high level of responsibility on the Union for ensuring that these activities are based upon the same standards in terms of ecological and social sustainability and transparency inside and outside Union waters; notes that such coherence requires coordination both within the Commission itself and between the Commission and the governments of the individual Member States;
47	Reiterates that, in order to improve PCD, the negotiation of fisheries partnership agreements (FPAs) must be based on the contracting country's priorities for the suitable development of its fishing sector; stresses that FPA payments should be compatible with development objectives and that the impacts of FPAs should be closely monitored by the EU;
48	Takes the view that PCD should be reinforced by: a) making DG-MARE and DG-Development jointly responsible for FPAs, b) applying relevant principles outlined in the FAO Code of Conduct for Responsible Fishing, EU commitments towards Policy Coherence for Development, and the EU-ACP Cotonou Agreement, c) incorporating human rights, anti-corruption and accountability obligations in all FPAs, and d) ensuring that FPAs are consistent with or contribute to the poverty reduction and human development objectives identified in the EU's Country and Regional Strategy Papers;
49	Stresses that any access to fisheries resources in third countries' waters must respect not only Article 62 of the UN Convention on the Law of the Sea (UNCLOS) regarding surplus stocks but also Articles 69 and 70 on the rights of land-locked and geographically disadvantaged states within the region, taking into account the nutritional and socioeconomic needs of local populations;
50	Proposes that, in line with the 2006 UN General Assembly resolution on Regional Fisheries Management Organizations (RFMOs), the Commission should be given an unequivocal negotiating mandate for all RFMOs for promoting marine conservation and sustainable fisheries;
51	Considers that any system of attributing fishing opportunities to countries within RFMOs must include the legitimate rights and aspirations of developing states to develop their own fisheries; insists that the EU oppose the introduction of Transferable Fishing Concessions schemes in RFMOs, since they would jeopardise the both the livelihood and the well-being of dependent communities in developing countries;
52	Maintains that the Union’s development policy should be carried out within the framework of the obligation agreed in the United Nations and other organisations and competent international bodies, and that the contribution of fishing to development should be made within the framework of the principles and objectives of the Union’s external action and should contribute towards the main aim of Union development policy, which is to reduce and ultimately eradicate poverty in developing countries;
