88	Draws attention to the plight of whistleblowers and their supporters, including journalists following their revelations; calls on the Commission to conduct an examination as to whether a future legislative proposal establishing an effective and comprehensive European whistleblower protection programme, as already requested in Parliament’s resolution of 23 October 2013, should also include other fields of Union competence, with particular attention to the complexity of whistleblowing in the field of intelligence; calls on the Member States to thoroughly examine the possibility of granting whistleblowers international protection from prosecution;
89	Calls on the Member States to ensure that their legislation, notably in the field of national security, provides a safe alternative to silence for disclosing or reporting of wrongdoing, including corruption, criminal offences, breaches of legal obligation, miscarriages of justice and abuse of authority, which is also in line with the provisions of different international (UN and Council of Europe) instruments against corruption, the principles laid out in the PACE Resolution 1729 (2010), the Tshwane principles, etc.;
90	Points out that recent incidents clearly demonstrate the acute vulnerability of the EU, and in particular the EU institutions, national governments and parliaments, major European companies, European IT infrastructures and networks, to sophisticated attacks using complex software and malware; notes that these attacks require financial and human resources on a scale such that they are likely to originate from state entities acting on behalf of foreign governments; in this context, regards the case of the hacking or tapping of the telecommunications company Belgacom as a worrying example of an attack on the EU’s IT capacity; underlines that boosting EU IT capacity and security also reduces the vulnerability of the EU towards serious cyberattacks originating from large criminal organisations or terrorist groups;
91	Takes the view that the mass surveillance revelations that have initiated this crisis can be used as an opportunity for Europe to take the initiative and build up, as a strategic priority measure, a strong and autonomous IT key-resource capability; stresses that in order to regain trust, such a European IT capability should be based, as much as possible, on open standards and open-source software and if possible hardware, making the whole supply chain from processor design to application layer transparent and reviewable; points out that in order to regain competitiveness in the strategic sector of IT services, a ‘digital new deal’ is needed, with joint and large-scale efforts by EU institutions, Member States, research institutions, industry and civil society; calls on the Commission and the Member States to use public procurement as leverage to support such resource capability in the EU by making EU security and privacy standards a key requirement in the public procurement of IT goods and services; urges the Commission, therefore, to review the current public procurement practices with regard to data processing in order to consider restricting tender procedures to certified companies, and possibly to EU companies, where security or other vital interests are involved;
92	Strongly condemns the fact that intelligence services sought to lower IT security standards and to install backdoors in a wide range of IT systems; asks the Commission to present draft legislation to ban the use of backdoors by law enforcement agencies; recommends, consequently, the use of open-source software in all environments where IT security is a concern;
93	Calls on all the Member States, the Commission, the Council and the European Council to give their fullest support, including through funding in the field of research and development, to the development of European innovative and technological capability in IT tools, companies and providers (hardware, software, services and network), including for purposes of cybersecurity and encryption and cryptographic capabilities; calls on all responsible EU institutions and Member States to invest in EU local and independent technologies, and to develop massively and increase detection capabilities;
94	Calls on the Commission, standardisation bodies and ENISA to develop, by December 2014, minimum security and privacy standards and guidelines for IT systems, networks and services, including cloud computing services, in order to better protect EU citizens' personal data and the integrity of all IT systems; believes that such standards could become the benchmark for new global standards and should be set in an open and democratic process, rather than being driven by a single country, entity or multinational company; takes the view that, while legitimate law enforcement and intelligence concerns need to be taken into account in order to support the fight against terrorism, they should not lead to a general undermining of the dependability of all IT systems; expresses support for the recent decisions by the Internet Engineering Task Force (IETF) to include governments in the threat model for internet security;
95	Points out that EU and national telecom regulators, and in certain cases also telecom companies, have clearly neglected the IT security of their users and clients; calls on the Commission to make full use of its existing powers under the ePrivacy and Telecommunication Framework Directive to strengthen the protection of confidentiality of communication by adopting measures to ensure that terminal equipment is compatible with the right of users to control and protect their personal data, and to ensure a high level of security of telecommunication networks and services, including by way of requiring state-of-the-art end-to-end encryption of communications;
96	Supports the EU cyber strategy, but considers that it does not cover all possible threats and should be extended to cover malicious state behaviour; underlines the need for more robust IT security and resilience of IT systems;
97	Calls on the Commission, by January 2015 at the latest, to present an Action Plan to develop greater EU independence in the IT sector, including a more coherent approach to boosting European IT technological capabilities (including IT systems, equipment, services, cloud computing, encryption and anonymisation) and to the protection of critical IT infrastructure (including in terms of ownership and vulnerability);
98	Calls on the Commission, in the framework of the next Work Programme of the Horizon 2020 Programme, to direct more resources towards boosting European research, development, innovation and training in the field of IT, in particular privacy-enhancing technologies and infrastructures, cryptology, secure computing, the best possible security solutions including open-source security, and other information society services, and also to promote the internal market in European software, hardware, and encrypted means of communication and communication infrastructures, including by developing a comprehensive EU industrial strategy for the IT industry; considers that small and medium enterprises play a particular role in research; stresses that no EU funding should be granted to projects having the sole purpose of developing tools for gaining illegal access into IT systems;
99	Asks the Commission to map out current responsibilities and to review, by December 2014 at the latest, the need for a broader mandate, better coordination and/or additional resources and technical capabilities for ENISA, Europol’s Cyber Crime Centre and other Union centres of specialised expertise, CERT-EU and the EDPS, in order to enable them to play a key role in securing European communication systems, be more effective in preventing and investigating major IT breaches in the EU and performing (or assisting Member States and EU bodies to perform) on-site technical investigations regarding major IT breaches; in particular, calls on the Commission to consider strengthening ENISA's role in defending the internal systems within the EU institutions and to establish within ENISA's structure a Computer Emergency Response Team (CERT) for the EU and its Member States;
100	Requests the Commission to assess the need for an EU IT Academy that brings together the best independent European and international experts in all related fields, tasked with providing all relevant EU institutions and bodies with scientific advice on IT technologies, including security-related strategies;
101	Calls on the competent services of the Secretariat of the European Parliament, under the responsibility of the President of Parliament, to carry out, by June 2015 at the latest with an intermediate report by December 2014 at the latest, a thorough review and assessment of Parliament’s IT security dependability, focused on: budgetary means, staff resources, technical capabilities, internal organisation and all relevant elements, in order to achieve a high level of security for Parliament’s IT systems; believes that such an assessment should at the least provide information, analysis and recommendations on:
102	Calls for all the EU institutions and agencies to perform a similar exercise in cooperation with ENISA, Europol and the CERTs, by June 2015 at the latest with an intermediate report by December 2014, in particular the European Council, the Council, the European External Action Service (including EU delegations), the Commission, the Court of Justice and the European Central Bank; invites the Member States to conduct similar assessments;
103	Stresses that as far as the external action of the EU is concerned, assessments of related budgetary needs should be carried out and first measures taken without delay in the case of the European External Action Service (EEAS) and that appropriate funds need to be allocated in the 2015 draft budget;
104	Takes the view that the large-scale IT systems used in the area of freedom, security and justice, such as the Schengen Information System II, the Visa Information System, Eurodac and possible future systems such as EU-ESTA, should be developed and operated in such a way as to ensure that data are not compromised as a result of requests by authorities from third countries; asks eu-LISA to report back to Parliament on the reliability of the systems in place by the end of 2014;
105	Calls on the Commission and the EEAS to take action at the international level, with the UN in particular, and in cooperation with interested partners to implement an EU strategy for democratic governance of the internet in order to prevent undue influence over ICANN’s and IANA’s activities by any individual entity, company or country by ensuring appropriate representation of all interested parties in these bodies, while avoiding the facilitation of state control or censorship or the balkanisation and fragmentation of the internet;
106	Calls for the EU to take the lead in reshaping the architecture and governance of the internet in order to address the risks related to data flows and storage, striving for more data minimisation and transparency and less centralised mass storage of raw data, as well as for rerouting of Internet traffic or full end-to-end encryption of all Internet traffic so as to avoid the current risks associated with unnecessary routing of traffic through the territory of countries that do not meet basic standards on fundamental rights, data protection and privacy;
107	Calls for the promotion of:
108	Calls on the Commission to present a legal proposal for an EU routing system including the processing of call detail records (CDRs) at EU level that will be a substructure of the existing internet and will not extend beyond EU borders; notes that all routing data and CDRs should be processed in accordance with EU legal frameworks;
109	Calls on the Member States, in cooperation with ENISA, Europol's CyberCrime Centre, CERTs and national data protection authorities and cybercrime units, to develop a culture of security and to launch an education and awareness-raising campaign in order to enable citizens to make a more informed choice regarding what personal data to put on-line and how better to protect them, including through encryption and safe cloud computing, making full use of the public interest information platform provided for in the Universal Service Directive;
110	Calls on the Commission, by December 2014, to put forward legislative proposals to encourage software and hardware manufacturers to introduce more security and privacy by design and by default features in their products, including by introducing disincentives for the undue and disproportionate collection of mass personal data and legal liability on the part of manufacturers for unpatched known vulnerabilities, faulty or insecure products or the installation of secret backdoors enabling unauthorised access to and processing of data; in this respect, calls on the Commission to evaluate the possibility of setting up a certification or validation scheme for IT hardware including testing procedures at EU level to ensure the integrity and security of the products;
111	Believes that, beyond the need for legislative change, the inquiry has shown the need for the US to restore trust with its EU partners, as it is the US intelligence agencies’ activities that are primarily at stake;
112	Points out that the crisis of confidence generated extends to:
113	Recalls the important historical and strategic partnership between the EU Member States and the US, based on a common belief in democracy, the rule of law and fundamental rights;
114	Believes that the mass surveillance of citizens and the spying on political leaders by the US have caused serious damage to relations between the EU and the US and negatively impacted on trust in US organisations acting in the EU; this is further exacerbated by the lack of judicial and administrative remedies for redress under US law for EU citizens, particularly in cases of surveillance activities for intelligence purposes;
115	Recognises, in light of the global challenges facing the EU and the US, that the transatlantic partnership needs to be further strengthened, and that it is vital that transatlantic cooperation in counter-terrorism continues on a new basis of trust based on true common respect for the rule of law and the rejection of all indiscriminate practices of mass surveillance; insists, therefore, that clear measures need to be taken by the US to re-establish trust and re-emphasise the shared basic values underlying the partnership;
116	Is ready to engage in a dialogue with US counterparts so that, in the ongoing American public and congressional debate on reforming surveillance and reviewing intelligence oversight, the right to privacy and other rights of EU citizens, residents or other persons protected by EU law and equivalent information rights and privacy protection in US courts, including legal redress, are guaranteed through, for example, a revision of the Privacy Act and the Electronic Communications Privacy Act and by ratifying the First Optional Protocol to the International Covenant on Civil and Political Rights (ICCPR), so that the current discrimination is not perpetuated;
117	Insists that necessary reforms be undertaken and effective guarantees be given to Europeans to ensure that the use of surveillance and data processing for foreign intelligence purposes is proportional, limited by clearly specified conditions, and related to reasonable suspicion and probable cause of terrorist activity; stresses that this purpose must be subject to transparent judicial oversight;
118	Considers that clear political signals are needed from our American partners to demonstrate that the US distinguishes between allies and adversaries;
119	Urges the Commission and the US Administration to address, in the context of the ongoing negotiations on an EU-US Umbrella Agreement on data transfer for law enforcement purposes, the information and judicial redress rights of EU citizens, and to conclude these negotiations, in line with the commitment made at the EU-US Justice and Home Affairs Ministerial Meeting of 18 November 2013, before summer 2014;
120	Encourages the US to accede to the Council of Europe’s Convention for the Protection of Individuals with regard to Automatic Processing of Personal Data (Convention 108), as it acceded to the 2001 Convention on Cybercrime, thus strengthening the shared legal basis between the transatlantic allies;
121	Calls on the EU institutions to explore the possibilities for establishing with the US a code of conduct which would guarantee that no US espionage is pursued against EU institutions and facilities;
122	Also believes that the involvement and activities of EU Member States have led to a loss of trust, including among Member States and between EU citizens and their national authorities; is of the opinion that only full clarity as to purposes and means of surveillance, public debate and, ultimately, revision of legislation, including an end to mass surveillance activities and strengthening the system of judicial and parliamentary oversight, will it be possible to re-establish the trust lost; reiterates the difficulties involved in developing comprehensive EU security policies with such mass surveillance activities in operation, and stresses that the EU principle of sincere cooperation requires that Member States refrain from conducting intelligence activities in other Member States' territory;
123	Notes that some Member States are pursuing bilateral communication with the US authorities on spying allegations, and that some of them have concluded (the UK) or envisage concluding (Germany, France) so-called ‘anti-spying’ arrangements; stresses that these Member States need to observe fully the interests and the legislative framework of the EU as a whole; deems such bilateral arrangements to be counterproductive and irrelevant, given the need for a European approach to this problem; asks the Council to inform Parliament on developments by Member States on an EU-wide mutual no-spy arrangement;
124	Considers that such arrangements should not breach the Union Treaties, especially the principle of sincere cooperation (under Article 4(3) TEU), or undermine EU policies in general and, more specifically, the internal market, fair competition, and economic, industrial and social development; decides to review any such arrangements for their compatibility with European law, and reserves the right to activate Treaty procedures in the event of such arrangements being proven to contradict the Union's cohesion or the fundamental principles on which it is based;
125	Calls on the Member States to make every effort to ensure better cooperation with a view to providing safeguards against espionage, in cooperation with the relevant EU bodies and agencies, for the protection of EU citizens and institutions, European companies, EU industry, and IT infrastructure and networks, as well as European research; considers the active involvement of EU stakeholders to be a precondition for an effective exchange of information; points out that security threats have become more international, diffuse and complex, thereby requiring an enhanced European cooperation; believes that this development should be better reflected in the Treaties, and therefore calls for a revision of the Treaties in order to reinforce the notion of sincere cooperation between the Member States and the Union as regards the objective of achieving an area of security and to prevent mutual espionage between Member States within the Union;
126	Considers tap-proof communication structures (email and telecommunications, including landlines and cell phones) and tap-proof meeting rooms within all relevant EU institutions and EU delegations to be absolutely necessary; therefore calls for the establishment of an encrypted internal EU email system;
127	Calls on the Council and Commission to consent without further delay to the proposal adopted by the European Parliament on 23 May 2012 for a regulation of the European Parliament on the detailed provisions governing the exercise of the European Parliament's right of inquiry and repealing Decision 95/167/EC, Euratom, ECSC of the European Parliament, the Council and the Commission presented on the basis of Article 226 TFEU; calls for a revision of the Treaty in order to extend such inquiry powers to cover, without restrictions or exceptions, all fields of Union competence or activity and to include the possibility of questioning under oath;
128	Calls on the Commission to present, by January 2015 at the latest, an EU strategy for democratic governance of the internet;
129	Calls on the Member States to follow the call of the 35th International Conference of Data Protection and Privacy Commissioners ‘to advocate the adoption of an additional protocol to Article17 of the International Covenant on Civil and Political Rights (ICCPR), which should be based on the standards that have been developed and endorsed by the International Conference and the provisions in the Human Rights Committee General Comment No 16 to the Covenant in order to create globally applicable standards for data protection and the protection of privacy in accordance with the rule of law’; calls on the Member States to include in this exercise a call for an international UN agency to be in charge of, in particular, monitoring the emergence of surveillance tools and regulating and investigating their uses; asks the High Representative/Vice-President of the Commission and the European External Action Service to take a proactive stance;
130	Calls on the Member States to develop a coherent and strong strategy within the UN, supporting in particular the resolution on ‘the right to privacy in the digital age’ initiated by Brazil and Germany, as adopted by the Third Committee of the UN General Assembly Committee (Human Rights Committee) on 27 November 2013, as well as taking further action for the defence of the fundamental right to privacy and data protection at an international level while avoiding any facilitation of state control or censorship or the fragmentation of the internet, including an initiative for an international treaty prohibiting mass surveillance activities and an agency for its oversight;
131	Decides to submit to EU citizens, institutions and Member States the above-mentioned recommendations as a Priority Plan for the next legislature; calls on the Commission and the other EU institutions, bodies, offices and agencies referred to in this resolution, in accordance with Article 265 TFEU, to act upon the recommendations and calls as contained in this resolution;
132	Decides to launch ‘A European Digital Habeas Corpus - protecting fundamental rights in a digital age’ with the following 8 actions, the implementation of which it will oversee:
133	Calls on the EU institutions and the Member States to promote the ‘European Digital Habeas Corpus’ protecting fundamental rights in a digital age; undertakes to act as the EU citizens’ rights advocate, with the following timetable to monitor implementation:
134	Instructs its President to forward this resolution to the European Council, the Council, the Commission, the parliaments and governments of the Member States, the national data protection authorities, the EDPS, eu-LISA, ENISA, the Fundamental Rights Agency, the Article 29 Working Party, the Council of Europe, the Congress of the United States of America, the US Administration, the President, Government and Parliament of the Federative Republic of Brazil, and the UN Secretary-General;
135	Instructs its Committee on Civil Liberties, Justice and Home Affairs to address Parliament in plenary on the matter a year after the adoption of this resolution; considers it essential to assess the extent to which the recommendations adopted by Parliament have been followed and to analyse any instances where such recommendations have not been followed;
