32	Welcomes, in this regard, the remarks made and the Presidential Policy Directive issued by US President Obama on 17 January 2014, as a step towards limiting authorisation of the use of surveillance and data processing to national security purposes and towards equal treatment of all individuals' personal information, regardless of their nationality or residence, by the US intelligence community; awaits, however, in the context of the EU-US relationship, further specific steps which will, most importantly, strengthen trust in transatlantic data transfers and provide for binding guarantees for enforceable privacy rights of EU citizens, as outlined in detail in this report;
33	Stresses its serious concerns in relation to the work within the Council of Europe's Cybercrime Convention Committee on the interpretation of Article 32 of the Convention on Cybercrime of 23 November 2001 (Budapest Convention) on transborder access to stored computer data with consent or where publicly available, and opposes any conclusion of an additional protocol or guidance intended to broaden the scope of this provision beyond the current regime established by this Convention, which is already a major exception to the principle of territoriality because it could result in unfettered remote access by law enforcement authorities to servers and computers located in other jurisdictions without recourse to MLA agreements and other instruments of judicial cooperation put in place to guarantee the fundamental rights of the individual, including data protection and due process, and in particular Council of Europe Convention 108;
34	Calls on the Commission to carry out, before July 2014, an assessment of the applicability of Regulation (EC) No 2271/96 to cases of conflict of laws on transfers of personal data;
35	Calls on the Fundamental Rights Agency to undertake in-depth research on the protection of fundamental rights in the context of surveillance, and in particular on the current legal situation of EU citizens with regard to the judicial remedies available to them in relation to those practices;
36	Notes that the companies identified by media revelations as being involved in the large-scale mass surveillance of EU data subjects by the US NSA are companies that have self-certified their adherence to the Safe Harbour, and that the Safe Harbour is the legal instrument used for the transfer of EU personal data to the US (examples being Google, Microsoft, Yahoo!, Facebook, Apple and LinkedIn); expresses its concerns that these organisations have not encrypted information and communications flowing between their data centres, thereby enabling intelligence services to intercept information; welcomes the subsequent statements by some US companies that they will accelerate plans to implement encryption of data flows between their global data centres;
37	Considers that large-scale access by US intelligence agencies to EU personal data processed by Safe Harbour does not meet the criteria for derogation under ‘national security’;
38	Takes the view that, as under the current circumstances the Safe Harbour principles do not provide adequate protection for EU citizens, these transfers should be carried out under other instruments, such as contractual clauses or BCRs, provided these instruments set out specific safeguards and protections and are not circumvented by other legal frameworks;
39	Takes the view that the Commission has failed to act to remedy the well-known deficiencies of the current implementation of Safe Harbour;
40	Calls on the Commission to present measures providing for the immediate suspension of Commission Decision 2000/520/EC, which declared the adequacy of the Safe Harbour privacy principles, and of the related FAQs issued by the US Department of Commerce; calls on the US authorities, therefore, to put forward a proposal for a new framework for transfers of personal data from the EU to the US which meets Union law data protection requirements and provides for the required adequate level of protection;
41	Calls on Member States’ competent authorities, in particular the data protection authorities, to make use of their existing powers and immediately suspend data flows to any organisation that has self-certified its adherence to the US Safe Harbour Principles, and to require that such data flows are only carried out under other instruments and provided they contain the necessary safeguards and guarantees with respect to the protection of the privacy and fundamental rights and freedoms of individuals;
42	Calls on the Commission to present, by December 2014, a comprehensive assessment of the US privacy framework covering commercial, law enforcement and intelligence activities, and concrete recommendations based on the absence of a general data protection law in the US; encourages the Commission to engage with the US administration in order to establish a legal framework providing for a high level of protection of individuals with regard to the protection of their personal data when transferred to the US and ensure the equivalence of EU and US privacy frameworks;
43	Recalls that Directive 95/46/EC stipulates that transfers of personal data to a third country may take place only if, without prejudice to compliance with the national provisions adopted pursuant to the other provisions of the Directive, the third country in question ensures an adequate level of protection, the purpose of this provision being to ensure the continuity of the protection afforded by EU data protection law where personal data are transferred outside the EU;
44	Recalls that Directive 95/46/EC also provides that the adequacy of the level of protection afforded by a third country is to be assessed in the light of all the circumstances surrounding a data transfer operation or set of such operations; recalls likewise that the said Directive also equips the Commission with implementing powers to declare that a third country ensures an adequate level of protection in the light of the criteria laid down by Directive 95/46/EC; recalls that Directive 95/46/EC also empowers the Commission to declare that a third country does not ensure an adequate level of protection;
45	Recalls that in the latter case Member States must take the measures necessary to prevent any transfer of data of the same type to the third country in question, and that the Commission should enter into negotiations with a view to remedying the situation;
46	Calls on the Commission and the Member States to assess without delay whether the adequate level of protection of the New Zealand Privacy Act and of the Canadian Personal Information Protection and Electronic Documents Act, as declared by Commission Decisions 2013/65/EU and 2002/2/EU, has been affected by the involvement of those countries’ national intelligence agencies in the mass surveillance of EU citizens, and, if necessary, to take appropriate measures to suspend or reverse the adequacy decisions; also calls on the Commission to assess the situation for other countries that have received an adequacy rating; expects the Commission to report to Parliament on its findings on the above-mentioned countries by December 2014 at the latest;
47	Recalls that national data protection authorities have indicated that neither standard contractual clauses nor BCRs were formulated with situations of access to personal data for mass surveillance purposes in mind, and that such access would not be in line with the derogation clauses of the contractual clauses or BCRs which refer to exceptional derogations for a legitimate interest in a democratic society and where necessary and proportionate;
48	Calls on the Member States to prohibit or suspend data flows to third countries based on the standard contractual clauses, contractual clauses or BCRs authorised by the national competent authorities where it is likely that the law to which data recipients are subject imposes requirements on them which go beyond the restrictions that are strictly necessary, adequate and proportionate in a democratic society and are likely to have an adverse effect on the guarantees provided by the applicable data protection law and the standard contractual clauses, or because continuing transfer would create a risk of grave harm to the data subjects;
49	Calls on the Article 29 Working Party to issue guidelines and recommendations on the safeguards and protections that contractual instruments for international transfers of EU personal data should contain in order to ensure the protection of the privacy, fundamental rights and freedoms of individuals, taking particular account of the third-country laws on intelligence and national security and the involvement of the companies receiving the data in a third country in mass surveillance activities by a third country’s intelligence agencies;
50	Calls on the Commission to examine without delay the standard contractual clauses it has established in order to assess whether they provide the necessary protection as regards access to personal data transferred under the clauses for intelligence purposes and, if appropriate, to review them;
51	Calls on the Commission to conduct, before the end of 2014, an in-depth assessment of the existing Mutual Legal Assistance Agreement, pursuant to its Article 17, in order to verify its practical implementation and, in particular, whether the US has made effective use of it for obtaining information or evidence in the EU and whether the Agreement has been circumvented to acquire the information directly in the EU, and to assess the impact on the fundamental rights of individuals; such an assessment should not only refer to US official statements as a sufficient basis for the analysis but also be based on specific EU evaluations; this in-depth review should also address the consequences of the application of the Union’s constitutional architecture to this instrument in order to bring it into line with Union law, taking account in particular of Protocol 36 and Article 10 thereof and Declaration 50 concerning this protocol; calls on the Council and Commission also to assess bilateral agreements between Member States and the US so as to ensure that they are consistent with the agreements that the EU follows or decides to follow with the US;
52	Asks the Council and Commission to inform Parliament about the actual use by Member States of the Convention on Mutual Assistance in Criminal Matters between the Member States, in particular its Title III on interception of telecommunications; calls on the Commission to put forward a proposal, in accordance with Declaration 50, concerning Protocol 36, as requested, before the end of 2014 in order to adapt it to the Lisbon Treaty framework;
53	Takes the view that the information provided by the European Commission and the US Treasury does not clarify whether US intelligence agencies have access to SWIFT financial messages in the EU by intercepting SWIFT networks or banks’ operating systems or communication networks, alone or in cooperation with EU national intelligence agencies and without having recourse to existing bilateral channels for mutual legal assistance and judicial cooperation;
54	Reiterates its resolution of 23 October 2013 and asks the Commission for the suspension of the TFTP Agreement;
55	Calls on the Commission to react to concerns that three of the major computerised reservation systems used by airlines worldwide are based in the US and that PNR data are saved in cloud systems operating on US soil under US law, which lacks data protection adequacy;
56	Considers that a satisfactory solution under the ‘Umbrella agreement’ is a precondition for the full restoration of trust between the transatlantic partners;
57	Asks for an immediate resumption of the negotiations with the US on the 'Umbrella Agreement', which should put rights for EU citizens on an equal footing with rights for US citizens; stresses that, moreover, this agreement should provide effective and enforceable administrative and judicial remedies for all EU citizens in the US without any discrimination;
58	Asks the Commission and Council not to initiate any new sectorial agreements or arrangements for the transfer of personal data for law enforcement purposes with the US as long as the 'Umbrella Agreement' has not entered into force;
59	Urges the Commission to report in detail on the various points of the negotiating mandate and the latest state of play by April 2014;
60	Calls on the Council Presidency and the Member States to accelerate their work on the whole Data Protection Package to allow for its adoption in 2014, so that EU citizens will be able to enjoy a high level of data protection in the very near future; stresses that strong engagement and full support on the part of the Council are a necessary condition to demonstrate credibility and assertiveness towards third countries;
61	Stresses that both the Data Protection Regulation and the Data Protection Directive are necessary to protect the fundamental rights of individuals, and that the two must therefore be treated as a package to be adopted simultaneously, in order to ensure that all data-processing activities in the EU provide a high level of protection in all circumstances; stresses that it will only adopt further law enforcement cooperation measures once the Council has entered into negotiations with Parliament and the Commission on the Data Protection Package;
62	Recalls that the concepts of 'privacy by design' and 'privacy by default' are a strengthening of data protection and should have the status of guidelines for all products, services and systems offered on the internet;
63	Considers higher transparency and safety standards for online and telecommunication as a necessary principle with a view to a better data protection regime; calls, therefore, on the Commission to put forward a legislative proposal on standardised general terms and conditions for online and telecommunications services, and to mandate a supervisory body to monitor compliance with the general terms and conditions;
64	Notes that trust in US cloud computing and cloud providers has been negatively affected by the above-mentioned practices; emphasises, therefore, the development of European clouds and IT solutions as an essential element for growth and employment and for trust in cloud computing services and providers, as well as for ensuring a high level of personal data protection;
65	Calls on all public bodies in the Union not to use cloud services where non-EU laws might apply;
66	Reiterates its serious concern regarding the compulsory direct disclosure of EU personal data and information processed under cloud agreements to third-country authorities by cloud providers subject to third-country laws or using storage servers located in third countries, as also regarding direct remote access to personal data and information processed by third-country law enforcement authorities and intelligence services;
67	Deplores the fact that such access is usually attained by means of direct enforcement by third-country authorities of their own legal rules, without recourse to international instruments established for legal cooperation such as mutual legal assistance (MLA) agreements or other forms of judicial cooperation;
68	Calls on the Commission and the Member States to speed up the work of establishing a European Cloud Partnership while fully including civil society and the technical community, such as the Internet Engineering Task Force (IETF), and incorporating data protection aspects;
69	Urges the Commission, when negotiating international agreements that involve the processing of personal data, to take particular note of the risks and challenges that cloud computing poses to fundamental rights, in particular – but not exclusively – the right to private life and to the protection of personal data, as enshrined in Articles 7 and 8 of the Charter of Fundamental Rights of the European Union; urges the Commission, furthermore, to take note of the negotiating partner's domestic rules governing the access of law enforcement and intelligence agencies to personal data processed through cloud computing services, in particular by demanding that such access be granted only if there is full respect for due process of law and on an unambiguous legal basis, as well as the requirement that the exact conditions of access, the purpose of gaining such access, the security measures put in place when handing over data and the rights of the individual, as well as the rules for supervision and for an effective redress mechanism, be specified;
70	Recalls that all companies providing services in the EU must, without exception, comply with EU law and are liable for any breaches, and underlines the importance of having effective, proportionate and dissuasive administrative sanctions in place that can be imposed on 'cloud computing' service providers who do not comply with EU data protection standards;
71	Calls on the Commission and the competent authorities of the Member States to evaluate the extent to which EU rules on privacy and data protection have been violated through the cooperation of EU legal entities with secret services or through the acceptance of court warrants of third-country authorities requesting personal data of EU citizens contrary to EU data protection legislation;
72	Calls on businesses providing new services using ‘Big Data’ and new applications such as the ’Internet of Things’ to build in data protection measures already at the development stage, in order to maintain a high level of trust among citizens;
73	Recognises that the EU and the US are pursuing negotiations for a Transatlantic Trade and Investment Partnership, which is of major strategic importance for creating further economic growth;
74	Strongly emphasises, given the importance of the digital economy in the relationship and in the cause of rebuilding EU-US trust, that the consent of the European Parliament to the final TTIP agreement could be endangered as long as the blanket mass surveillance activities and the interception of communications in EU institutions and diplomatic representations are not completely abandoned and an adequate solution is found for the data privacy rights of EU citizens, including administrative and judicial redress; stresses that Parliament may only consent to the final TTIP agreement provided the agreement fully respects, inter alia, the fundamental rights recognised by the EU Charter, and provided the protection of the privacy of individuals in relation to the processing and dissemination of personal data remain governed by Article XIV of the GATS; stresses that EU data protection legislation cannot be deemed an ‘arbitrary or unjustifiable discrimination’ in the application of Article XIV of the GATS;
75	Stresses that, despite the fact that oversight of intelligence services’ activities should be based on both democratic legitimacy (strong legal framework, ex ante authorisation and ex post verification) and adequate technical capability and expertise, the majority of current EU and US oversight bodies dramatically lack both, in particular the technical capabilities;
76	Calls, as it did in the case of Echelon, on all national parliaments which have not yet done so to install meaningful oversight of intelligence activities by parliamentarians or expert bodies with legal powers to investigate; calls on the national parliaments to ensure that such oversight committees/bodies have sufficient resources, technical expertise and legal means, including the right to conduct on-site visits, to be able to effectively control intelligence services;
77	Calls for the setting up of a Group of Members and experts to examine, in a transparent manner and in collaboration with national parliaments, recommendations for enhanced democratic oversight, including parliamentary oversight, of intelligence services and increased oversight collaboration in the EU, in particular as regards its cross-border dimension; considers that the group should examine, in particular, the possibility of minimum European standards or guidelines for the (ex ante and ex post) oversight of intelligence services on the basis of existing best practices and recommendations by international bodies (UN, Council of Europe), including the issue of oversight bodies being considered as a third party under the ‘third party rule’, or the principle of ’originator control’, on the oversight and accountability of intelligence from foreign countries, criteria on enhanced transparency, built on the general principle of access to information and the so-called ‘Tshwane Principles’(43), as well as principles regarding the limits on the duration and scope of any surveillance ensuring that they are proportionate and limited to its purpose;
78	Calls on this Group to prepare a report for and to assist in the preparation of a conference to be held by Parliament with national oversight bodies, whether parliamentary or independent, by the beginning of 2015;
79	Calls on the Member States to draw on best practices so as to improve access by their oversight bodies to information on intelligence activities (including classified information and information from other services) and establish the power to conduct on-site visits, a robust set of powers of interrogation, adequate resources and technical expertise, strict independence vis-à-vis their respective governments, and a reporting obligation to their respective parliaments;
80	Calls on the Member States to develop cooperation among oversight bodies, in particular within the European Network of National Intelligence Reviewers (ENNIR);
81	Urges the HR/VP to regularly account for the activities of the EU Intelligence Analysis Centre (IntCen), which is part of the European External Action Service, to the responsible bodies of Parliament, including its full compliance with fundamental rights and applicable EU data privacy rules, allowing for improved oversight by Parliament of the external dimension of EU policies; urges the Commission and the HR/VP to present a proposal for a legal basis for the activities of IntCen, should any operations or future competences in the area of intelligence or data collection facilities of its own be envisaged which may have an impact on the EU’s internal security strategy;
82	Calls on the Commission to present, by December 2014, a proposal for an EU security clearance procedure for all EU office holders, as the current system, which relies on the security clearance undertaken by the Member State of citizenship, provides for different requirements and lengths of procedures within national systems, thus leading to differing treatment of Members of Parliament and their staff depending on their nationality;
83	Recalls the provisions of the interinstitutional agreement between the European Parliament and the Council concerning the forwarding to and handling by Parliament of classified information held by the Council on matters other than those in the area of the common foreign and security policy, which should be used to improve oversight at EU level;
84	Calls on the Europol Joint Supervisory Body, together with national data protection authorities, to conduct a joint inspection before the end of 2014 in order to ascertain whether information and personal data shared with Europol have been lawfully acquired by national authorities, particularly if the information or data were initially acquired by intelligence services in the EU or a third country, and whether appropriate measures are in place to prevent the use and further dissemination of such information or data; considers that Europol should not process any information or data which were obtained in violation of fundamental rights which would be protected under the Charter of Fundamental Rights;
85	Calls on Europol to make full use of its mandate to request the competent authorities of the Member States to initiate criminal investigations with regards to major cyberattacks and IT breaches with potential cross-border impact; believes that Europol's mandate should be enhanced in order to allow it to initiate its own investigation following suspicion of a malicious attack on the network and information systems of two or more Member States or Union bodies(44); calls on the Commission to review the activities of Europol's European Cybercrime Centre (EC3) and, if necessary, put forward a proposal for a comprehensive framework for strengthening its competences;
86	Expresses its deep concern at the mounting threats to the freedom of the press and the chilling effect on journalists of intimidation by state authorities, in particular as regards the protection of confidentiality of journalistic sources; reiterates the calls expressed in its resolution of 21 May 2013 on ‘the EU Charter: standard settings for media freedom across the EU’;
87	Takes note of the detention of David Miranda and the seizure of the material in his possession by the UK authorities under Schedule 7 of the Terrorism Act 2000 (and also the request made to the Guardian newspaper to destroy or hand over the material) and expresses its concern that this constitutes a possible serious interference with the right of freedom of expression and media freedom as recognised by Article 10 of the ECHR and Article 11 of the EU Charter and that legislation intended to fight terrorism could be misused in such instances;
