A	whereas too many obstacles, resulting from a lack of information about rights and opportunities, fragmented regulation, a lack of legislative initiatives in a number of key areas, poor transposition, inadequate application and enforcement of rules, and a lack of administrative coordination and cooperation, stand in the way of citizens, consumers and SMEs wishing to move, shop, sell or trade across borders with the same sense of security and confidence they enjoy in their own Member States,
B	whereas, at the same time, efforts to harmonise legislation in order to overcome these obstacles have sometimes led to over-regulation, from which the majority of SMEs, in particular the micro-entities that do not wish to operate on the European market but prefer to remain active locally, as well as local government bodies, have experienced adverse effects, so that better regulation is called for with a minimum of administrative burdens,
C	whereas only a small percentage of workers, service providers and professionals take the step of moving to another Member State, inter alia because the red tape involved and the risk of losing social security rights make it too complicated and costly to do so,
D	whereas few entrepreneurs and SMEs offer their goods and services outside their domestic markets, owing to language barriers, lack of certainty regarding investments, payments and liability, and to differences in the legal, administrative, social and cultural traditions of the different Member States,
E	whereas the single market must not be seen in isolation from other horizontal policy areas, particularly health, social and consumer protection, labour law, the environment, sustainable development and external policies,
F	whereas the EU 2020 Strategy should set realistic targets for achieving a green, knowledge-based, social market economy and sustainable growth by 2020, as well as to create jobs, including in the environmental sector; whereas the cornerstone of the EU 2020 Strategy should be the single European market, with the challenges of social justice and economic growth and a focus on benefits to citizens, consumer protection and SMEs,
G	whereas, increasingly, single market and international trade issues are interdependent and affect each other,
H	whereas many European citizens are not aware of the practical benefits they themselves derive from the single market, as too little information on the single market is available and it is not explained properly,
1	Considers that the Union is facing a particularly problematic time in the history of single European market integration; takes the view that the current and future challenges must be addressed with coherence, determination, commitment and strength, necessarily coupled with sensitivity and practicality, in a spirit of cooperation and solidarity; emphasises that this process will necessitate firm authority and considerable initiative on the part of the European Commission, and political commitment from the Council, the Member States and the European Parliament;
2	Emphasises that the single market is not only an economic structure, and single market legislation protects and preserves specific fundamental rights of citizens, such as security and privacy, and that for this reason a smoothly functioning single market is in the best interests of European citizens, consumers and SMEs, given the many economic and other challenges that the EU currently faces;
3	Stresses that, notwithstanding the economic, technological and legislative weaknesses in its structure, the single European market, along with the eurozone, best illustrates the true meaning of EU economic integration and unity, and is certainly the most visible achievement of European integration for EU citizens;
4	Emphasises that the single market should open new horizons in the research and innovation sector, doing more to promote the development of goods and services, with an emphasis on knowledge and technology, which constitute a driving force for future economic development;
5	Welcomes and fully supports the Commission's intention to ‘put back at the heart of the internal market those who live in it and use it daily’ as well as its commitment to be a determined defender of the single market through full use of its enforcement powers and to come up with a social and environmental vision of the single market based on the Lisbon Treaty obligations;
6	Emphasises that integration into the single market is not an irreversible process and that the continued existence of the single market should not be taken for granted;
7	Expresses its concern that the re-emergence of economic protectionism at national level would most probably result in fragmentation of the single market and therefore needs to be avoided; is concerned that the current economic and financial crisis could be used to justify reviving protectionist measures in various Member States, whereas the downturn calls for common safeguard mechanisms instead;
8	Considers that the crisis has substantially damaged the single market integration process and that antagonism towards, and distrust of, the single market have increased as a result of shortcomings and inequalities emanating from Member States' economic systems;
9	Recalls that policies to tackle the crisis should not detract from the single market integration process, but rather provide a window of opportunity for reforming, consolidating and improving the current structure of the single market, releasing the job creation potential of a green economy and regaining the trust and confidence of citizens, especially consumers and SMEs;
10	Stresses that the relaunch of the single market must not be wholly dictated by the recent financial downturn and that the revival must go beyond the fundamental lessons learned from the crisis;
11	Underlines that the relaunch of the single market should achieve concrete, measurable, achievable, relevant and timed targets, which must be achieved by proper and effective policy instruments based on the four freedoms of movement that are available to all EU citizens;
12	Highlights the fact that the single European market is in dire need of a new momentum, and that strong leadership from European institutions, especially the Commission, and political ownership by the Member States is required to restore credibility and confidence in the single market;
13	Takes the view that the old perception of the single market should be supplemented in order to make it more inclusive; stresses that all those involved in shaping and implementing the single market need to adopt a more holistic approach, fully integrating citizens' concerns;
14	Emphasises that a stronger, deeper and expanded single market is of vital importance for growth and job creation;
15	Stresses that the single market should be central in achieving the goal of a sustainable and highly competitive social market economy in the context of the EU 2020 Strategy's long-term vision;
16	Believes that the single market is a very important prerequisite for the success of the EU 2020 strategy; proposes therefore that any strategy and policies to revitalise the single European market should be coordinated by the European institutions and based on a pragmatic, comprehensive and wide-ranging deal supported by all the Member States and focusing mainly on priorities for which the Member States will truly take ownership and which they will implement effectively at national, regional and local level;
17	Emphasises that the single market should provide benefits for consumers in terms of better quality, greater variety, reasonable prices, and safety of goods and services;
18	Calls for a new paradigm of political thinking, focusing on citizens, consumers and SMEs in the relaunch of the European single market; holds the view that this can be achieved by putting European citizen at the heart of European Union policy making;
19	Maintains that revitalisation of the single market requires effective implementation of more adequate checks and balances, and more dialogue,  in order to guarantee that the needs of citizens and consumers are adequately taken into account; considers that an evidence-based and citizen-based approach will help the Union to win back popular confidence in the single European market and to find the right formula for the adoption of initiatives to give the Union the competitive edge it needs, without prejudice to the social dimension;
20	Reiterates that meaningful assessment of the social, consumer, environmental and economic impacts of the single market – which should feature in all single market proposals – is crucial to gaining public confidence and will also ensure the realistic integration of social, consumer-protection, environmental and economic goals;
21	Believes that the abolition of borders in the single market has further boosted the competitiveness of Europe in a globalised world;
22	Emphasises that the proper functioning of the internal market cannot be dissociated from the role Europe must play as a global economic actor; takes the view that the European Union must protect its social and environmental model by strictly enforcing its rules on imported products and services and firmly upholding the application of those rules, including in the context of multilateral bodies, and of World Trade Organisation dispute settlement procedures in particular;
23	Stresses that the internal market and the common currency have acted as a protective shield in Europe, reducing the negative impact of the financial crisis on businesses and citizens in Europe;
24	Takes the view that the major challenge facing the Union is to find a balance between an open economy, capable of stimulating economic growth and job creation and providing an integrated response to the major challenges of the future (such as competitiveness, research and development, industrial policy, demographic issues, the environment and new technologies), and an economic system which is equally up to the task of delivering consumer protection and the social and environmental safeguards that citizens need;
25	Emphasises that implementation of the single market rules remains uneven, since market networks are not sufficiently interlinked, which means that enterprises and citizens have to face the daily reality of continuing difficulties in their cross-border activities, which may involve 27 different legal systems for a single transaction;
26	Highlights the importance of establishing a green single market for emerging low-carbon and environmental technologies, services and products by developing EU-wide standards for carbon emissions; points out that clear standards and labelling for energy-efficient products must become, progressively, mandatory throughout the Union; notes that existing methodologies and standards should be taken into account when developing new standards for carbon footprints; emphasises that such standards must not create overly burdensome requirements, particularly for SMEs;
27	Urges that, in the digital era, the Union must fully realise the potential and opportunities offered by the internet and e-commerce and the diffusion of ICT in SMEs and public administration for the further development of the single market, making it available to all EU citizens; emphasises that the development of new technologies must take into account the need to protect citizens, consumers and SMEs and those in the most vulnerable positions;
28	Stresses the importance of establishing new business models where right holders of copyright and related rights are properly remunerated without creating unnecessary limitations on access to creative content online for consumers;
29	Endorses initiatives taken by the Commission to prioritise research, knowledge and innovation in any future strategy; expects that sufficient funds will be allocated in successive Union budgets in order to address these crucial matters; recalls, in this context, the urgent need to resolve the outstanding issue of the Community patent; proposes that the Commission start to examine possible ways of finding concrete benchmarks in order to measure success in the areas of research, knowledge and innovation;
30	Endorses the Commission's efforts to promote the safety of manufactured goods via the entry into force of Regulation (EC) No 765/2008 of the European Parliament and of the Council of 9 July 2008 setting out the requirements for accreditation and market surveillance relating to the marketing of products;
31	Is convinced that the European citizen's perception, understanding and knowledge of the single market are low, non-existent, confused or even negative, in part because of a lack of political commitment and information and a low level of public awareness; takes the view that decisive action must be taken to ensure that future European Union policy on the single market addresses the needs of citizens, especially consumers and SMEs, and provides them with tangible results;
32	Emphasises that, in order to secure the social and economic backing and cooperation of European citizens, the EU and its Member States must intensively promote the possibilities that result from European economic integration, and change popular perceptions of the single market by making people aware of and able to understand the benefits it offers them and the ways of effectively claiming their rights; believes, therefore, that it is important that sectors which have a direct impact on the daily lives of citizens and consumers' needs should be at the centre of the single market;
33	Considers that some of the most obvious problems encountered by consumers, especially in the services sector, which need to be acted upon as a  priority in order to achieve quick results are: (1) access to safe products and quality services; (2) access to reliable, comparable and objective information, including price comparisons; (3) greater legal security and clarity in contractual relations; (4) greater payment security; (5) access to adequate, affordable and effective systems of redress, and (6) improved knowledge of, and greater confidence in, the system;
34	Maintains that citizens are not being given enough information on single market legislation and the availability and enforcement of their rights; highlights the need to organise the relevant websites, SOLVIT and contact points more effectively; believes that better coordination and communication of such initiatives is needed, since they have so far failed to reach their target audience;  underlines the role of the Commission's ‘Your Europe’ portal in informing both citizens and businesses on aspects of living, working and business opportunities in the European Union; proposes that existing offers be strengthened rather than new points of contact being created;
35	Believes that a responsible approach by the business world, with respect for the principle of corporate responsibility, the rules of competition and consumers' economic interests, will help inspire confidence in consumers, the least that is required if consumer protection is to be enhanced;
36	Maintains that economic integration initiatives will take off better if citizens are convinced that their social rights are being safeguarded and that internal market policies will have a positive impact on social policies;
37	Deplores the fact that only a small percentage of citizens, consumers and SMEs are aware of existing alternative redress mechanisms, or know how to register a complaint with the Commission; points out that existing problem-solving systems for citizens and businesses such as SOLVIT need to be strengthened in accordance with Parliament's report on SOLVIT of 2 March 2010 (
38	Stresses the major role consumer associations play in circulating information to consumers about their rights, supporting consumers in consumer disputes, and promoting consumer interests in the construction of the internal market;
39	Affirms that SMEs form an essential part of the backbone of the European economy and are the main drivers of job creation, of economic growth, of the shift towards a green economy and  of social cohesion in Europe; contends that the active participation of SMEs in an enlarged EU is imperative in making the single market more innovative and competitive, and emphasises that greater efforts must be made to improve access for SMEs to the single market, to facilitate their development and to enable them to take full advantage of their entrepreneurial potential;
40	Considers that more of the obstacles which prevent SMEs from accessing public procurement markets should be removed in order to boost competitiveness in the single market, specifically by simplifying the requirements for SMEs in calls for tender by contracting authorities;
41	Encourages future joint initiatives by the Commission and the Member States to: (1) support small businesses operating across borders throughout the EU; (2) effect a tangible reduction in administrative, financial and regulatory burdens, particularly the administrative hurdles faced by SMEs, irrespective of whether they operate locally, nationally or at European level, in accordance with the principle of proportionality; in this regard calls on the Member States and the Commission strictly to implement and apply the Think Small First principle as outlined in the Small Business Act;
42	Asks the Commission to step up its efforts to help SMEs bridge the linguistic gap which often prevents them from doing business in Member States other than their own, by offering all information, and services, on the single market in all the official European Union languages;
43	Remains committed to reducing gold plating in new single market legislation, and asks the Member States, and in particular their parliaments, to remain committed to the fight against golden plating when transposing EU legislation, as these extra burdens are particularly taxing for SMEs;
44	Agrees that proper implementation of the Small Business Act - in particular regarding a strict application of the SME test by the Commission when proposing new legislative internal market measures and the introduction of a European private company statute will guarantee the practical integration of SMEs into a relevant and viable single European system;
45	Supports strongly the regulation governing translation requirements for the future EU patent, which will finally make the EU patent a reality and reinforce Europe as a driving force of innovation and competition in the world; further supports the review of the Community Trade Mark system to achieve higher quality and better prospects for this system;
46	Points out that the greatest problem for SMEs in times of economic crisis is their access to finance; considers it regrettable that as a result of the withdrawal of large banks from rural and under populated or economically weak areas a major problem for SMEs has emerged as regards access to finance; welcomes the important role of savings banks and various cooperative movements in financing the regional economy, as well as their contribution to the social market economy in the form of their promotion of ethical and social projects;
47	Agrees that the notification procedure introduced by Directive 98/34/EC is a very efficient tool for improving national legislation, on the one hand, and for avoiding barriers in the single market, particularly for SMEs, on the other; believes that the Commission should reinforce the mechanism by starting a fast-track infringement procedure if a Member State does not comply with a detailed opinion issued by the Commission or does not react to a detailed opinion issued by a Member State,
48	Believes that different economic and social policies such as budget, tax, education and research policies must be coordinated at EU level;
49	Asserts that, under the principle of subsidiarity, a substantial part of the administrative and legal responsibility for the single market lies in the hands of the Member States and, where appropriate, of their regional and local authorities, which, together with other EU institutions, must therefore take real ownership of the single European market and its management;
50	Contends that the Internal Market Scoreboards and the Consumer Market Scoreboards reveal clearly that Member States are still failing to meet their objectives for transposing, applying and enforcing single market legislation correctly and that there is a delay of transposition of European laws, which undermines the level playing field that is essential for a properly functioning internal market, notably in the services sector;
51	Notes that a gradual fragmentation of rules and inconsistencies in the implementation of legislation in the EU are proving increasingly detrimental to the completion of the single market; notes that the EU has yet to adopt a set of internally coherent policies designed to remove direct and indirect obstacles to the proper functioning of the internal market;
52	Welcomes the Commission initiative for ‘better regulation’ which reinforces the effectiveness of rules and their proper application by the Member States; urges the Commission to maintain its momentum here, as rapid implementation of this strategy would significantly contribute to the successful re-launch of the single market;
53	Takes note of the new concept of ‘smart regulation’, as introduced in the Commission's communication on EU2020;
54	Proposes that, with a view to the improved transposition, application and enforcement of single market legislation, the Commission forge a partnership among all the stakeholders involved in shaping, implementing and enforcing such legislation, using new mechanisms such as the proposed annual single market forum;
55	Invites the Commission to ensure proper implementation and transposition through more systematic, independent monitoring in order to speed up and expedite infringement proceedings; contends that delays in the settlement of infringement proceedings will have an adverse effect on citizens' interests in the single market;
56	Asks the Commission to develop new ways, other than formal infringement procedures, to improve the transposition and enforcement of single market rules; in this context, asks it to consider innovative mechanisms, such as the mutual evaluation procedure envisaged in the Services Directive, to encourage peer review and Member State ownership, and to improve informal problem-solving mechanisms such as SOLVIT and EU-PILOT, which would be of significant benefit to citizens who face frustrations in the single market on a daily basis;
57	Calls on the Commission to pay greater attention to the systematic evaluation and simplification of existing single market legislation, cutting red tape wherever feasible, which will benefit citizens and enterprises alike;
58	Urges the Commission to ensure proper coordination and to work in collaboration with Parliament and the Member States, as well as major trading partners and business and consumer associations, in surveillance of the goods market and in cross-border enforcement of consumer protection law, and to inform European consumers and citizens more effectively;
59	Recommends that the Commission conduct an independent exercise to identify the top 20 single-market-related sources of dissatisfaction and frustration which citizens encounter every day, in particular on the labour market, in relation to e-commerce, cross-border medical care, vehicle purchase and hire, portability of pensions, mutual recognition of professional qualifications, child custody, adoption and maintenance and allowances;
60	Calls on the Commission to push for the creation of a better mechanism for reviewing how single market rules apply in practice at all levels in the various Member States, and how citizens and businesses are empowered to exercise their single market rights;
61	Asks the Commission to give more assistance to Member States and, where appropriate, to their regional and local authorities so as to facilitate proper compliance with EU standards; stresses that the EU institutions as a whole must tighten the rules and encourage Member States to improve the transposition of laws in a correct and timely manner, in order to ensure that the same rules apply throughout the Union;
62	Calls for the strengthening of Parliament's role in the areas of application, enforcement and monitoring of single market legislation; considers that the enhanced role for the EP and the national parliaments under the Lisbon Treaty must entail better synergism between the two parliamentary levels;
63	Calls on the Member States to ensure better coordination and exchange of best practices in the single market, particularly through the internal market information system and training of single market and consumer protection specialists at national, regional and local level;
64	Insists that the Commission ensure: independent scrutiny of regulatory proposals for their quality; the adoption of ex-ante and ex-post mechanisms for verifying the effectiveness of legislation; the use of benchmarking against international best practice; the use of conformity assessments to gauge social environmental and economic impact at both EU and national level;
65	Calls on the Commission and the Member States to develop a targeted communication strategy focusing on the day-to-day problems that citizens encounter when settling and taking up employment in another Member State, especially when undertaking cross-border transactions moving, shopping or selling across borders, and the social, health, consumer-protection and environmental-protection standards on which they can rely; considers that this communication strategy should expressly include problem-solving methods such as SOLVIT;
