A	whereas the employment and social consequences of the crisis are far-reaching, and are now exacerbated by the impact of fiscal consolidation introduced in certain countries in response to the sovereign debt crisis and a constricted monetary policy in the eurozone, which contrasts with that implemented by other major economic regions and is unable to give an effective response to the sovereign debt crisis and promote growth; whereas the crisis is having negative effects on the quality and quantity of social investments in Europe; whereas the eurozone is in recession and the EU is currently the only major region in the world where unemployment is still rising;
B	whereas in 2012 the employment situation has worsened and the prospects for 2013 are pessimistic; whereas labour market segmentation has continued to rise, long-term unemployment has reached alarming levels, in-work poverty is still a major problem, average household incomes are declining in many Member States and indicators point to a trend of higher levels and deeper forms of poverty and social exclusion, with in-work poverty and social polarisation on the rise in many Member States.
C	whereas unemployment has increased significantly since 2008 and reached the level of 25 million unemployed people in the EU, corresponding to 10,5 % of the working age population; whereas, over the last twelve months alone, the number of unemployed people has increased by 2 million; whereas the decline in employment has been more pronounced in those countries which are undertaking more substantial fiscal consolidation;
D	whereas the labour market situation is particularly critical for young people, regardless of their level of education, who often end up with precarious employment contracts and in unpaid traineeships; whereas the difficult situation of young people is partly due to mismatches between acquired skills and labour market demand, limited geographic mobility, early school leaving without qualifications, a lack of relevant skills and work experience, precarious employment conditions, limited training opportunities, and inefficient active labour market policies;
E	whereas across the EU more than one in five young people are unemployed (22,8 %), with youth unemployment exceeding 50 % in some Member States; whereas more than 7 million Europeans under 25 are not in employment, education or training (NEET); whereas these figures are continuing to rise and there is a risk of a lost generation; whereas the cost of inaction with regard to NEETs is estimated at EUR 153 billion across the EU;
F	whereas after the European Council meeting of 30 January 2012, as part of its ‘Youth Opportunities Initiative’, the Commission called on Member States to develop and implement comprehensive initiatives for youth employment, education and skills, and to develop youth jobs plans within their national reform programmes; whereas, however, such initiatives have yet to be brought forward in most Member States;
G	whereas people approaching pension age, long-term unemployed workers, non-EU workers and low-skilled workers are also among those worst hit by the crisis;
H	whereas the necessary reforms should be carried out to guarantee the sustainability of pension systems; whereas, in this connection, it is possible to raise the actual retirement age without raising the mandatory retirement age, by reducing the number of people leaving the labour market early; whereas, in order to successfully increase actual retirement ages, reforms in pension systems need to be accompanied by policies that develop employment opportunities for older workers' access to life-long learning, introduce tax benefit policies giving incentives to stay longer at work and support active healthy ageing;
I	whereas long-term unemployment reached alarming levels in the second quarter of 2012, when the figures showed that 11,1 million unemployed Europeans had been unemployed for more than 12 months, accounting for 4,6 % of the active population; whereas the probability of unemployed people finding a job has decreased in most Member States, especially those subject to significant fiscal consolidation measures;
J	whereas approximately 120 million people are threatened by social exclusion in the EU27 because they are at an aggravated risk of poverty, are severely materially deprived or living in households with very low work participation,
K	whereas social protection expenditure has decreased in nearly all Member States and whereas the Social Protection Committee (SPC) warns of increasing numbers of people at risk of income poverty, child poverty, severe material deprivation and social exclusion because of the impact of fiscal consolidation measures;
L	whereas achieving growth and a high level of employment is necessary to the recovery of the economy, to fiscal consolidation and to the sustainability of the welfare state and public finances in the long term;
M	whereas targeted social investments should form a major part of Member States' response to the crisis as they are key to reaching the employment, social and education objectives of the Europe 2020 strategy;
N	whereas the European Council stated on 30 January 2012 that ‘growth and employment will only resume if we pursue a consistent and broad-based approach, combining a smart fiscal consolidation preserving investment in future growth, sound macroeconomic policies and an active employment strategy preserving social cohesion’;
O	whereas fiscal consolidation must continue in view of the high debt levels and long-term challenges to public finances, but with due account being taken of the fact that it must be a medium- to long-term objective; whereas fiscal consolidation can have negative growth and employment effects in the short term, especially in countries in recession or with marginal growth rates, compromising future growth and job-creation potential; whereas fiscal consolidation must therefore be managed in a growth-friendly manner so that it does not damage the growth and job-creation potential of the economy or its social fabric;
P	whereas tensions in financial markets remain high and imbalances in access to financing prevail between Member States; whereas high premium risks unduly increase sovereign debt burdens, requiring heavier fiscal consolidation, deepening the crisis and thus hampering growth and job creation;
Q	whereas, in spite of the urgency of the situation, the European Union is failing to achieve almost all of the Europe 2020 targets, and progress in Member States in delivering on the Europe 2020 objectives has been disappointing; whereas commitments set in the National Reform Programmes 2012 are insufficient to meet most of the EU-level targets;
R	whereas investment in education and training, research and innovation – key areas for economic growth and job creation – is still lower in the EU than in its main economic partners and competitors elsewhere in the world; whereas productive investment in these areas is essential for a sustainable exit from the crisis but also for consolidating the EU economy on a path of competitiveness and productivity;
S	whereas the gender dimension is crucial to achieving the EU 2020 headline targets, as women form the greatest reserve of as yet unused labour force; whereas women form the majority of those living in poverty in the EU; whereas cuts to public services such as child care and other dependants' care will have a negative impact on women and consequently their ability to participate in the labour market; whereas specific attention needs to be paid therefore to gender mainstreaming and specific policies targeted at women throughout the European Semester process; whereas the legal retirement age of women needs to be aligned to that of men;
T	whereas there is a need to ensure greater interaction between employment, social and economic policies in the context of the European Semester, as set out in Articles 121 and 148 TFEU;
U	whereas it is essential to foster democratic accountability, ownership and legitimacy of all actors involved in the European Semester; whereas an essential part of this is the appropriate involvement of the European Parliament;
V	whereas the national parliaments are the representatives and guarantors of the rights acquired and delegated by citizens; whereas the introduction of the European Semester should fully respect the prerogatives of national parliaments;
1	Urges the European Council to ensure that the following messages form part of its policy guidance for the European Semester 2013, and mandates its President to defend this position during the Spring European Council of 14-15 March 2013; refers, in particular, to the specific recommendations to be adopted by the European Council in its policy guidance, annexed to this resolution;
2	Deplores the fact that priorities identified during last year's European Semester cycle, in particular those relating to job creation, job quality and the fight against poverty and social exclusion have not given the expected results;
3	Points out that the economic situation and the social consequences of the crisis have further deteriorated during the last year and therefore stresses the importance of stepping up the Member States' commitment to following the 2013 policy guidance, in particular in the employment and social policy area;
I	Europe 2020 objectives
4	Calls on the European Council to ensure that the yearly policy guidance set out on the basis of the AGS is fully focused on fulfilling all the objectives of the Europe 2020 Strategy for smart, sustainable and inclusive growth; regrets that no Europe 2020 progress report was included in the AGS 2013, calls on the Commission to deliver this report in time for the Spring European Council meeting;
5	Deplores the fact that the 2012 policy guidance and its implementation have not been sufficiently effective as regards the attainment of the political targets enshrined in the Europe 2020 strategy; deplores the fact that some Member States are moving further away from the 2020 targets;
6	Deplores the fact that the commitments set in the National Reform Programmes 2012 are insufficient to meet most of the EU-level targets; stresses its concern about the fact that the current national targets are not sufficient to achieve the Europe 2020 headline targets for employment, education and poverty reduction;
7	Calls on the Member States to adopt the necessary commitments in the 2013 National Reform Programmes towards the fulfilment of the Europe 2020 objectives;
8	Calls on the European Council to ensure, in its policy guidelines, that a sufficient level of EU funds is devoted to the achievement of the Europe 2020 objectives; urges Member States to earmark funds more effectively for the achievement of the Europe 2020 Strategy's objectives;
II	Job creation through structural reforms and growth-targeted investments
9	Considers it regrettable that last year most Member States did not respect their commitment to submit a National Job Plan (NJP) as part of their 2012 NRPs; calls on the Member States to respect this commitment in 2013; stresses that NJPs should include comprehensive measures for job creation and green employment, a link between employment policies and financial instruments, labour market reforms, a clear timetable for rolling out the multiannual reform agenda over the next 12 months and an indication of both the fields and regions experiencing specialisation shortages and surpluses;
10	Regrets that the Commission has not made NJPs a mandatory requirement and calls on the Commission to oversee their preparation during each year's European Semester cycle;
11	Calls on the Member States to adopt measures favourable to job creation such as labour tax reforms that encourage employment, promote and support genuine and voluntary self-employment and business start-ups, improve the framework for doing business and facilitate the access to financing for SMEs, transform informal and undeclared work into regular employment, reform labour markets, if necessary, to make them more adaptive, dynamic, competitive and inclusive while ensuring adequate security for employees, provide employers and employees with skills and instruments that enable them to adapt to changing labour markets needs, modernise wage-setting systems - within the framework of social dialogue with the active participation of the social partners, while respecting the diversity of national models of industrial relations - to align wages with productivity trends within the boundaries of decent living wages, and exploit the high employment potential of sectors such as the green economy, health and social care, and the ICT sector to create sustainable and quality jobs;
III	Youth employment
12	Calls on the European Council to make youth unemployment a priority in the 2013 policy guidance;
13	Calls on the Member States to take decisive measures to fight youth unemployment, including targeted active labour-market policy measures, measures tackling skills mismatches in the labour market, in particular by preventing early drop-out from school or apprenticeship schemes and ensuring that education and training systems provide young people with the relevant skills in an efficient way, and promote entrepreneurship and effective business development support for young people and frameworks securing the transition from education to work;
14	Strongly supports the Commission's proposal on Youth Guarantee Schemes; calls for its speedy implementation and for sufficient funding to be provided for it; considers that the ESF should play a key role in funding Youth Guarantee Schemes and that an appropriate balance should be sought between EU and Member State funding;
15	Urges Member States to develop comprehensive strategies for young people who are not in employment, education or training (NEET); urges them also, in developing these strategies, to show financial solidarity with Member States with limited fiscal space;
IV	More adaptive, dynamic and inclusive labour markets and better-quality employment
16	Regrets that the 2013 AGS does not address the quality of jobs and that too little attention is paid to putting in place the necessary preconditions for increasing labour market participation, notably that of women, workers aged 45 +, people with disabilities and the most deprived;
17	Recalls that the internal imbalances between Member States, especially in employment and social indicators, is widening; points out that Member States with relatively unsegmented labour markets, strong welfare systems and an ability to temporarily adjust working hours, working time and other flexible working arrangements (internal flexibility) and efficient collective bargaining models have proved more resilient in the face of the employment and social consequences of the crisis;
18	Calls for labour markets to be more adaptive and dynamic, able to adjust to disruptions in the economic situation without causing redundancies, and more inclusive, favouring an increased labour participation, specially for those vulnerable and disadvantaged people;
19	Warns that austerity measures should not compromise the quality of employment, nor social protection and health and safety standards; encourages Member states to promote the identification of companies and SMEs making an effort to be more socially virtuous than meeting their minimum legal obligations;
V	Investing in education and training
20	Underlines the key role of education and training in achieving the Europe 2020 Strategy objectives;
21	Underlines the importance of reducing the early school leaving rate in order to decrease numbers in the NEET group;
22	Calls on the Member States, while pursuing sustainable, growth-friendly and differentiated fiscal consolidation, to secure efficient and sufficient investment in education, training and lifelong learning in order to meet all the commitments agreed in the Europe 2020 Strategy;
23	Calls on the Member States to incorporate the European exchange programmes for education, training, youth and sports into measures taken in the framework of the European Semester;
VI	Guaranteeing the quality of public services and combating poverty and social exclusion
24	Is deeply concerned about the increase in poverty and unemployment among all age groups since the last 2012 European Semester cycle;
25	Welcomes the fact that the 2013 AGS addresses poverty and social exclusion, as well as tackling the social consequences of the crisis; calls on the Commission to stress these measures in the country-specific recommendations and, in particular, to address in-work poverty, poverty among people with limited or no links to the labour market and poverty among elderly people; calls on the European Council to endorse this guidance as a priority;
26	Calls for the implementation of integrated active inclusion strategies to be a central element of EU and national social policy agendas;
VII	Pursuing proportionate and differentiated growth- friendly fiscal consolidation while ensuring economic recovery and job creation
27	Acknowledges the need to implement proportionate and differentiated growth-friendly fiscal consolidation to avoid negative short-, medium- and long-term growth and employment effects while guaranteeing the sustainability of public finances; stresses that the impact of fiscal consolidation programmes should be evaluated on the basis of their short-term effects on growth, employment and social inclusion, especially in countries in recession or with marginal growth rates; calls on the Commission and the European Council to make use of the flexibility in times of economic downturn that Regulations (EU) No 1175/2011 and (EU) No 1177/2011 provide for;
28	Emphasises that the Commission should take greater account of specific local, regional and national trends, as well as potential errors in its forecast, which represents the basis for the AGS;
29	Considers that fiscal consolidation should be implemented in a proportionate and growth-friendly way and that the rhythm of consolidation should be differentiated across countries according to their fiscal space and that of the broader European economy, in order to avoid negative growth and negative employment effects while ensuring debt sustainability;
30	Calls on the Commission to recalibrate its models on the impact of the multiplier effect on growth and job creation of fiscal cuts on the budgets of Member States in line with recent IMF revisions;
31	Calls on the European Council to ensure coherence between the different priorities in its policy guidance, so as not to compromise sustainable growth and job-creation potential, increase poverty and social exclusion, or prevent universal access to the provision of quality public services; believes that the main priority must be to put into place integrated reform measures and investments that promote growth and job creation whilst guaranteeing the sustainability of public finances;
32	Calls on the European Council, should it endorse the first priority of the AGS, ‘differentiated growth-friendly fiscal consolidation’, to specifically explain how this can be implemented in full compliance with the aim of increasing social cohesion and combating poverty, as outlined in its fourth priority, ‘tackling unemployment and the social consequences of the crisis’;
33	Stresses the need to attain full coherence between budgetary consolidation and economic measures on the one hand and social policy, growth and employment measures on the other.
34	Points out that, at a time of heavy fiscal constraint and reduced lending capacity in the private sector, the Structural Funds and the Cohesion Fund, with their financial size and the objectives pursued, represent an essential lever, at the Member States' disposal, to stimulate the economy and help deliver the growth and employment objectives enshrined in the Europe 2020 Strategy; in this connection, stresses that, in view of the key role played by cohesion policy in the development of national programmes within the framework of the European Semester, this policy should be a prime focus of the AGS and should contribute to the annual debate on growth and jobs in the EU;
35	Is concerned at the fact that the European Parliament, national parliaments, social partners and civil society continue to play a limited role in the European Semester; highlights the fact that policy guidance in the AGS initiated by the Commission, and to be endorsed by the European Council, lacks parliamentary and civil involvement and therefore democratic legitimacy;
36	Maintains that Parliament has a crucial role to play in establishing the necessary democratic legitimacy; considers that, in the absence of a legal basis for the ordinary legislative procedure applicable to the AGS, the European Council should take into account parliamentary comments when endorsing the policy guidance in order to guarantee democratic legitimacy;
37	Asks the Commission to require Member States to guarantee maximum transparency in the elaboration of NRP as well as a wide involvement of national parliaments and social partners in this process;
38	Recalls that strengthening job-rich growth calls for employment policies that generate favourable conditions for job creation, facilitate positive transitions from job to job and from unemployment to employment, increase the labour supply and improve its geographic and skills matching with labour market needs.
39	Stresses the need for reforms in the labour market to increase labour productivity and efficiency in order to improve EU economic competitiveness and enable sustainable growth and job creation while strictly respecting both the letter and the spirit of the European Social Aquis and its principles; believes that reforms in labour markets should be implemented in such a way as to promote job quality;
40	Suggests that Member States reduce taxation on labour when fiscal conditions allow, especially with regard to low-paid and low-skilled workers and vulnerable groups; considers that well targeted temporary reductions in social security contributions or job subsidy schemes for new recruits, especially for the low-skilled and long-term unemployed, are very effective incentives to promote job creation;
41	Notes that demographic change has a clear impact on the provision of social infrastructure, posing a serious challenge to all generations throughout the EU; stresses, in this connection, that the role of cohesion policies in tackling demographic challenges should be given more consideration in the Commission's survey;
42	Stresses the need to carry out the necessary reforms to guarantee the sustainability of pension systems; believes that retirement age could be evaluated on the basis of the evolution of healthy life expectancy, but recalls that it is possible to raise the actual retirement age without raising the mandatory retirement age by reducing the number of people leaving the labour market early; believes that to successfully raise effective retirement ages, reforms in pension systems need to be accompanied by policies that limit the access to early retirement schemes and other early exit pathways, develop employment opportunities for older workers, guarantee access to life-long learning, introduce tax benefit policies giving incentives to stay longer at work, and support active healthy ageing;
43	Calls on the Commission to work with the Member States to ensure that austerity programmes do not hinder employment creation measures and growth-promoting policies, and do not compromise social protection; urges Member States to prioritise growth-friendly expenditure such as education, lifelong learning, research, innovation and energy efficiency, and at the same time to ensure the efficiency of this spending;
44	Agrees with the Commission that innovative EU financial instruments can serve as catalysts for targeted investment, achieve a multiplier effect on the EU budget and increase the EU's growth potential; urges the Commission, therefore, to provide detailed information, further assistance and guidance to the Member States and regions regarding enhanced application of financial instruments under the cohesion policy in 2013 and the future programming period (2014-2020); calls on the Member States to follow the Commission and also to indicate clearly in their respective national reform programmes how they intend to use Structural Fund allocations to promote growth- and employment-enhancing priorities with the use of financial instruments;
45	Welcomes the attention given to exploitation of the job-creation potential of key sectors such as innovative industries, services, the green economy, health and social care (the ‘white sector’), and the ICT sector in the AGS priorities for 2013; calls on the Commission and the Member States to support initiatives that facilitate the development of these sectors with high employment potential;
46	Recalls that the full exploitation of the job creation potential of these new sectors will call for adaptation, especially of lower skilled and older workers, and new skills; calls on the Commission and the Member States to anticipate skill needs in these sectors and guarantee the necessary investments in education and training to provide those skills;
