36	Considers that the cooperation instruments should be defined precisely, taking account of available instruments and programmes and focusing particularly on education and academic exchange; calls for additional financial resources to be provided for implementation of the EaP and support for reforms, flagship initiatives and projects; calls for the full participation of all six EaP partner countries in Union programmes;
37	Stresses that respect for the rule of law, including the establishment of an independent and efficient judiciary, and deterrence of corruption in both private and public sectors are essential for the protection of democratic values;
38	Underlines that corruption is still widespread in the EaP countries and is an important issue that needs to be addressed;
39	Recognises the effects of the economic crisis on the economic development of the Eastern Partnership countries; highlights the importance of fostering economic cooperation in order to move the EaP project forward, inter alia by raising awareness of the complexity of the economic problems, promoting good governance in the financial sector and cooperation with international financial institutions, adopting a sectoral approach, and encouraging legislation conducive to the development of the SME sector; highlights the need for the conclusion and provisional application of DCFTAs as the main tools for modernising the economies of the EaP countries and enabling recovery from the financial crisis;
40	Calls for greater efforts to strengthen the business dimension of the Eastern Partnership, including through improving the business environment in partner countries to the benefit of local, regional and European SMEs and businesses and promoting business partnerships between the EU and the EaP;
41	Considers, furthermore, that promoting joint activities with other strategic partners and cooperation in international and European organisations would be beneficial to all concerned;
42	Emphasises the need to promote social and cultural ties, thus putting the EU motto ‘united in diversity’ into practice;
43	Highlights the importance of information and cultural exchange between the EaP countries and the EU for the purposes of building contemporary, well-informed societies and promoting European values;
44	Highlights the fact that the European Endowment for Democracy (EED) has an important role to play in EaP countries by strengthening, in a rapid, effective and flexible way, civil society and promoting the rule of law and respect for human rights, and by supporting or developing pro-democracy movements in countries which have not yet made the transition to democracy or which are in the process of doing so; invites the Commission, the EEAS and the Member States to support the work of the EED, and make full use of the potential for cooperation and synergies; urges the EU and its Member States, in this context, to ensure that appropriate and stable funding is made available for the activities of the EED;
45	Considers that, in order to improve cooperation among the Eastern Partners, the EU should refrain from imposing a restriction to one language in joint projects, and should promote multilingualism, notably in local government, civic and educational initiatives;
46	Highlights the importance of promoting and supporting joint efforts in research and innovation, including exchange programmes for students, in virtual multilingual projects, in dialogue between cultures through joint film productions and joint resources for literary translations, in joint research on the legacy of Nazism and Communism and of totalitarian regimes and on common history in Europe, inter alia through the ‘Europe for citizens’ programme and by promoting cooperation with the Platform of European Memory and Conscience;
47	Calls for the gradual development of a Common Knowledge and Innovation Space, in order to pull together several existing strands of cooperation in research and innovation;
48	Encourages further regulatory approximation in all areas of transport and in implementing transport infrastructure projects, across the Eastern Partnership transport network through existing EU programmes and instruments, while also seeking closer involvement of European and international financial institutions and prioritising projects that improve connections with the TEN-T core network;
49	Calls for understanding that the EaP is an ambitious programme whose results may become more obvious in the long-term perspective; stresses that, while the EaP is being widely criticised, the success of the initiative is dependent on the engagement and political will of both the EU and its Eastern neighbours; further notes that it is essential that any criticism of the EaP should be constructive in character and should be targeted on improving it rather than discrediting it;
50	Instructs its President to forward this resolution to the Council, the Commission, the Vice-President of the Commission / High Representative of the Union for Foreign Affairs and Security Policy, the European External Action Service, the Committee of the Regions, the governments and parliaments of the EaP countries, the OSCE and the Council of Europe.
