53	Believes that the Union should contribute to development in the sphere of fisheries by supporting the principle of surplus fishing stocks and other rules laid down in UNCLOS as well as the application of the FAO Guidelines for responsible fisheries and the FAO Compliance Agreement on the conservation and management of fisheries resources at global level;
54	Emphasises that the objectives of fisheries policy must be implemented on a basis of transparency and coherence with other Union objectives, and that their impact on development must be planned, measured and assessed, and regularly and systematically subjected to democratic control;
55	Wishes to make it clear that fisheries cooperation agreements and the fisheries-related aspects of development cooperation agreements and EU trade agreements should contribute towards making fishing a socially, economically and environmentally sustainable activity for the EU and its partners;
56	Regrets the fact that a substantial proportion of the objectives of the FPAs have not been achieved; regrets in particular the poor results attained in the fields of scientific and technological cooperation and support for the sustainable development of the fishing industry (and allied industries) in developing countries; believes these aspects can be improved through coherent policies and governance of international fishery activity;
57	Stresses that the EU must ensure that the current reform of the Common Fisheries Policy is mainstreamed with its commitment towards developing countries to support the achievement of the Millennium Development Goals as well as the basic human right to food as recognised in the Universal Declaration of Human Rights;
58	Calls on the Commission to ensure that its external action in general, and the FPAs in particular, promote good governance and transparency and create the conditions for developing third countries to base their fisheries policies on the same guidelines and sustainability standards as the Common Fisheries Policy, including: the adoption of decisions based on scientific reports and impact studies and the drafting of multiannual plans allowing exploitation proportionate to the maximum sustainable yield of stocks; special support for small-scale fishing and aquaculture activities and the communities which depend on them; promotion of selective fishing and adaptation of fleet capacity to resources and more responsible fishing practices; the gradual reduction and ultimate elimination of discards; efforts to combat illegal, unreported and unregulated fishing; improvements to safety and welfare conditions at work; protection of biodiversity and the environment and measures to combat climate change; product quality and better marketing; and promotion of research and innovation in order to increase the sustainability of activities in the sphere of fisheries, aquaculture and associated industries;
59	Stresses that the agreements and the industries which develop around them are contributing to the development of third countries and their future ability to exploit their own resources;
60	Maintains firmly that, in their relations with third countries and their actions within international organisations, the Union and its Member States must contribute to building the capacities of societies and governments of developing countries to draw up, implement and monitor sustainable fisheries policies which increase their food security and contribute to their development;
61	Advocates the joint formulation of models with objectives, actions and indicators with the aim of monitoring the use of the funds more effectively in a spirit of partnership; stresses that this monitoring must include the adoption of corrective procedures, to be agreed on with the third country, whenever a deviation of one of the parties from the objectives is observed;
62	Welcomes the example of transparency that the EU has set in a global context by publishing the conditions of its FPAs; urges the Commission to continue its openness by ensuring that the evaluations of these agreements are also publically available, respecting the principles of the Aarhus convention, for the purpose of enabling local parliaments, civil society and other stakeholders to effectively scrutinise the implementation and impact of the agreements;
63	Draws attention to the importance of the existence of transparent and up-to-date scientific data on fish stocks, on all fisheries agreements including those of the EU, and on total fishing effort in each country’s waters; considers that scientific assessment should precede the signature of agreements or at least that the agreements should contribute to the examination of data;
64	Draws attention to the problem of illegal, unregistered and undeclared (IUU) fishing; recalls that many vessels do not duly report their catches and are not inspected, that the data supplied by vessels are not checked and that the species caught are not clearly identified; considers that the EU can and must make a more effective contribution towards overcoming these problems; urges the Commission, in all its international relations, to support the principle of flag state responsibility, which underpins international law and is fundamental to an efficient implementation of the IUU regulation;
65	Advocates better linkage of FPAs to existing development policy instruments, particularly the EDF, and to conditions relating to access to EU markets for developing countries.
66	Emphasises that fisheries cooperation is able directly to benefit the 150 million people on our planet who rely on fishing and fishery-related activities for their livelihood.
67	Reiterates that more attention needs to be focused on maximising the synergies between EU climate change policies and the EU development objectives, especially in terms of tools and instruments used and the collateral development and/or climate change adaptation benefits;
68	Stresses that an investment in education for sustainable development, including combating climate change, is an area where development aid can achieve multiple objectives at once, especially when women are targeted;
69	Believes that the challenges posed by climate change must be addressed through structural reforms, and calls for a systematic climate change risk assessment of all aspects of EU's policy planning and decision making, including trade, agriculture, food security, etc., and demands that the result of this assessment be used to formulate clear and coherent country and regional strategy papers, as well as development programmes and projects;
70	Calls for specific attention to be devoted to the special needs of smallholder agriculture and livestock farmers facing the consequences of climate change in any policy and agreements entailing possible reduction of, or constraints in the access to, resources for food production, such as land, water, mobility, among others;
71	Repeats its call on the Commission and the Member States to collect country-specific and gender-disaggregated data when planning, implementing and evaluating climate change policies, programmes and projects, in order effectively to assess and address the differing effects of climate change on each gender and to produce a guide on adapting to climate change, outlining policies that can protect women and empower them to cope with the effects of climate change;
72	Welcomes the proposals made in the European Report on Development 2011/2012 on an integrated and ecosystems-based management of water, energy and land, with those three resources being crucial for development; asks the Commission to follow-up on the proposals made in the report; points especially to the existence of significant EU and global governance gaps, and stresses the necessity of a change towards more sustainability in consumption and production patterns within the Union itself;
73	Suggests that the EU should work in developing countries to promote investment, innovative approaches and high standards of corporate practice in the inclusive and sustainable use of water, energy and land; suggests as well that the emphasis on sustainable energy and agriculture in the 'Agenda for Change' should be complemented with interventions in the area of water;
74	Calls on the Commission to report on the social sustainability of biofuels by the end of 2012 and to consult with affected communities and local NGOs beforehand; points out that this is an opportunity to propose an adequate methodology and cover the full impacts that European biofuels targets are having on food security, land rights and other development issues; recalls that the monitoring and reporting by the Commission foreseen in the proposed directive provides an opportunity, if appropriate, to propose corrective actions, based on lessons learned;
75	Underlines the importance of guaranteeing that imported bioenergy is produced on the basis of acceptable working environments and employment standards and respecting local communities;
76	Encourages the further development of second and third generation bioenergy from biomass by-products, wastes and residues;
77	Asks the Commission to reconsider the 10 % target for biofuels from renewable sources by 2020 set forth in the Renewable Energies Directive, unless strict sustainability criteria are applied;
78	Urges the Members States to allocate a significant share of the auctioning revenues from the European Emissions Trading System (ETS) to climate change-related activities in developing countries from 2013 onwards;
79	Urges the Commission to propose an adequate and PCD-aligned methodology to calculate the effects of indirect land use change, reminding the Commission that such a methodology was due by the end of 2010;
80	Stresses that the review of the EU’s arms exports due in 2012 must be based on comprehensive information in order to comply with the development objectives; points out that the publication of the Council’s Thirteenth Annual Report on control of exports of military technology and equipment raised questions about the reliability and usability of the data provided;
81	Draws attention to the EU's pledges for democracy and human rights and for conditions such as those enshrined in the ‘more for more’ approach concerning the EU's immediate Neighbourhood policy; stresses that their relevance can only be assured when no other policy area, and when no interaction with partner countries, counteract initiatives undertaken to strengthen human rights, human security and democracy in partner countries;
82	Recalls the fact that arms exports are an inter-governmental issue and that PCD should be taken into account in this context; concludes that deciding whether to approve arms exports to developing countries in relation to the ‘sustainable development’ criterion, i.e	criterion 8 of the Consolidated EU and National Arms Export Licensing Criteria, can be difficult, given that other policy considerations can override its application; recommends that Member States provide a full statement of the methodology used in relation to this criterion;
83	Acknowledges the interdependence of development, democracy, human rights, good governance and security, which any discussion on PCD has to take into account;
84	Takes the view that the concepts of human security and development should be considered as essential in the security-development nexus, as they are centred on the individual;
85	Points out that coordination among peace-building, humanitarian aid and development activities in post-conflict situations should be improved in accordance with the ‘Linking Relief, Rehabilitation and Development’ (LRRD) strategic framework in order to comply with the principles of PCD and human security, the latter still being undervalued; reminds the Commission that the Council had invited it to prepare an EU Action Plan on situations of conflict and fragility in 2009, and that the EU endorsed the New Deal for engagement in fragile states that was adopted at the Busan High Level Forum on Aid Effectiveness;
86	Emphasises that with the Council Working Group on Conventional Arms Exports being the main committee responsible for the EU's Code of Conduct on Arms Exports, it is imperative that development objectives are taken into account in this forum; calls on the Council to make the European Code of Conduct on Arms Exports legally binding;
87	Stresses that 'brain drain' can cause serious problems in developing countries, especially in the health sector; acknowledges that 'brain drain' affecting developing countries is the result of a combination of structural causes and 'push and pull' factors; therefore asks the Commission to monitor the effects of the Blue Card system on developing countries and take corrective action if necessary; asks as well the Commission to promote the application of the ‘WHO Code of practice’ regarding the international recruitment of health personnel to both the public and the private sectors;
88	Underlines that it has to be guaranteed that mobility partnerships are consistent with the international human rights legal framework; asks the EU to prevent conditionality in development aid relating to migration reduction, in both bilateral and multilateral negotiations by the EU and its Member States;
89	Insists that the external dimension strand in the Asylum and Migration Fund is fully coherent with the external aid instruments and EU development objectives; proposes that safeguards be put in place to prevent Member States from using this strand of funding merely to curb migration from developing countries;
90	Supports a migrant-centred and human rights based approach to EU migration policy with the view to enable the Member States and partner countries to respect, protect and fulfil the human rights of all migrants and to enable migrants to claim their rights throughout the migration journey; emphasises that human rights-based and migrant-centred approaches will help to analyse, in a proper way, the root causes of forced migration – notably conflicts, climate change, unemployment and poverty – and ensure that the EU offers adequate responses to these, in line with PCD;
91	Points out that it is expedient to involve diasporas and diaspora returnees as development agents, the latter being especially relevant in the context of the European financial crisis;
92	Emphasises the need to further explain the parameters of complementarity and to put in place a coherent and integrated institutional dialogue to plan and manage external and internal funds addressing migration-related issues from a PCD and human rights perspective;
93	Calls on the Commission and the ACP countries, in the ongoing revision of the ACP-EU Agreement, to include in Article 13 the principles of circular migration and its facilitation by granting circular visas; stresses that the article in question emphasises respect for human rights and equitable treatment of nationals of ACP countries, but that the scope of these principles is seriously compromised by bilateral readmission agreements with transit countries which, taken together, amount to an externalisation by Europe of the management of migration, and which do not guarantee respect for the rights of migrants and may result in 'cascade' readmissions that jeopardise their safety and their lives;
94	Reaffirms the importance of co-financing NGOs as a principle that motivates grant beneficiaries to contribute to higher accountability and development effectiveness and that improves cooperation of all stakeholders, as recommended by the Istanbul principles(8);
95	Solicits attention to emphasise the overall framework of good governance and respect for human rights and its catalytic role for development in partner countries in all policy dialogues, irrespective of the five core issues identified for PCD assessment purposes;
96	Proposes that the concept of 'aid effectiveness' be complemented with the concept of 'development effectiveness' as the latter is more suitable to measure PCD and more convenient for deepening the dialogue with BRICS countries in the field of development policy;
97	Draws attention to the cross-cutting nature of good governance programmes in developing countries, and encourages further efforts in this regard by the Commission; draws attention as well to the need, in the current period of multiple crises, for better global governance as it has an instrumental role to play in achieving global development; regrets that the Outcome Document of the UN Rio+20 conference lacks the commitment on resource conservation, climate change adaptation and mitigation, and economic sustainability that the EU had called for; urges, nevertheless, the EU to remain closely involved in defining the Sustainable Development Goals (SDGs) and in making them operational by 2015;
98	Supports the Commission's proposal to create a comprehensive overview of the costs of policies that are not aligned with PCD, and of the benefits, or win-win situations, created by PCD-aligned policies that can be used both for further awareness-raising and training and as a basis for discussion with the European citizens and other affected stakeholders in order to overcome misconceptions which are still prevalent as regards the costs and benefits of PCD; such an analysis would be especially helpful in the fields of migration – where the EU should stress the linkages between migration and development policies, and provide constant information to its people on the benefits of these linkages – and sustainable energy;
99	Calls on the Commission and the Council to develop a long-term, cross-sectoral EU strategy for development education, awareness-raising and active global citizenship;
100	Calls on the Member States to develop – or strengthen – national development education strategies and programmes on education in sustainable development, and to make PCD part of their respective curricula;
101	Points out that the ongoing initiative on Markets for Financial Instruments Directive (MiFID) can make a valuable contribution to the fulfilment of the overarching objectives of the Union's development cooperation by including strict position limits and a strict limitation on exemptions from MiFID, and by strengthening the powers for regulators to intervene in specific products or activities;
102	Reiterates that, in the interest of transparency and accountability, the EEAS and DEVCO should monitor how the division of responsibilities agreed between the Commission and the EEAS works in practice, and improve it in ways that avoid overlaps and ensure synergies;
103	Refers to the fact that the EEAS has put forward the concept of ‘EU actorness’ in order to increase the visibility of EU actions; takes the view that this makes PCD even more important, as every negative impact will be associated even more closely with the EU; urges the Commission to make sure that this concept does not contradict other objectives of development policy as formulated by the EU, especially the objectives of ownership and policy space for developing countries;
104	Suggests that, in line with the Cotonou Agreement and the reference document on 'Engaging Non-State Actors in New Aid Modalities'(9), the EU delegations should undertake a comprehensive mapping of NGOs, CSOs and local authorities relevant for their work in the respective country, especially of local and community-based organizations;
105	Reiterates that the creation of a Standing Rapporteur for PCD from the ACP countries in the context of the Joint Parliamentary Assembly would facilitate the coordination with, and work of, the EP's Standing Rapporteur on PCD and the relevant department of the Commission and Council, and would help to eliminate obstacles to PCD within developing countries themselves;
106	Recalls that, in its June 2011 Communication on the Multi-Annual Financial Framework, the Commission had proposed extending the powers of scrutiny of the EDF to Parliament; regrets that this proposal does not feature in the legislative proposal for the 11th EDF;
107	Underlines that a post-2015 international framework for development cooperation, in order to provide a more comprehensive approach to poverty eradication and sustainable development, should go beyond a traditional interpretation of development cooperation, , leveraging policy coherence for development as an important mechanism and promoting rights-based approaches; points out that such a framework should go beyond the current concept of public action and aid and should involve all countries (developed, developing, emerging) and all actors (traditional and new donors, developing and developed country governments, and local authorities, the private sector, NGOs, social partners, etc.) in a coherent and inclusive process;
108	Welcomes the fact that the social clause in Article 9 of the Treaty on the Functioning of the European Union (TFEU) applies both within and beyond the EU’s borders;
109	Stresses the need to ensure that the social provisions enshrined in EU trade agreements are implemented and properly monitored; considers it necessary to ensure that mechanisms for revision and enforcement are available;
110	Calls on the Commission to include provisions on social standards and on the objectives of full and productive employment, taking into account gender equality and youth, decent work, respect for workers’ rights, including for migrant workers, and gender equality in all EU trade agreement;
111	Stresses the need to support and spread collective bargaining as a tool for reducing labour market inequalities, ensuring decent work and wages, preventing social dumping and undeclared work, and ensuring fair competition;
112	Underlines the necessity to respect the conditions of work contracts, stressing that the work performed by young people and women should not represent any type of exploitation, whether in the form of sexual exploitation, forced labour or services, slavery or practices similar to slavery;
113	Underlines the importance of CSR obligations, and of encouraging employers to apply social standards which are more ambitious than current statutory provisions, including the possibility to develop and obtain a designation such as a social label; calls on the Commission to support the Member States in carefully monitoring the implementation, and ensuring the legal enforcement, of these obligations;
114	Stresses the importance of establishing PCD focal points also in developing countries to improve information exchanges, inter alia on issues beyond EU competences, such as the socially-inclusive use of resource rents or taxation and remittances, and the impact of the so-called ‘brain drain’ on countries of origin; calls on the Commission to mainstream social policy in the work of the EEAS; believes it is essential also for middle-income countries to commit an increasing proportion of their revenue to social purposes, notably by developing taxation systems and social protection;
115	Urges the Commission and the Member States to pay greater attention to the participation and integration of migrants, particularly women and children, in receiving countries, and on the portability of social rights;
116	Calls on the Commission to engage in social dialogue with non-EU labour organisations and trade unions about the implementation of social standards in their respective countries, and to ensure more adequate technical assistance for the implementation of social and fiscal policy;
117	Asks the Commission to consider scaling up its support for culture-related programmes or cooperation projects with partners from developing countries due to their cross-cutting nature regarding the EU's development objectives;
118	Highlights that planning for the provision of basic services, such as primary education, needs to focus more forcefully on those specific characteristics of particularly marginalised groups that make the provision of such services more difficult and that limit the ability of the groups to take advantage of what is available;
119	Underlines the urgent need to change the humanitarian mindset and recognise the vital role of education, especially of education during conflict-related emergencies and in the aftermath of conflicts; regrets that education is still one of the most underfunded areas of humanitarian aid;
120	Asks the Commission to consider the cross-cutting nature of ICTs in development policies, especially the positive influence they can have on the education system, and stresses that intellectual property rights, technology transfer and local capacity-building require particular attention in that context;
121	Points out that true banking transactions using mobile phone technology (m-banking) should be distinguished from basic money transfers using such technology (m-payments), and stresses that the need to regulate international money transactions (e.g	to prevent money laundering or terrorism financing) must be reconciled with the need to promote affordable access to money for the poor through the use of mobile phones; suggests that collecting existing best practices would be a useful way to share knowledge and address those challenges;
122	Regrets that budget support arrangements are still characterised by a lack of citizen and parliamentarian oversight of agreements and their implementation and monitoring;
123	Reiterates that while budget support should be in line with efforts to promote democratic governance, strengthen developing countries' own economic resources, combat corruption and strengthen the accountability of public spending, it should in the first instance focus on poverty reduction;
