66	Calls on the Commission and the Member States to step up their efforts to ensure that the product standards used within the single market become the main global standard, thus ensuring a level playing field for European companies, and in particular SMEs, wishing to operate beyond the single market;
67	Urges the Commission to focus on prioritising ‘consumer-friendly’ legislation relating to the single market, which makes a difference to the daily lives of European citizens, when planning its yearly activities; believes that this prioritisation must be followed by adequate information campaigns so as to bolster citizens' perceptions of the single market;
68	Reiterates that it is important to run alongside the emblematic ‘publicity campaign’ style activities of the EU institutions or the Member States decentralised public relations measures that better associate local stakeholders and the national, regional and local media (placing special stress on the local media), who are more focused on the daily problems experienced by consumers in the single market (examples of bank charges in another Member State, study on the possibilities of changing operator, comparisons of telephony costs, etc.);
69	Asks the Commission to launch a regular series of studies exploring the relationship between the single market and the average European citizen, focusing in particular on the costs and benefits arising from this relationship, as well as the day-to-day challenges that they face;
70	Calls on the Member States, with the support of the Commission, to improve the capacity of problem-solving mechanisms, in particular SOLVIT, by allocating additional financial and human resources and reviewing their mandate so as to ensure that such mechanisms can effectively address the wide range of problems encountered by citizens and businesses; calls on the Commission to complete the single market assistance services (SMAS) project as a matter of priority, so that citizens and businesses have easy access to the information and guidance they need, while finding solutions to the problems they encounter;
71	Urges the Commission, and the Member States, to keep up and increase, through information campaigns and tougher checks, their efforts to raise citizens' confidence in the CE mark, a fundamental tool for ensuring consumer rights and quality standards in the single market;
72	Highlights the key role played by the Enterprise Europe Network in enabling SMEs to make use of the opportunities offered by the single market; stresses that bureaucratic obligations tie up valuable resources, thus preventing a stronger focus on the Enterprise Europe Network's core task of providing tailor-made support for SMEs; calls on the Commission to make more use of the Enterprise Europe Network for the targeted distribution of information and to reduce bureaucracy for the Enterprise Europe Network's partners;
73	Suggests to the Commission that the single market strategy should comprise four main stages: the first to include an evaluation or health check of the current situation to assess the degree of distortion and strain that the various stakeholders in the single market have suffered, notably as a result of the crisis; the second to see the launch of a consolidation process, tying up loose ends; the third to entail development and improvement of the single market; and the fourth to concentrate on the longer-term vision of the market (EU 2020 Strategy);
74	Believes that both financial services and access to finance must be a part of the EU 2020 strategy.
75	Suggests that in the first stage of the abovementioned health check, the Commission should conduct a financial audit of the EU budget and allocate as a priority more funds to investment in education, innovation and research; calls on the Member States to set the same priorities in their budget spending;
76	Believes that in order to establish an effective single market, the Commission must produce a clear set of political priorities through the adoption of a ‘Single Market Act’, which should cover both legislative and non-legislative initiatives, aimed at creating a highly competitive social market and green economy;
77	Encourages the Commission to present the ‘Act’ by May 2011–- well ahead of the 20th anniversary of the 1992 Single Market Programme – putting citizens, consumers and SMEs at the heart of the single market; emphasises that it should be looked upon as a blueprint for future action if we are to achieve a knowledge-based, highly competitive, social and environmentally friendly, green market economy which also ensures a credible level playing field;
78	Calls on the Commission to incorporate in the ‘Single Market Act’ specific measures aimed at, but not limited to:
79	Calls on the Commission	in preparing the ‘Single Market Act’, to take into account the various EU institutions' consultations and reports (EU 2020, Monti, Gonzales and IMCO reports, etc.), and to launch an additional wide-ranging public consultation, with a view to bringing forward a coordinated policy proposal for a more coherent and viable single market;
80	Recommends that an analysis be carried out to identify ways and means of integrating consumer interest into the relevant EU policies, thus enabling consumer protection to feature automatically in the drafting of the relevant EU legislation;
81	Reiterates the importance of the Services directive in completing the single market, and the huge potential it has for delivering benefits to consumers and SMEs; emphasises that the successful implementation of this legislation requires sustained political commitment and support from all actors at European, national and local level; calls on the Commission, after the implementation phase, to undertake an evaluation of the Services Directive to determine whether it has achieved its main goals; calls for a clear involvement of the European Parliament in this work and insists on the need to preserve the balance between the need to improve the single market in services while ensuring a high level of social protection;
82	Considers that proper implementation of single market legislation (e.g	the Professional Qualifications Directive, Service Directive and Market Surveillance Regulation) should remain a top priority for the new Commission;
83	Notes that redress mechanisms applicable across the Union have yielded limited results and therefore urges the Commission to bring forward a legislative proposal to ensure implementation of an affordable, expedient and accessible Europe-wide collective redress system by May 2011;
84	Invites the Commission to consider adopting a ‘Citizens’ Charter' encompassing the various facets of the right to live and work anywhere in the EU; holds that this right must be readily available to all EU citizens; underlines that certain labour restrictions for workers from the new Member States still exist within the single market; calls on Member States, taking into account all the positive  and negative effects of opening up of national markets, to consider removing the existing restrictions;
85	Calls on the Commission to submit to Parliament and the Council during the current parliamentary term a proposal for a regulation on a European Statute for Mutual Societies and Associations;
86	Calls on the Commission to take the requisite steps to propose, as soon as possible, a feasibility study and consultation process designed to lead to the introduction of a European Mutual Society Statute;
87	Calls on the Commission to focus more closely on market monitoring, especially in the areas of financial services, insurance, telephony, banking services and utilities, and believes that the effective monitoring of markets will strengthen fair competition and increase their efficiency, thus benefiting both the economy and consumers;
88	Takes the view that the quality of consumer protection in the financial services sector requires considerable improvement, especially in respect to the monitoring and supervising aspects;
89	Maintains that continued sustainable development of the internal market depends on: (1) the Commission's continued commitment to all market initiatives required to stimulate and improve significantly our standing and competitive edge in the global market; (2) adoption of an overall framework to ensure that the single market really delivers for all stakeholders; and, crucially, (3) the single market also reaching citizens;
90	Instructs its President to forward this resolution to the Council and the Commission.
