64	Calls on the Commission to create a sufficient budget line in the light of the tourist sector's importance for the European economy;
65	Asks that any draft secondary legislation which has an impact on the tourist sector be identified at the outset of the implementation of the Commission's work programme, and be subject to an impact assessment, with the involvement of bodies representing industry, employees and consumers; asks also that there be a report on the implementation of these measures on the tourist sector; asks that these
66	Asks likewise that within the framework of the interservices consultations within the Commission, the interests of the sector and the goals of sustainable tourism set out in the Commission's communication be taken into account;
67	Calls on the Commission to consider setting up a network of tourism correspondents/ coordinators in all Commission Directorates whose remit affects tourism activities (Enterprises and Industry, Regional Policy, Environment, Agriculture and Rural Development, Energy and Transport, Internal Market and Services, and so on), which could be coordinated by the department in charge of tourism within the Enterprise and Industry DG;
68	Welcomes the insertion of a specific section on tourism (Section 4, Article III-281) in the Treaty establishing a Constitution for Europe; believes that this legal basis will make more consistent support action possible, and that it will be given extra weight by the full involvement of the European Parliament in the adoption of legislative measures;
69	"Calls on the Commission to work together with its main institutional partners and the sector's representative bodies on the various avenues of action to encourage the development of an environment more favourable to business competitiveness and coordination between Member States; calls on the Commission to propose, from 2007, the implementation of a multiannual action plan (""tourism package"") to strengthen the consistency of Union action on tourism by bringing together the Member States and their regional local authorities, in accordance with the principles of good governance;"
70	Calls on the Commission to include tourism among the principal guidelines and priorities for cooperation with partner countries in the context of European initiatives to promote neighbourly relations, for example the Euro-Mediterranean partnership arrangements;
71	Instructs its President to forward this resolution to the Council and Commission.
