BG	whereas the Joint Review fails to mention the fact that in the case of processing of personal data for intelligence purposes, under US law, non-US citizens do not enjoy any judicial or administrative avenue to protect their rights, and constitutional protections are only granted to US persons; whereas this lack of judicial or administrative rights nullifies the protections for EU citizens laid down in the existing PNR agreement;
BH	whereas the EU-US Agreement on mutual legal assistance in criminal matters of 6 June 2003(36) entered into force on 1 February 2010 and is intended to facilitate cooperation between the EU and the US to combat crime in a more effective way, having due regard for the rights of individuals and the rule of law;
BI	whereas the purpose of this general agreement is to establish the legal framework for all transfers of personal data between the EU and US for the sole purposes of preventing, investigating, detecting or prosecuting criminal offences, including terrorism, in the framework of police and judicial cooperation in criminal matters; whereas negotiations were authorised by the Council on 2 December 2010; whereas this agreement is of the utmost importance and would act as the basis to facilitate data transfer in the context of police and judicial cooperation and in criminal matters;
BJ	whereas this agreement should provide for clear and precise and legally binding data-processing principles, and should in particular recognise EU citizens' right to judicial access to and rectification and erasure of their personal data in the US, as well as the right to an efficient administrative and judicial redress mechanism for EU citizens in the US and independent oversight of the data-processing activities;
BK	whereas in its communication of 27 November 2013 the Commission indicated that the ‘umbrella agreement’ should result in a high level of protection for citizens on both sides of the Atlantic and should strengthen the trust of Europeans in EU-US data exchanges, providing a basis on which to develop EU-US security cooperation and partnership further;
BL	whereas negotiations on the agreement have not progressed because of the US Government’s persistent position of refusing recognition of effective rights of administrative and judicial redress to EU citizens and because of the intention of providing broad derogations to the data protection principles contained in the agreement, such as purpose limitation, data retention or onward transfers either domestically or abroad;
BM	whereas the EU data protection legal framework is currently being reviewed in order to establish a comprehensive, consistent, modern and robust system for all data-processing activities in the Union; whereas in January 2012 the Commission presented a package of legislative proposals: a General Data Protection Regulation(37), which will replace Directive 95/46/EC and establish a uniform law throughout the EU, and a Directive(38) which will lay down a harmonised framework for all data processing activities by law enforcement authorities for law enforcement purposes and will reduce the current divergences among national laws;
BN	whereas on 21 October 2013 the LIBE Committee adopted its legislative reports on the two proposals and a decision on the opening of negotiations with the Council with a view to having the legal instruments adopted during this legislative term;
BO	whereas, although the European Council of 24/25 October 2013 called for the timely adoption of a strong EU General Data Protection framework in order to foster the trust of citizens and businesses in the digital economy, after two years of deliberations the Council has still been unable to arrive at a general approach on the General Data Protection Regulation and the Directive(39);
BP	whereas Parliament’s abovementioned resolution of 10 December 2013 emphasises the economic potential of ‘cloud computing’ business for growth and employment; whereas the overall economic value of the cloud market is forecast to be worth USD 207 billion a year by 2016, or twice its value in 2012;
BQ	whereas the level of data protection in a cloud computing environment must not be inferior to that required in any other data-processing context; whereas Union data protection law, since it is technologically neutral, already applies fully to cloud computing services operating in the EU;
BR	whereas mass surveillance activities give intelligence agencies access to personal data stored or otherwise processed by EU individuals under cloud services agreements with major US cloud providers; whereas the US intelligence authorities have accessed personal data stored or otherwise processed in servers located on EU soil by tapping into the internal networks of Yahoo and Google; whereas such activities constitute a violation of international obligations and of European fundamental rights standards including the right to private and family life, the confidentiality of communications, the presumption of innocence, freedom of expression, freedom of information, freedom of assembly and association and the freedom to conduct business; whereas it is not excluded that information stored in cloud services by Member States’ public authorities or undertakings and institutions has also been accessed by intelligence authorities;
BS	whereas US intelligence agencies have a policy of systematically undermining cryptographic protocols and products in order to be able to intercept even encrypted communication; whereas the US National Security Agency has collected vast numbers of so called ‘zero-day exploits’ – IT security vulnerabilities that are not yet known to the public or the product vendor; whereas such activities massively undermine global efforts to improve IT security;
BT	whereas the fact that intelligence agencies have accessed personal data of users of online services has severely distorted the trust of citizens in such services, and therefore has an adverse effect on businesses investing in the development of new services using ‘Big Data’ and new applications such as the ’Internet of Things’;
BU	whereas IT vendors often deliver products that have not been properly tested for IT security or that even sometimes have backdoors implanted purposefully by the vendor; whereas the lack of liability rules for software vendors has led to such a situation, which is in turn exploited by intelligence agencies but also leaves open the risk of attacks by other entities;
BV	whereas it is essential for companies providing such new services and applications to respect the data protection rules and privacy of the data subjects whose data are collected, processed and analysed, in order to maintain a high level of trust among citizens;
BW	whereas intelligence services in democratic societies are given special powers and capabilities to protect fundamental rights, democracy and the rule of law, citizens' rights and the State against internal and external threats, and are subject to democratic accountability and judicial oversight; whereas they are given special powers and capabilities only to this end; whereas these powers should be used within the legal limits imposed by fundamental rights, democracy and the rule of law and their application should be strictly scrutinised, as otherwise they lose legitimacy and risk undermining democracy;
BX	whereas the fact that a certain level of secrecy is conceded to intelligence services in order to avoid endangering ongoing operations, revealing modi operandi or putting at risk the lives of agents, such secrecy cannot override or exclude rules on democratic and judicial scrutiny and examination of their activities, as well as on transparency, notably in relation to the respect of fundamental rights and the rule of law, all of which are cornerstones in a democratic society;
BY	whereas most of the existing national oversight mechanisms and bodies were set up or revamped in the 1990s and have not necessarily been adapted to the rapid political and technological developments over the last decade that have led to increased international intelligence cooperation, also through the large scale exchange of personal data, and often blurring the line between intelligence and law enforcement activities;
BZ	whereas democratic oversight of intelligence activities is still only conducted at national level, despite the increase in exchange of information between EU Member States and between Member States and third countries; whereas there is an increasing gap between the level of international cooperation on the one hand and oversight capacities limited to the national level on the other, which results in insufficient and ineffective democratic scrutiny;
CA	whereas national oversight bodies often do not have full access to intelligence received from a foreign intelligence agency, which can lead to gaps in which international information exchanges can take place without adequate review; whereas this problem is further aggravated by the so-called ‘third party rule’ or the principle of ’originator control’, which has been designed to enable originators to maintain control over the further dissemination of their sensitive information, but is unfortunately often interpreted as applying also to the recipient services' oversight;
CB	whereas private and public transparency reform initiatives are key to ensuring public trust in the activities of intelligence agencies; whereas legal systems should not prevent companies from disclosing to the public information about how they handle all types of government requests and court orders for access to user data, including the possibility of disclosing aggregate information on the number of requests and orders approved and rejected;
1	Considers that recent revelations in the press by whistleblowers and journalists, together with the expert evidence given during this inquiry, admissions by authorities, and the insufficient response to these allegations, have resulted in compelling evidence of the existence of far-reaching, complex and highly technologically advanced systems designed by US and some Member States' intelligence services to collect, store and analyse communication data, including content data, location data and metadata of all citizens around the world, on an unprecedented scale and in an indiscriminate and non-suspicion-based manner;
2	Points specifically to US NSA intelligence programmes allowing for the mass surveillance of EU citizens through direct access to the central servers of leading US internet companies (PRISM programme), the analysis of content and metadata (Xkeyscore programme), the circumvention of online encryption (BULLRUN), access to computer and telephone networks, and access to location data, as well as to systems of the UK intelligence agency GCHQ such as the upstream surveillance activity (Tempora programme), the decryption programme (Edgehill), the targeted ‘man-in-the-middle attacks’ on information systems (Quantumtheory and Foxacid programmes) and the collection and retention of 200 million text messages per day (Dishfire programme);
3	Notes the allegations of ‘hacking’ or tapping into the Belgacom systems by the UK intelligence agency GCHQ; notes the statements by Belgacom that it could neither confirm nor deny that EU institutions were targeted or affected, and that the malware used was extremely complex and its development and use would require extensive financial and staffing resources that would not be available to private entities or hackers;
4	Emphasises that trust has been profoundly shaken: trust between the two transatlantic partners, trust between citizens and their governments, trust in the functioning of democratic institutions on both sides of the Atlantic, trust in the respect of the rule of law, and trust in the security of IT services and communication; believes that in order to rebuild trust in all these dimensions, an immediate and comprehensive response plan comprising a series of actions which are subject to public scrutiny is needed;
5	Notes that several governments claim that these mass surveillance programmes are necessary to combat terrorism; strongly denounces terrorism, but strongly believes that the fight against terrorism can never be a justification for untargeted, secret, or even illegal mass surveillance programmes; takes the view that such programmes are incompatible with the principles of necessity and proportionality in a democratic society;
6	Recalls the EU's firm belief in the need to strike the right balance between security measures and the protection of civil liberties and fundamental rights, while ensuring the utmost respect for privacy and data protection;
7	Considers that data collection of such magnitude leaves considerable doubts as to whether these actions are guided only by the fight against terrorism, since it involves the collection of all possible data of all citizens; points, therefore, to the possible existence of other purposes including political and economic espionage, which need to be comprehensively dispelled;
8	Questions the compatibility of some Member States’ massive economic espionage activities with the EU internal market and competition law as enshrined in Titles I and VII of the Treaty on the Functioning of the European Union; reaffirms the principle of sincere cooperation as enshrined in Article 4(3) of the Treaty on European Union, as well as the principle that Member States shall ‘refrain from any measures which could jeopardise the attainment of the Union’s objectives’;
9	Notes that international treaties and EU and US legislation, as well as national oversight mechanisms, have failed to provide for the necessary checks and balances or for democratic accountability;
10	Condemns the vast and systemic blanket collection of the personal data of innocent people, often including intimate personal information; emphasises that the systems of indiscriminate mass surveillance by intelligence services constitute a serious interference with the fundamental rights of citizens; stresses that privacy is not a luxury right, but is the foundation stone of a free and democratic society; points out, furthermore, that mass surveillance has potentially severe effects on freedom of the press, thought and speech and on freedom of assembly and of association, as well as entailing a significant potential for abusive use of the information gathered against political adversaries; emphasises that these mass surveillance activities also entail illegal actions by intelligence services and raise questions regarding the extraterritoriality of national laws;
11	Considers it crucial that the professional confidentiality privilege of lawyers, journalists, doctors and other regulated professions is safeguarded against mass surveillance activities; stresses, in particular, that any uncertainty about the confidentiality of communications between lawyers and their clients could negatively impact on EU citizens' right of access to legal advice and access to justice and the right to a fair trial;
12	Sees the surveillance programmes as yet another step towards the establishment of a fully-fledged preventive state, changing the established paradigm of criminal law in democratic societies whereby any interference with suspects' fundamental rights has to be authorised by a judge or prosecutor on the basis of a reasonable suspicion and must be regulated by law, promoting instead a mix of law enforcement and intelligence activities with blurred and weakened legal safeguards, often not in line with democratic checks and balances and fundamental rights, especially the presumption of innocence; recalls in this regard the decision of the German Federal Constitutional Court(40) on the prohibition of the use of preventive dragnets (‘präventive Rasterfahndung’) unless there is proof of a concrete danger to other high-ranking legally protected rights, whereby a general threat situation or international tensions do not suffice to justify such measures;
13	Is convinced that secret laws and courts violate the rule of law; points out that any judgment of a court or tribunal and any decision of an administrative authority of a non-EU state authorising, directly or indirectly, the transfer of personal data, may not be recognised or enforced in any manner unless there is a mutual legal assistance treaty or an international agreement in force between the requesting third country and the Union or a Member State and a prior authorisation by the competent supervisory authority; recalls that any judgment of a secret court or tribunal and any decision of an administrative authority of a non-EU state secretly authorising, directly or indirectly, surveillance activities shall not be recognised or enforced;
14	Points out that the abovementioned concerns are exacerbated by rapid technological and societal developments, since internet and mobile devices are everywhere in modern daily life (‘ubiquitous computing’) and the business model of most internet companies is based on the processing of personal data; considers that the scale of this problem is unprecedented; notes that this may create a situation where infrastructure for the mass collection and processing of data could be misused in cases of change of political regime;
15	Notes that there is no guarantee, either for EU public institutions or for citizens, that their IT security or privacy can be protected from attacks by well-equipped intruders (‘no 100 % IT security’); notes that in order to achieve maximum IT security, Europeans need to be willing to dedicate sufficient resources, both human and financial, to preserving Europe’s independence and self-reliance in the field of IT;
16	Strongly rejects the notion that all issues related to mass surveillance programmes are purely a matter of national security and therefore the sole competence of Member States; reiterates that Member States must fully respect EU law and the ECHR while acting to ensure their national security; recalls a recent ruling of the Court of Justice according to which ‘although it is for Member States to take the appropriate measures to ensure their internal and external security, the mere fact that a decision concerns State security cannot result in European Union law being inapplicable’(41); recalls further that the protection of the privacy of all EU citizens is at stake, as are the security and reliability of all EU communication networks; believes, therefore, that discussion and action at EU level are not only legitimate, but also a matter of EU autonomy;
17	Commends the institutions and experts who have contributed to this Inquiry; deplores the fact that several Member States’ authorities have declined to cooperate with the inquiry the European Parliament has been conducting on behalf of citizens; welcomes the openness of several Members of Congress and of national parliaments;
18	Is aware that in such a limited timeframe it has been possible to conduct only a preliminary investigation of all the issues at stake since July 2013; recognises both the scale of the revelations involved and their ongoing nature; adopts, therefore, a forward-planning approach consisting in a set of specific proposals and a mechanism for follow-up action in the next parliamentary term, ensuring the findings remain high on the EU political agenda;
19	Intends to request strong political undertakings from the new Commission which will be designated after the May 2014 European elections to the effect that it will implement the proposals and recommendations of this Inquiry;
20	Calls on the US authorities and the EU Member States, where this is not yet the case, to prohibit blanket mass surveillance activities;
21	Calls on the EU Member States, and in particular those participating in the so-called ‘9-eyes’ and ’14-eyes’ programmes(42), to comprehensively evaluate, and revise where necessary, their national legislation and practices governing the activities of the intelligence services so as to ensure that they are subject to parliamentary and judicial oversight and public scrutiny, that they respect the principles of legality, necessity, proportionality, due process, user notification and transparency, including by reference to the UN compilation of good practices and the recommendations of the Venice Commission, and that they are in line with the standards of the European Convention on Human Rights and comply with Member States' fundamental rights obligations, in particular as regards data protection, privacy, and the presumption of innocence;
22	Calls on all EU Member States and in particular, with regard to its Resolution of 4 July 2013 and Inquiry Hearings, the United Kingdom, France, Germany, Sweden, the Netherlands and Poland to ensure that their current or future legislative frameworks and oversight mechanisms governing the activities of intelligence agencies are in line with the standards of the European Convention on Human Rights and European Union data protection legislation; calls on these Member States to clarify the allegations of mass surveillance activities, including mass surveillance of cross border telecommunications, untargeted surveillance on cable-bound communications, potential agreements between intelligence services and telecommunication companies as regards access and exchange of personal data and access to transatlantic cables, US intelligence personnel and equipment on EU territory without oversight on surveillance operations, and their compatibility with EU legislation; invites the national parliaments of those countries to intensify cooperation of their intelligence oversight bodies at European level;
23	Calls on the United Kingdom, in particular, given the extensive media reports referring to mass surveillance by the intelligence service GCHQ, to revise its current legal framework, which is made up of a 'complex interaction' between three separate pieces of legislation – the Human Rights Act 1998, the Intelligence Services Act 1994 and the Regulation of Investigatory Powers Act 2000;
24	Takes note of the review of the Dutch Intelligence and Security Act 2002 (report by the Dessens Commission of 2 December 2013); supports those recommendations of the review commission which aim to strengthen the transparency, control and oversight of the Dutch intelligence services; calls on the Netherlands to refrain from extending the powers of the intelligence services in such a way as to enable untargeted and large-scale surveillance also to be performed on cable-bound communications of innocent citizens, especially given the fact that one of the biggest Internet Exchange Points in the world is located in Amsterdam (AMS-IX); calls for caution in defining the mandate and capabilities of the new Joint Sigint Cyber Unit, as well as for caution regarding the presence and operation of US intelligence personnel on Dutch territory;
25	Calls on the Member States, including when represented by their intelligence agencies, to refrain from accepting data from third states which have been collected unlawfully and from allowing surveillance activities on their territory by third states’ governments or agencies which are unlawful under national law or do not meet the legal safeguards enshrined in international or EU instruments, including the protection of human rights under the TEU, the ECHR and the EU Charter of Fundamental Rights;
26	Calls for the termination of mass interception and processing of webcam imagery by any secret service; calls upon the Member States to fully investigate whether, how and to what extent their respective secret services have been involved in the collection and processing of webcam images, and to delete all stored images collected through such mass surveillance programmes;
27	Calls on the Member States immediately to fulfil their positive obligation under the European Convention on Human Rights to protect their citizens from surveillance contrary to its requirements, including when the aim thereof is to safeguard national security, undertaken by third states or by their own intelligence services, and to ensure that the rule of law is not weakened as a result of extraterritorial application of a third country's law;
28	Invites the Secretary-General of the Council of Europe to launch the Article 52 procedure according to which ‘on receipt of a request from the Secretary-General of the Council of Europe any High Contracting Party shall furnish an explanation of the manner in which its internal law ensures the effective implementation of any of the provisions of the Convention’;
29	Calls on Member States to take appropriate action immediately, including court action, against the breach of their sovereignty, and thereby the violation of general public international law, perpetrated through the mass surveillance programmes; calls further on Member States to make use of all available international measures to defend EU citizens’ fundamental rights, notably by triggering the inter-state complaint procedure under Article 41 of the International Covenant on Civil and Political Rights (ICCPR);
30	Calls upon the Member States to establish effective mechanisms whereby those responsible for (mass) surveillance programmes that are in violation of the rule of law and the fundamental rights of citizens are held accountable for this abuse of power;
31	Calls on the US to revise its legislation without delay in order to bring it into line with international law, to recognise the privacy and other rights of EU citizens, to provide for judicial redress for EU citizens, to put rights of EU citizens on an equal footing with rights of US citizens, and to sign the Optional Protocol allowing for complaints by individuals under the ICCPR;
