50	Takes the view that there is great potential for the United States and the European Union to adopt joint positions and initiatives in international forums, in view of the many trade interests that they have in common, for example non-discriminatory access to raw materials on the global market, the implementation of intellectual property rights and global patent harmonisation; suggests that it is in both parties' interests to better exploit this potential;
51	Was concerned about the new trade-inhibiting US stimulus Bill, notes, however, that it has been amended to comply with WTO rules and insists on the absolute need for a mutual response to the current crisis rather than the adoption of measures to seal the EU and the US off from one another;
52	Advocates gradually integrating the financial markets through mutual recognition combined with a degree of convergence of the current regulatory frameworks and through the establishment of occasional exemptions whenever possible; recalls that the basic principles for successful integration are free access to markets, regulations that conform to international standards, uniform application of those regulations and an ongoing dialogue with market stakeholders; calls on the EU and the US authorities to avoid setting up barriers to inward investment and enacting legislation having an extra-territorial impact without prior consultation and agreement;
53	Supports the removal of barriers that hinder investment and transatlantic financial services, and favours improving the integration of EU and US markets so that they compete better with emerging markets, subject to the establishment of a satisfactory framework of prudential rules to prevent a crisis on one side of the Atlantic affecting the other;
54	Points out that the integration of financial services markets without a parallel review of the regulatory framework and supervisory standards would make it harder for the authorities to exercise effective supervision; therefore advocates the adoption of regulations that guarantee competition, ensure increased transparency and effective supervision of products, financial institutions and markets, and create common risk management models, in line with agreements reached at the G20 Summit in November 2008;
55	Acknowledges that the US supervisory authorities have made progress in implementing the Basel II agreements with regard to large banks, but criticises the discrepancies that remain to be corrected as they impose additional burdens on American subsidiaries of European banks, thereby reducing their competitiveness, and notes that there are still some issues (financial holdings and small banks) that need to be cleared up as soon as possible; encourages the US Congress, therefore, to consider a more coherent supervisory structure in the banking and insurance sectors so as to facilitate EU-US coordination;
56	Calls for greater cooperation between the supervisory bodies in supervising the activities of cross-border financial institutions and preventing action by financial institutions domiciled in jurisdictions that are uncooperative and less than transparent, and calls for the abolition of tax havens;
57	Urges the EU and US authorities to regulate credit rating agencies in accordance with jointly held principles and methods so as to restore confidence in ratings and place them on a sound footing; points out however that the EU needs to develop its own regulatory framework as the extra-territorial application of US Securities and Exchange Commission standards to US agencies operating in the European market would not be acceptable;
58	Agrees with the Commission that credit originator institutions should be obliged to retain a fraction of the credit issued in order to force them to accept their share of the risks transferred; calls for this issue to be raised in the transatlantic dialogue in order to preserve equal conditions at international level and limit systemic risks on the world financial markets; considers that a code of conduct should be agreed upon for sovereign wealth funds;
59	Calls on the new Congress to modify the US regulation which provides for the scanning of 100 % of inbound cargo and urges it to work closely with the EU to ensure the implementation of a multi-layered approach based on actual risk; notes that secure trade is particularly important in an ever more integrated global economy, but considers that this blunt measure represents a potential new trade barrier, imposing significant costs on economic operators, which will not bring any benefit in terms of supply chain security;
60	Believes that the TEC could usefully organise seminars on the 100 % scanning issue in Brussels and Washington in order to foster a deeper understanding between EU and US legislators and to promote an early and mutually acceptable resolution of this problem;
61	Recommends that the next TEC meeting should discuss whether it would be helpful to integrate more technical topics into the scope of the TEC and whether greater cooperation between the EU and the US is essential in order to achieve a workable cap-and-trade-emission system; recommends that existing common international benchmarks for energy-intensive industries should be developed or integrated into the TEC process;
62	Instructs its President to forward this resolution to the Council, the Commission, the governments and parliaments of the Member States and the President and Congress of the United States of America.
