54	Would like the Agenda for Change to specify the important and independent role of regional and local authorities and civil society, not only in implementing development programmes and projects, but also as fundamental players in the process of developing evidence-based development policies; highlights the importance of improving cooperation with them and calls for regular dialogue and consultations with them in policy-making; in this regard, underlines the importance of establishing dialogue between the EU and civil society organisations and regional and local authorities;
55	Calls for greater awareness in the new Member States of the importance of development aid;
56	Expresses its hope that development cooperation will be a more prominent topic during the course of 2015, a key year in which deep reflection will be required, particularly with regard to following up on the MDGs; would like to see the Commission name 2015 the ‘European Year for Development’;
57	Points out that a better understanding of the impacts of non-development policies on development is instrumental in establishing and monitoring an effective development framework; therefore considers it essential that the Agenda for Change should promote evidence-based Policy Coherence for Development (PCD);
58	Demands that any support provided to the private sector in the form of ODA come within the framework of the national plans and/or strategies of the partner countries, and that the amounts allocated be focused on the development of human resources, decent work, the sustainable management of natural resources and the development of high-quality inclusive public services for the benefit of the population; advocates safeguards to ensure that private companies respect human rights, offer decent jobs and pay their taxes in the countries where they operate;
59	Welcomes the proposals of the Agenda for change concerning aid effectiveness, in view of the importance of aid effectiveness in terms of improving quality of life, reducing poverty in recipient countries and achieving the MDGs, and urges more resolute EU action in this respect; underlines the importance of swift implementation of the Busan Partnership for effective development cooperation; takes the view that moving successfully from the concept of effective aid to that of cooperation for effective development requires a strong commitment from the EU and its international partners; hopes for a rapid international consensus on the working arrangements for the Global Partnership;
60	Believes that certain new challenges, particularly climate change and universal access to energy, are not sufficiently covered by the sectors of intervention selected in the Commission’s proposal;
61	Reiterates its demand to include in the Agenda for Change the obligations and duties of foreign investors operating in developing countries to respect human rights and environmental and ILO core labour standards; considers that EU companies should be legally liable in their home countries for violation of these obligations and duties by their subsidiaries abroad and for the entities they control;
62	Calls on the EU to recognise the right of developing countries to regulate investment, favour investors who support the partner country’s development strategy, and give preferential treatment to domestic and regional investors in order to promote regional integration;
63	Regrets that the Agenda for Change has not addressed the issue of land leasing in developing countries, which threatens local food security; expresses its deep concern over the current phenomenon of farmland acquisition by government-backed foreign investors, some of them from the EU, which risks undermining the EU’s policy for combating poverty;
64	Stresses the need to take account of the cross-sectional dimension of culture and the importance of including it in all external policies of the EU in general and in development policy in particular;
65	Believes that the Commission must maintain the monopoly of programming in the area of development and cooperation policies;
66	Instructs its President to forward this resolution to the Council, the Commission, the EEAS and the Governments and Parliaments of the Member States.
