A	whereas data protection and privacy are fundamental rights; whereas security measures, including counterterrorism measures, must therefore be pursued through the rule of law and must be subject to fundamental rights obligations, including those relating to privacy and data protection;
B	whereas information flows and data, which today dominate everyday life and are part of any person’s integrity, need to be as secure from intrusion as private homes;
C	whereas the ties between Europe and the United States of America are based on the spirit and principles of democracy, the rule of law, liberty, justice and solidarity;
D	whereas cooperation between the US and the European Union and its Member States in counter-terrorism remains vital for the security and safety of both partners;
E	whereas mutual trust and understanding are key factors in the transatlantic dialogue and partnership;
F	whereas following 11 September 2001, the fight against terrorism became one of the top priorities of most governments; whereas the revelations based on documents leaked by the former NSA contractor Edward Snowden put political leaders under the obligation to address the challenges of overseeing and controlling intelligence agencies in surveillance activities and assessing the impact of their activities on fundamental rights and the rule of law in a democratic society;
G	whereas the revelations since June 2013 have caused numerous concerns within the EU as to:
H	whereas the unprecedented magnitude of the espionage revealed requires full investigation by the US authorities, the European institutions and Member States’ governments, national parliaments and judicial authorities;
I	whereas the US authorities have denied some of the information revealed but have not contested the vast majority of it; whereas the public debate has developed on a large scale in the US and in certain EU Member States; whereas EU governments and parliaments too often remain silent and fail to launch adequate investigations;
J	whereas President Obama has recently announced a reform of the NSA and its surveillance programmes;
K	whereas in comparison to actions taken both by EU institutions and by certain EU Member States, the European Parliament has taken very seriously its obligation to shed light on the revelations on the indiscriminate practices of mass surveillance of EU citizens and, by means of its resolution of 4 July 2013 on the US National Security Agency surveillance programme, surveillance bodies in various Member States and their impact on EU citizens, instructed its Committee on Civil Liberties, Justice and Home Affairs to conduct an in-depth inquiry into the matter;
L	whereas it is the duty of the European institutions to ensure that EU law is fully implemented for the benefit of European citizens and that the legal force of the EU Treaties is not undermined by a dismissive acceptance of extraterritorial effects of third countries’ standards or actions;
M	whereas the District Court for the District of Columbia, in its Decision of 16 December 2013, has ruled that the bulk collection of metadata by the NSA is in breach of the Fourth Amendment to the US Constitution(27); whereas, however the District Court for the Southern District of New York ruled in its Decision of 27 December 2013 that this collection was lawful;
N	whereas a Decision of the District Court for the Eastern District of Michigan has ruled that the Fourth Amendment requires reasonableness in all searches, prior warrants for any reasonable search, warrants based upon prior-existing probable cause, as well as particularity as to persons, place and things and the interposition of a neutral magistrate between executive branch enforcement officers and citizens(28);
O	whereas in its report of 12 December 2013, the President’s Review Group on Intelligence and Communication Technology proposes 46 recommendations to the President of the United States; whereas the recommendations stress the need simultaneously to protect national security and personal privacy and civil liberties; whereas in this regard it invites the US Government: to end bulk collection of phone records of US persons under Section 215 of the USA PATRIOT Act as soon as practicable; to undertake a thorough review of the NSA and the US intelligence legal framework in order to ensure respect for the right to privacy; to end efforts to subvert or make vulnerable commercial software (backdoors and malware); to increase the use of encryption, particularly in the case of data in transit, and not to undermine efforts to create encryption standards; to create a Public Interest Advocate to represent privacy and civil liberties before the Foreign Intelligence Surveillance Court; to confer on the Privacy and Civil Liberties Oversight Board the power to oversee Intelligence Community activities for foreign intelligence purposes, and not only for counterterrorism purposes; and to receive whistleblowers’ complaints, to use Mutual Legal Assistance Treaties to obtain electronic communications, and not to use surveillance to steal industry or trade secrets;
P	whereas, according to an open memorandum submitted to President Obama by Former NSA Senior Executives/Veteran Intelligence Professionals for Sanity (VIPS) on 7 January 2014(29), the massive collection of data does not enhance the ability to prevent future terrorist attacks; whereas the authors stress that mass surveillance conducted by the NSA has resulted in the prevention of zero attacks and that billions of dollars have been spent on programmes which are less effective and vastly more intrusive on citizens' privacy than an in-house technology called THINTHREAD that was created in 2001;
Q	whereas in respect of intelligence activities concerning non-US persons under Section 702 of FISA, the Recommendations to the President of the USA recognise the fundamental principle of respect for privacy and human dignity as enshrined in Article 12 of the Universal Declaration of Human Rights and Article 17 of the International Covenant on Civil and Political Rights; whereas they do not recommend granting non-US persons the same rights and protections as US persons;
R	whereas in his Presidential Policy Directive on Signals Intelligence Activities of 17 January 2014 and the related speech, US President Barack Obama stated that mass electronic surveillance is necessary for the United States to protect its national security, its citizens and the citizens of US allies and partners, as well as to advance its foreign policy interests; whereas this policy directive contains certain principles regarding the collection, use and sharing of signals intelligence and extends certain safeguards to non-US persons, partly providing for treatment equivalent to that enjoyed by US citizens, including safeguards for the personal information of all individuals regardless of their nationality or residence; whereas, however, President Obama did not call for any concrete proposals, particularly regarding the prohibition of mass surveillance activities and the introduction of administrative and judicial redress for non-US persons;
S	whereas the report on the findings by the EU Co-Chairs of the ad hoc EU-US Working Group on data protection provides for an overview of the legal situation in the US, but has failed to establish the facts about US surveillance programmes; whereas no information has been made available about the so-called ‘second track’ Working Group, under which Member States discuss bilaterally with the US authorities matters related to national security;
T	whereas fundamental rights, notably freedom of expression, of the press, of thought, of conscience, of religion and of association, private life, data protection, as well as the right to an effective remedy, the presumption of innocence and the right to a fair trial and non-discrimination, as enshrined in the Charter of Fundamental Rights of the European Union and in the European Convention on Human Rights, are cornerstones of democracy; whereas mass surveillance of human beings is incompatible with these cornerstones;
U	whereas in all Member States the law protects from disclosure information communicated in confidence between lawyer and client, a principle which has been recognised by the European Court of Justice(30);
V	whereas in its resolution of 23 October 2013 on organised crime, corruption and money laundering Parliament called on the Commission to submit a legislative proposal establishing an effective and comprehensive European whistleblower protection programme in order to protect EU financial interests and furthermore conduct an examination on whether such future legislation should also cover other fields of Union competence;
W	whereas according to Article 67(3) TFEU the EU ‘shall endeavour to ensure a high level of security’; whereas the provisions of the Treaty (in particular Article 4(2) TEU, Article 72 TFEU and Article 73 TFEU) imply that the EU possesses certain competences on matters relating to the collective security of the Union; whereas the EU has competence in matters of internal security (Article 4(j) TFEU) and has exercised this competence by deciding on a number of legislative instruments and concluding international agreements (PNR, TFTP) aimed at fighting serious crime and terrorism, and by setting up an internal security strategy and agencies working in this field;
X	whereas the Treaty on the Functioning of the European Union states that ‘it shall be open to Member States to organise between themselves and under their responsibility such forms of cooperation and coordination as they deem appropriate between the competent departments of their administrations responsible for safeguarding national security’ (Article 73 TFEU);
Y	whereas Article 276 TFEU states that ‘in exercising its powers regarding the provisions of Chapters 4 and 5 of Title V of Part Three relating to the area of freedom, security and justice, the Court of Justice of the European Union shall have no jurisdiction to review the validity or proportionality of operations carried out by the police or other law enforcement services of a Member State or the exercise of the responsibilities incumbent upon Member States with regard to the maintenance of law and order and the safeguarding of internal security’;
Z	whereas the concepts of ‘national security’, ’internal security’, ‘internal security of the EU’ and ’international security’ overlap; whereas the Vienna Convention on the Law of Treaties, the principle of sincere cooperation among EU Member States and the human rights law principle of interpreting any exemptions narrowly point towards a restrictive interpretation of the notion of ‘national security’ and require that Member States refrain from encroaching upon EU competences;
AA	whereas the European Treaties confer on the European Commission the role of the ‘Guardian of the Treaties’, and it is therefore the legal responsibility of the Commission to investigate any potential breaches of EU law;
AB	whereas, in accordance with Article 6 TEU, referring to the EU Charter of Fundamental Rights and the ECHR, Member States’ agencies and even private parties acting in the field of national security also have to respect the rights enshrined therein, be they of their own citizens or of citizens of other states;
AC	whereas the extraterritorial application by a third country of its laws, regulations and other legislative or executive instruments in situations falling under the jurisdiction of the EU or its Member States may impact on the established legal order and the rule of law, or even violate international or EU law, including the rights of natural and legal persons, taking into account the extent and the declared or actual aim of such an application; whereas, in these circumstances, it is necessary to take action at Union level to ensure that the EU values enshrined in Article 2 TEU, the Charter of Fundamental Rights, the ECHR referring to fundamental rights, democracy and the rule of law, and the rights of natural and legal persons as enshrined in secondary legislation applying these fundamental principles, are respected within the EU, for example by removing, neutralising, blocking or otherwise countering the effects of the foreign legislation concerned;
AD	whereas the transfer of personal data by EU institutions, bodies, offices or agencies or by the Member States to the US for law enforcement purposes in the absence of adequate safeguards and protections for the respect of the fundamental rights of EU citizens, in particular the rights to privacy and the protection of personal data, would make that EU institution, body, office or agency or that Member State liable, under Article 340 TFEU or the established case law of the CJEU(31), for breach of EU law – which includes any violation of the fundamental rights enshrined in the EU Charter;
AE	whereas the transfer of data is not geographically limited, and, especially in a context of increasing globalisation and worldwide communication, the EU legislator is confronted with new challenges in terms of protecting personal data and communications; whereas it is therefore of the utmost importance to foster legal frameworks on common standards;
AF	whereas the mass collection of personal data for commercial purposes and in the fight against terror and serious transnational crime puts at risk the personal data and privacy rights of EU citizens;
AG	whereas the US data protection legal framework does not ensure an adequate level of protection for EU citizens;
AH	whereas, in order to enable EU data controllers to transfer personal data to an entity in the US, the Commission, in its Decision 2000/520/EC, has declared the adequacy of the protection provided by the Safe Harbour privacy principles and the related FAQs issued by the US Department of Commerce for personal data transferred from the Union to organisations established in the US that have joined the Safe Harbour;
AI	whereas in its resolution of 5 July 2000 Parliament expressed doubts and concerns as to the adequacy of the Safe Harbour, and called on the Commission to review the decision in good time, in the light of experience and of any legislative developments;
AJ	whereas in Parliament’s working document 4 on US Surveillance activities with respect to EU data and its possible legal implications on transatlantic agreements and cooperation of 12 December 2013, the rapporteurs expressed doubts and concerns as to the adequacy of Safe Harbour and called on the Commission to repeal the decision on the adequacy of Safe Harbour and to find new legal solutions;
AK	whereas Commission Decision 2000/520/EC stipulates that the competent authorities in Member States may exercise their existing powers to suspend data flows to an organisation that has self-certified its adherence to the Safe Harbour principles, in order to protect individuals with regard to the processing of their personal data in cases where there is a substantial likelihood that the Safe Harbour principles are being violated or that the continuing transfer would create an imminent risk of grave harm to data subjects;
AL	whereas Commission Decision 2000/520/EC also states that where evidence has been provided that anybody responsible for ensuring compliance with the principles is not effectively fulfilling their role, the Commission must inform the US Department of Commerce and, if necessary, present measures with a view to reversing or suspending the Decision or limiting its scope;
AM	whereas in its first two reports on the implementation of the Safe Harbour, published in 2002 and 2004, the Commission identified several deficiencies as regards the proper implementation of the Safe Harbour and made a number of recommendations to the US authorities with a view to rectifying those deficiencies;
AN	whereas in its third implementation report, of 27 November 2013, nine years after the second report and without any of the deficiencies recognised in that report having been rectified, the Commission identified further wide-ranging weaknesses and shortcomings in the Safe Harbour and concluded that the current implementation could not be maintained; whereas the Commission has stressed that wide-ranging access by US intelligence agencies to data transferred to the US by Safe Harbour-certified entities raises additional serious questions as to the continuity of protection of the data of EU data subjects; whereas the Commission addressed 13 recommendations to the US authorities and undertook to identify by summer 2014, together with the US authorities, remedies to be implemented as soon as possible, forming the basis for a full review of the functioning of the Safe Harbour principles;
AO	whereas on 28-31 October 2013 a delegation of the European Parliament’s Committee on Civil Liberties, Justice and Home Affairs (LIBE Committee) met in Washington D.C	with the US Department of Commerce and the US Federal Trade Commission; whereas the Department of Commerce acknowledged the existence of organisations having self-certified adherence to Safe Harbour Principles but clearly showing a ‘not-current status’, meaning that the company does not fulfil Safe Harbour requirements although continuing to receive personal data from the EU; whereas the Federal Trade Commission admitted that the Safe Harbour should be reviewed in order to improve it, particularly with regard to complaints and alternative dispute resolution systems;
AP	whereas Safe Harbour Principles may be limited 'to the extent necessary to meet national security, public interest, or law enforcement requirements'; whereas, as an exception to a fundamental right, such an exception must always be interpreted restrictively and be limited to what is necessary and proportionate in a democratic society, and the law must clearly establish the conditions and safeguards to make this limitation legitimate; whereas the scope of application of such exception should have been clarified by the US and the EU, notably by the Commission, to avoid any interpretation or implementation that nullifies in substance the fundamental right to privacy and data protection, among others; whereas, consequently, such an exception should not be used in a way that undermines or nullifies the protection afforded by Charter of Fundamental Rights, the ECHR, the EU data protection law and the Safe Harbour principles; insists that if the national security exception is invoked, it must be specified under which national law;
AQ	whereas large-scale access by US intelligence agencies has seriously eroded transatlantic trust and negatively impacted on trust as regards US organisations acting in the EU; whereas this is further exacerbated by the lack of judicial and administrative redress for EU citizens under US law, particularly in cases of surveillance activities for intelligence purposes;
AR	whereas according to the information revealed and to the findings of the inquiry conducted by the LIBE Committee, the national security agencies of New Zealand, Canada and Australia have been involved on a large scale in mass surveillance of electronic communications and have actively cooperated with the US under the so- called ‘Five Eyes’ programme, and may have exchanged with each other personal data of EU citizens transferred from the EU;
AS	whereas Commission Decisions 2013/65/EU(32) and 2002/2/EC(33) have declared the levels of protection ensured by, respectively, the New Zealand Privacy Act and the Canadian Personal Information Protection and Electronic Documents Act to be adequate; whereas the aforementioned revelations also seriously affect trust in the legal systems of these countries as regards the continuity of protection afforded to EU citizens; whereas the Commission has not examined this aspect;
AT	whereas Directive 95/46/EC provides that international transfers to a third country may also take place by means of specific instruments whereby the controller adduces adequate safeguards with respect to the protection of the privacy and fundamental rights and freedoms of individuals and as regards the exercise of the corresponding rights;
AU	whereas such safeguards may in particular result from appropriate contractual clauses;
AV	whereas Directive 95/46/EC empowers the Commission to decide that specific standard contractual clauses offer sufficient safeguards required by the Directive, and whereas on this basis the Commission has adopted three models of standard contractual clauses for transfers to controllers and processors (and sub-processors) in third countries;
AW	whereas the Commission Decisions establishing the standard contractual clauses stipulate that the competent authorities in Member States may exercise their existing powers to suspend data flows where it is established that the law to which the data importer or a sub-processor is subject imposes upon them requirements to derogate from the applicable data protection law which go beyond the restrictions necessary in a democratic society as provided for in Article 13 of Directive 95/46/EC, where those requirements are likely to have a substantial adverse effect on the guarantees provided by the applicable data protection law and the standard contractual clauses, or where there is a substantial likelihood that the standard contractual clauses in the annex are not being or will not be complied with and the continuing transfer would create an imminent risk of grave harm to the data subjects;
AX	whereas national data protection authorities have developed binding corporate rules (BCRs) in order to facilitate international transfers within a multinational corporation with adequate safeguards with respect to the protection of the privacy and fundamental rights and freedoms of individuals and as regards the exercise of the corresponding rights; whereas before being used, BCRs need to be authorised by the Member States’ competent authorities after the latter have assessed compliance with Union data protection law; whereas BCRs for data processors have been rejected in the LIBE Committee report on the General Data Protection Regulation, as they would leave the data controller and the data subject without any control over the jurisdiction in which their data is processed;
AY	whereas the European Parliament, given its competence stipulated by Article 218 TFEU, has the responsibility to continuously monitor the value of international agreements it has given its consent to;
AZ	whereas in its resolution of 23 October 2013 Parliament expressed serious concerns over the revelations concerning the NSA’s activities as regards direct access to financial payments messages and related data, which would constitute a clear breach of the TFTP Agreement, and in particular Article 1 thereof;
BA	whereas terrorist finance tracking is an essential tool in the fight against terrorism financing and serious crime, allowing counterterrorism investigators to discover links between targets of investigation and other potential suspects connected with wider terrorist networks suspected of financing terrorism;
BB	whereas Parliament asked the Commission to suspend the Agreement and requested that all relevant information and documents be made available immediately for Parliament’s deliberations; whereas the Commission has done neither;
BC	whereas following the allegations published by the media, the Commission decided to open consultations with the US pursuant to Article 19 of the TFTP Agreement; whereas on 27 November 2013 Commissioner Malmström informed the LIBE Committee that, after meeting US authorities and in view of the replies given by the US authorities in their letters and during their meetings, the Commission had decided not to pursue the consultations on the grounds that there were no elements showing that the US Government has acted in a manner contrary to the provisions of the Agreement, and that the US has provided written assurance that no direct data collection has taken place contrary to the provisions of the TFTP agreement; whereas it is not clear whether the US authorities have circumvented the Agreement by accessing such data through other means, as indicated in the letter of 18 September 2013 from the US authorities(34);
BD	whereas during its visit to Washington of 28-31 October 2013 the LIBE delegation met with the US Department of the Treasury; whereas the US Treasury stated that since the entry into force of the TFTP Agreement it had not had access to data from SWIFT in the EU except within the framework of the TFTP; whereas the US Treasury refused to comment on whether SWIFT data would have been accessed outside TFTP by any other US government body or department or whether the US administration was aware of NSA mass surveillance activities; whereas on 18 December 2013 Mr Glenn Greenwald stated before the inquiry held by the LIBE Committee that the NSA and GCHQ had targeted SWIFT networks;
BE	whereas the Belgian and Netherlands data protection authorities decided on 13 November 2013 to conduct a joint investigation into the security of SWIFT’s payment networks in order to ascertain whether third parties could gain unauthorised or unlawful access to European citizens’ bank data(35);
BF	whereas according to the Joint Review of the EU-US PNR agreement, the US Department of Homeland Security (DHS) made 23 disclosures of PNR data to the NSA on a case-by-case basis in support of counterterrorism cases, in a manner consistent with the specific terms of the Agreement;
