A	whereas the inauguration of the new US President opens up a new era in the history of the United States, has been received with great expectations in the world and has the potential to give the transatlantic partnership a new impetus,
B	whereas the European Union is an increasingly important player on the world stage and whereas, once the Lisbon Treaty with its foreign policy tools comes into effect, the EU will be able to play a stronger and more coherent role on the international scene,
C	whereas according to surveys most Europeans support the idea that the EU should assume a more prominent role on the world stage; whereas the majority of Europeans and Americans feel that the EU and the US should address international threats in partnership,
D	whereas many Europeans expect from the new US administration a cooperative attitude in the international field and a strengthening of the EU-US relationship, based on mutual respect and mutual understanding of the partners' constraints and priorities,
E	whereas the transatlantic partnership must remain a cornerstone of the external action of the Union,
F	whereas the transatlantic partnership is founded on shared core values such as democracy, human rights, the rule of law and multilateralism as well as common goals such as open and integrated economies and sustainable development; whereas this foundation remains solid in spite of some differences in the last years,
G	whereas the EU and the US play key roles in the world's politics and economy, and share responsibility for promoting peace, respect for human rights and stability and for tackling various global dangers and challenges, such as the deep financial crisis, the eradication of poverty and fulfilment of other MDGs, climate change, energy security, terrorism and nuclear proliferation,
H	whereas in an increasingly global, complex and changing world, it is in the interest of both partners, the EU and the US, to shape the international environment together and to confront in unison common threats and challenges on the basis of international law and multilateral institutions, in particular the UN system, and to invite other partners to cooperate in this effort,
I	"whereas it is necessary to involve emerging players in responsibility for the world order, because, as the then presidential candidate Barack Obama said in Berlin in July 2008, ""no one nation, no matter how large or powerful"", can defeat global challenges alone,"
J	whereas, given the importance of their relationship and their responsibility for the international order, and given the changes that both partners and the world are undergoing, it is necessary that the EU-US  partnership be founded on a solid and updated basis such as a new partnership agreement,
K	whereas the transatlantic partnership and NATO are indispensable for collective security,
L	whereas the work of the Transatlantic Economic Council (TEC) needs to continue towards the goal of a genuine, integrated transatlantic market; whereas joint leadership is needed to conduct a decisive reform of the international economic institutions in the current crisis,
M	whereas the gross domestic product (GDP) of the EU and the US represents more than half of the global GDP; whereas the two partners have the world's largest bilateral trade and investment partnership, with, according to the Commission, almost 14 million jobs in the EU and US dependent on transatlantic commercial and investment ties,
1	"Congratulates Barack Obama on his election as President of the United States of America; recalls his emphatic commitment to the transatlantic partnership made in his Berlin speech in July 2008, in which he said that ""America has no better partner than Europe"" and added that now was the time to join together to meet the challenges of the 21st century; reiterates its invitation to President Obama to address the European Parliament in plenary during his first official visit to Europe;"
2	Calls on the Council, the EU Member States and the Commission to enhance the coordination and coherence of the EU's policy vis-à-vis the new US administration;
3	Is convinced that the EU-US relationship is the most important strategic partnership for the EU; believes that EU-US coordinated action on tackling global challenges while respecting international law and strengthening multilateralism is of fundamental importance for the international community; urges the Czech Presidency of the Council and the Commission to establish with the new US administration a common agenda of short and long-term goals with regard to both bilateral matters and global and regional issues and conflicts;
4	Warmly welcomes the upcoming summit to be held in Prague on 5 April 2009 between President Obama and the 27 EU Heads of State and Government, and hopes that that meeting will provide a strong impetus for the strengthening of the transatlantic relationship and the establishment of a common agenda;
5	Underlines that the current momentum should also be used to improve and renew the framework of the transatlantic relationship; insists on the need to replace the existing NTA of 1995 with a new Transatlantic Partnership Agreement, providing a more stable and a more up-to-date basis for the relationship;
6	Deems it appropriate for the negotiation of the new agreement to commence once the Lisbon Treaty comes into force, so that it may be completed before 2012;
7	Is convinced that the TEC, as the body responsible for enhancing economic integration and regulatory cooperation, should be included in the new agreement; welcomes the fact that the TEC is advised by a range of stakeholders, including representatives of business, and asks that a comparable role be given to representatives of the trade union movement on each side of the Atlantic;
8	Recommends that the EU-US summits take place twice a year, in order to provide the partnership with strategic direction and impetus, and that they proceed to exercise adequate oversight regarding implementation of the objectives previously identified;
9	Is of the view that the new agreement should establish a body for systematic high-level consultation and coordination in respect of foreign and security policy; recommends that this body be chaired by the High Representative/Vice-President of the Commission on the EU side and by the Secretary of State on the US side, and that it meet at least every three months, without prejudice to informal contacts; suggests that this mechanism could be called the Transatlantic Political Council (TPC);
10	Reaffirms that the new agreement should upgrade the current TLD into a transatlantic assembly, serving as a forum for parliamentary dialogue, identification of objectives and joint scrutiny of the implementation of the agreement, and for coordination of the work of both the European Parliament and the US Congress on issues of common concern, including close cooperation of committees and rapporteurs from both sides; considers that this assembly should meet in plenary twice a year and be comprised on an equal basis of both Members of the European Parliament and Members of both Houses of the US Congress; is of the view that the assembly could establish working groups to prepare the plenary meetings; reiterates that a reciprocal legislative early-warning system should be created within this assembly; believes that a steering committee should be responsible for enhancing cooperation between the legislative committees and rapporteurs of the European Parliament and the US Congress on legislation which is relevant with regard to further integration of the transatlantic market and in particular to the work of the TEC;
11	Considers that the transatlantic assembly should be kept informed by the TEC and the TPC about their activities, including the right to conduct hearings with representatives of those Councils, and that it should be able to make proposals to both Councils and to the EU-US summits; requests that, besides strengthening the role of parliamentarians within the TEC, both co-chairs of the assembly be invited to participate in the opening session of meetings of both Councils and of the EU-US summits;
12	Invites the US Congress, in full cooperation with the European Parliament, to reflect on the possibility of setting up a US Congress liaison office in Brussels;
13	Invites Parliament's Secretary-General to proceed as a matter of the utmost urgency with the implementation of the Bureau's decision of 11 December 2006 on the deployment of an official to Washington as Liaison Officer;
14	Insists on the advantages of a joint programme of staff exchanges and invites Parliament's Secretary-General to examine with the clerks of the US House of Representatives and the Senate the feasibility of a joint memorandum on staff exchanges similar to that agreed between Parliament and the UN Secretariat;
15	Underlines that the transatlantic partnership must be backed up by a deep understanding and closer ties between the parties' civil societies; insists on the need to increase exchanges among students, academics and other civil society actors from both sides so as to ensure that present and future generations gain mutual understanding and remain committed to this partnership; considers that back-up support for this initiative should be provided from the 2010 EU budget and from the relevant US institutions' budgets so as to ensure its effective development;
16	Warmly welcomes the growing presence of organisations of American parentage in Brussels and in particular their commitment to the European Union, its institutions and a strengthened EU-US partnership; stresses that European organisations need to give a similar commitment to operate in Washington DC in order to raise the profile of the EU and that of European perspectives on transatlantic and global issues in the US political community; is aware that European institutions are often unable to match the resources available to their American counterparts; therefore suggests that funding be made available and prioritised for projects organised by European organisations which are aimed at enhancing the awareness and understanding of European issues and perspectives in the United States;
17	Calls on the EU and the US to strengthen their cooperation in the field of culture, and to continue to foster and promote the mutual benefits resulting from cultural exchanges;
18	Stresses the importance of closer cooperation in space programmes, in particular between the ESA (European Space Agency) and NASA;
19	Urges both partners to engage in effective multilateralism, involving emerging players in a spirit of shared responsibility for the global order, respect for international law and common problems; insists that the EU and the US increase their efforts to accomplish the UN Reform Agenda, including the reform of the UN Security Council and of other multilateral forums within the global architecture;
20	Calls on both partners to promote respect for human rights in the world as a key element of their policy; underlines the need for intensive coordination in preventive and crisis diplomacy, as well as in responding in a coordinated and efficient way to pandemics and humanitarian emergencies; calls on the new US administration to ratify and accede to the Rome Statute of the International Criminal Court; repeats its appeal for the abolition of the death penalty;
21	Calls on both partners to contribute decisively to the achievement of the MDGs, particularly in Africa, which must not be placed in jeopardy by the economic crisis, and to study possibilities for coordinated action in those areas; calls on both partners to honour their commitment to spend 0.7 % of their GDP on development cooperation;
22	Calls on both partners to jointly lead the multilateral efforts, launched at the Washington Conference on 15 November 2008, to resolve the current financial and economic crisis and to reform the international financial system, the World Bank and the IMF, involving the emerging powers, while resisting protectionism and promoting a successful conclusion of the WTO Doha round;
23	Welcomes the strong commitment of the new US President to tackling climate change; urges the EU and the US to take the lead and to reach an ambitious post-2012 agreement at the Copenhagen Conference to be held in 2009, engaging all relevant gas-emitting countries and committing them to binding mid- and long-term targets;
24	Calls for closer cooperation between the EU and the US in the field of energy; urges that efficient coordination of their approaches towards the producing countries and strengthening diversity in supply, resources and transportation be regarded as a priority; advocates closer scientific and technological cooperation on energy and energy efficiency;
25	"Draws attention to the National Intelligence Council (NIC) report entitled ""Global Trends 2025: A Transformed World"", and, given the need for long-term strategic thinking on policy issues within the EU institutions, urges the Czech (from January to June 2009) and Swedish (from July to December 2009) Presidencies to strive to establish a system of analysis similar to that used by the NIC, in order to identify long-term trends from an EU perspective, working in close cooperation with the EU Institute for Security Studies; is convinced that this step will facilitate dialogue on the main strategic issues faced by the transatlantic partnership in the long term;"
26	Underlines that a peaceful and just settlement of the Middle East conflict is vital, and welcomes the fact that it will represent one of the most urgent priorities of the new US administration; asks the US administration to coordinate closely with the EU and engage in the Quartet; welcomes the early appointment of a US special envoy for the Middle East in the person of the former Senator George Mitchell; emphasises that both partners should strive for intensification of the negotiations based on the road map and the Annapolis Conference achievements, with the objective of a two-state solution; urges both partners to work closely together in order to help make the current fragile ceasefire in Gaza solid and durable, while involving the regional actors and contributing to the achievement of the goals of UN Security Council Resolution 1860 of 8 January 2009 (S/RES/1860(2009)), such as an immediate humanitarian relief for the population of Gaza and the assurance that illicit trafficking in arms and ammunition is prevented and the blockade of Gaza is lifted; calls on the transatlantic partners to support efforts for inter-Palestinian reconciliation, and points out the importance of improving the living conditions of Palestinians in both the West Bank and Gaza, including the reconstruction of Gaza;
27	Urges the EU and the US to work together in renewing strategies to promote efforts to strengthen respect for human rights and democracy in the Middle East, based on their economic and soft power in the region;
28	Underlines that the values, security and credibility of the transatlantic community are at stake in Afghanistan; urges the EU, the US, NATO and the UN to come up with a new joint strategic concept which comprehensively integrates the components of the international engagement, in order to increase security in all regions, strengthen the Afghan governmental and local institutions and aid nation-building and prosperity in close cooperation with neighbouring states; considers that the final goal must be a gradual handover of responsibility for security and stability into the hands of the Afghan authorities; recalls UN Security Council resolution 1833 of 22 September 2008 (S/RES/1833(2008)), which encourages all Afghan parties and groups to engage constructively in political dialogue and to avoid resorting to violence;
29	Calls on the EU and the US to develop a joint strategy towards Pakistan, aimed at strengthening its democratic institutions, the rule of law and its ability to fight terrorism, while encouraging Pakistan's involvement in responsibility for stability in the region, including the security of the Afghan border, and full governmental control of Pakistan's border provinces and tribal areas; welcomes the nomination of Richard Holbrooke as a single special envoy for the Pakistan-Afghan region;
30	Underlines that the Iranian nuclear programme endangers the non-proliferation system and stability in the region and the world; welcomes the announcement by President Obama that consideration will be given to direct contacts with the Iranian side and supports the objective, pursued jointly by both partners, of finding a negotiated solution with Iran, following the dual strategy of dialogue and sanctions, in coordination with other members of the Security Council and the International Atomic Energy Agency; considers that any initiatives that one of the partners may launch concerning Iran must be closely coordinated between them in a spirit of trust and transparency; calls on the transatlantic partners to define as soon as possible a common approach towards Iran, without waiting until the issue needs to be confronted as a matter of urgency;
31	Welcomes the ratification of the US-Iraqi agreement on the presence in Iraq of US military forces; underlines the readiness of the EU to continue helping with the reconstruction of Iraq, in particular focusing on the rule of law, respect for human rights,  consolidation of the state institutions and support for the economic development of Iraq and its reintegration into the world economy; calls on the partners to continue, by means of coordinated efforts, to work with the Iraqi government and the UN in order to improve stability and national reconciliation and to contribute to the unity and independence of Iraq;
32	Urges both parties to closely coordinate their policies towards Russia; conscious of Russia's relevance as a neighbouring country, of its interdependence with the EU and of its role as a major player on the regional and global level, emphasises the importance of building up with Russia constructive cooperation on challenges, threats and opportunities of mutual concern, including security matters, disarmament and non-proliferation, while respecting democratic principles, human rights standards and international law; underlines in this regard the need to enhance mutual trust between the transatlantic partners and Russia and to intensify the cooperation within the NATO-Russia Council; calls on both transatlantic partners to closely coordinate their approach towards any reform of the European security architecture, while observing the OSCE principles and maintaining the coherence of NATO; considers that developments in this architecture, which also involves international arrangements such as the Treaty on Conventional Forces in Europe, need to be addressed in dialogue with Russia and also other non-EU OSCE member countries;
33	Welcomes the recent statements by US Vice-President Joe Biden at the European Security Conference in Munich indicating that the US will continue the consultations with its NATO allies and Russia on the US missile defence system and adding that the new administration would consider the costs and efficiency of the system; notes some signals from Russia that it would suspend the plans to station short-range Iskander missiles in Kaliningrad;
34	Calls on the EU and US to develop a common strategy concerning the six eastern European countries (Moldova, Ukraine, Georgia, Armenia, Azerbaijan and Belarus), encompassed by the European Neighbourhood Policy, in order to achieve substantial and lasting results in the implementation of the new Eastern Partnership and Black Sea Synergy;
35	Urges both partners to pay special attention to Latin America and its regional organisations in particular, coordinating efforts to promote the consolidation of democracy, respect for human rights, good governance, the fight against poverty, the strengthening of social cohesion, market economies, the rule of law including the fight against organised crime and drug trafficking, and supporting regional integration as well as cooperation in respect of climate change;
36	Recommends also the promotion of a common approach to other major geopolitical players such as China, India or Japan, as well as to the various crises and problems in sub-Saharan Africa;
37	Underlines the importance of NATO as the cornerstone of transatlantic security; welcomes the decision by the European Council in December 2008 to strengthen the strategic partnership between the EU and NATO, and calls on both partners to accelerate the creation of an EU-NATO high-level group in order to improve cooperation between the two organisations; suggests that discussions be held on the value of a Euro-Atlantic Security Strategy that could define common security concerns and interests;
38	Emphasises the growing importance of the European Security and Defence Policy and the need to continue improving the civilian and military capabilities of Europe; welcomes the recognition by the Bucharest NATO summit held in April 2008 of the value of an enhanced European defence capability for the strengthening of transatlantic security;
39	Invites the EU and the US to adopt a common strategy in all international forums, in particular the UN, on disarmament of weapons of mass destruction and conventional weaponry; urges the new US administration to re-engage with Russia in the area of arms control and disarmament, extending the two countries' current bilateral agreements; stresses the need for closer cooperation in order to ensure progress in the run-up to the NPT Review Conference in 2010, welcomes the commitment of the new US President to ratification of the Comprehensive Nuclear-Test-Ban Treaty;
40	Underlines the importance of strengthening transatlantic cooperation in the fight against terrorism on the basis of full respect for international law and human rights, and of supporting the role of the UN in combating this threat; points out the need to cooperate closely when the lives of hostages are at risk;
41	Welcomes the decision of US President Barack Obama to close the detention facility at Guantánamo Bay, as well as other related executive orders concerning lawful interrogations and CIA detention facilities, and encourages the US administration to close down any detention centres outside the United States which are not in accordance with international law, and to put an end explicitly to the policy of extraordinary rendition; calls on the Member States, should the US administration so request, to cooperate in finding, on a case-by case basis, solutions to the issue of accepting some of the Guantánamo inmates in the EU while respecting the duty of loyal cooperation to consult each other regarding possible effects on public security throughout the EU;
42	Stresses the importance of the prompt entry into force of the EU-US Extradition and Legal Assistance Agreements, and urges those Member States that have not yet ratified them to do so as soon as possible; emphasises that the effective implementation of those agreements requires a high degree of mutual trust built on full respect by all parties of human rights obligations, defence and fair trial rights and the rule of domestic and international law;
43	Underlines that the sharing of data and information is a valuable tool in the international fight against terrorism and transnational crime, but stresses that this must take place within a proper legal framework, ensuring adequate protection of civil liberties, including the right to privacy, and that it should be based on a binding international agreement, as agreed at the 2008 EU-US Summit;
44	Welcomes the recent extension of the visa waiver programme to another seven EU Member States; however, urges the US to lift the visa regime for the remaining five Member States and to treat all EU citizens equally and on the basis of full reciprocity; asks the Commission to treat this as a priority matter with the new US administration;
45	Is of the view that close EU-US cooperation in the area of justice and home affairs is also necessary in order to gradually build a transatlantic area of freedom, security and justice;
46	Urges the partners to use the full potential of the TEC in order to overcome the existing obstacles to economic integration and to achieve a unified transatlantic market by 2015; requests the Commission, on the basis of the study authorised and financed by the European Parliament in its 2007 Budget, to draw up a detailed road map of existing obstacles which need to be removed with the aim of meeting that target date;
47	Underlines the importance of using the TEC also as a framework for macro-economic cooperation between both partners, and encourages the competent monetary institutions to strengthen their coordination;
48	Welcomes the progress that has been made over recent months in promoting transatlantic economic integration; considers, in particular, that in areas such as investment, accounting standards, regulatory issues, the safety of imported products and the enforcement of intellectual property rights, improved cooperation has already resulted in significant progress and must be continued;
49	Believes, at the same time, that transatlantic economic cooperation must be made more accountable, transparent and predictable; considers that schedules of meetings, agendas, roadmaps and progress reports must be agreed upon between the core stakeholders as early as possible and should then be published on a website;
