62	Calls on the Commission to complete the wider neighbourhood action plan, on which it has been working since 1999, and to identify the factors that will help ORs to become more closely integrated into the geographical regions in which they are located, as well as the barriers to such integration; draws attention in this context to the particularly close historical and cultural relations that each OR has with non-EU countries and to the potential for developing economic, trade and cooperation relations with various regions of the world;
63	Calls on the Commission to take greater account of the impact that trade agreements concluded with non-EU countries have on OR economies, with impact studies being conducted in advance of each agreement in order to ensure that any 'sensitive' products are protected and fair compensation is provided for any losses incurred in specific sectors; calls also for a procedure for consulting OR regional authorities to be introduced; recommends that the Commission should arrange for periodic studies to be carried out in respect of the international agreements currently in force, in order to assess and take proper account of the  vulnerability of OR markets;
64	Criticises the failure to take account of OR interests in the agreements concluded with Latin American and ACP countries, as well as the fact that no impact assessments were conducted prior to the negotiation of those agreements;
65	Calls on the Commission to negotiate the inclusion in all trade agreements with ACP countries that lie close to ORs a specific section on the creation of an OR-ACP market, with a view to integrating ORs more closely into their geographical neighbourhood;
66	Draws attention to the fact that the ORs can be a real asset for the EU in connection with building humanitarian response capacity and deploying it when natural disasters occur; recommends, in this connection, that a European civil protection force should be set up;
67	Draws attention to the fact that a number of fundamental problems exist in the ORs, one of them being social exclusion; points out that thematic objective 9 of the new cohesion policy covers social inclusion and action against poverty and all forms of discrimination and that support for the most deprived sections of society is an ERDF investment priority;
68	Welcomes the adoption of the FEAD Regulation and calls for it to be fully and properly implemented in the ORs;
69	Points out that some ORs are faced with major housing shortages stemming from, among other things, strong population growth; advocates the establishment of a social housing investment scheme and the introduction of special measures under which aid in support of investment in social housing is not considered to be State aid; points out that other ORs are facing growing desertification, which is also leading to deterioration of their characteristic built environment, and that this latter problem has to be tackled by supporting urban regeneration and stimulating economic activities suited to the areas affected, so as to encourage the population to remain there;
70	Points out that some ORs are located in areas in which industrial competition is fierce, in particular owing to low labour costs and an abundant supply of raw materials in neighbouring countries; draws attention to the fact that thematic objectives 3 and 8 of the 2014-2020 cohesion policy cover action to enhance SME competitiveness and promote high-quality sustainable employment;
71	Points out that, although they show a healthy start-up rate despite the crisis, very small and small and medium-sized businesses in the ORs are finding it increasingly difficult to gain access to financing, and that this is jeopardising their development and future survival;
72	Welcomes in this connection the objectives set for the future COSME programme, under which support will be provided to European SMEs, in particular as regards access to finance and to new markets; welcomes the development of the Progress Microfinance Facility; calls on the Commission to ensure that these programmes are implemented efficiently in the ORs as well and welcomes the possibility of dialogue with the EIB and the European Investment Fund in order to explore avenues for improving access to financing for OR SMEs with a view to setting up local investment funds in each OR and developing regional investment capital markets;
73	Stresses that the economic development model for each OR needs to be geared to harnessing its potential; points out, for example, that the shortage of waste processing facilities provides an opportunity to make substantial headway in terms of both job creation and environmental protection;
74	Welcomes the recent opening of the public consultation on a Green Action Plan for SMEs; calls on the Commission to take proper account of the problems and expertise of outermost-region SMEs in this area when it draws up its conclusions on that consultation;
75	Stresses that tourism is a key economic driver in the ORs; considers it essential therefore for joint ERDF-COSME support to be provided for efforts to expand and modernise the ORs’ hotel network, in order to help diversify and develop the sustainable tourism services on offer in the ORs;
76	Considers that thought should be given to simplifying visa policies in respect of both EU Member States and some non-EU countries, in order to streamline formalities for tourists and foster the development of multi-destination tourism in the ORs and neighbouring countries;
77	Notes that some ORs are highly multicultural societies and points to the need for cultural interchange between the ORs and mainland Europe; calls on the Commission to allow projects from ORs to be funded under the Creative Europe programme;
78	Calls on the Commission to draw up a strategy for the development and dissemination of the ORs' cultural heritage, using the Euromed Heritage IV programme as a model;
79	Instructs its President to forward this resolution to the Council and the Commission.
