76	Emphasises that the resilience of terrestrial as well as marine ecosystems ultimately depends on the preservation of biological diversity;
77	Highlights the fact that existing EU legislation, such as the Water Framework Directive(10) and the Marine Strategy Framework Directive(11), can help to address ecosystem resilience in Europe as long as management plans incorporate an ecosystems-based approach; calls on the Commission and Member States to attach the highest priority to implementing these policies;
78	Stresses the importance of studying the phenomenon of the invasion of European ecosystems by alien species (e.g	tropical marine species in the Mediterranean) and of developing suitable policies to counter it;
79	Stresses the fact that urban areas in Europe accommodate nearly 75% of the population and that climate change is one additional factor impacting on quality of life in towns and cities; urges the EEA to study the expected impact of climate change on micro-climates in urban areas (taking into account, for example, the urban heat-island effect);
80	Emphasises that climate change is likely to induce large-scale environmental migration from regions which are already at the origin of migration flows to Europe (Africa, the Middle East, south and south-east Asia);
81	Stresses that environmental migration should be taken into account in the long-term planning of development assistance policy, so that timely prevention and prompt humanitarian response measures can be taken in the countries of origin;
82	Stresses the importance of developing adaptation measures which take into account all aspects of European cultural heritage;
83	Stresses the need for local and regional authorities to be recognised as pivotal actors in the struggle against the harmful effects of climate change;
84	Emphasises the importance of having the appropriate level of intervention, cross-sectoral integration and resilient environmental underpinning in order to maximise the effectiveness of the measures implemented;
85	Calls on the Commission and the Member States to encourage a coordinated approach when dealing with adaptation to guarantee territorial cohesion across the EU;
86	Is of the view that measures should be taken that reconcile economically innovative and sustainable action with protection of the natural environment and thus minimise conflicts of use between ecological and economic interests;
87	Urges the Commission to act on the proposals to introduce mandatory National and Regional Adaptation Strategies;
88	Invites the Commission to develop a comprehensive approach regarding the involvement of the insurance industry towards risk awareness and risk sharing;
89	Calls on the Commission and Member States to develop the public-private partnerships needed to create a long-term, strong and effective climate risk management framework (covering all aspects from risk awareness to risk sharing and recovery), with strong leadership by and the involvement of the public authorities;
90	Considers that the outermost regions, owing to their special circumstances – as set out in Article 349 of the Treaty of Lisbon – and their geographical location in the tropics, are susceptible to the consequences of climate change and should consequently receive special attention from the Commission; calls on the Commission, therefore, to develop an impact assessment and specific action plan for the outermost regions and to support information exchanges and exchanges of good practices between local authorities in those regions and regional authorities in third countries in their surrounding geographical areas;
91	Asks the Commission to exercise fully the new rights the Lisbon Treaty gives it under Article 260 in order to fulfil its role as guardian of the Treaties;
92	Emphasises that the EU budget does not currently reflect EU policy priorities in the field of adaptation to climate change;
93	Urges the Commission, in the framework of the review of the current multiannual financial framework, to focus on the capacity of the EU budget to cope with climate change; stresses that the next multiannual financial framework should accord a high ranking to climate change, and in particular to adaptation measures, ensuring that the necessary funds are available;
94	Urges the Commission, in the framework of the EU budget review, and in order to ensure that it addresses climate change impacts, to propose a climate-proofing procedure;
95	Calls, in the future, for the prioritisation of climate change, in particular by integrating the adaptation strategy into European Union policies;
96	Calls for strict care to be taken to ensure that an evaluation of climate change effects forms part of the process of approving proposals for EU-funded projects connected with energy efficiency, waste management and infrastructure development;
97	Stresses that the objectives of climate change and environmental protection should be integrated into the EU cohesion policy's convergence and growth objectives, without replacing the traditional tasks of structural policy;
98	Urges the Commission to put forward, in keeping with the EU Sustainable Development Strategy(12), and as a matter of urgency, a Road Map for the sector-by-sector reform of subsidies that have a considerable negative impact on the environment, with a view gradually to eliminating them; stresses, further, that financial resources made available through this reform should be directed towards adaptation efforts and green jobs;
99	Emphasises that the funds made available under the various economic recovery plans should also be directed to adaptation investments, and in any case need to be climate-proofed;
100	Emphasises the principle of prevention in adapting to climate change; calls on the Commission to develop approaches to ensure that costs arising from a failure to take adaptation measures are not passed on to the general public;
101	Supports the Commission in urging  the Council to reactivate the process of the revision of the Solidarity Fund Regulation (EUSF), which will make it possible to address damage caused by natural or man-made disasters in a more effective, flexible and timely manner;
102	Underlines that a substantial part of the revenues generated by the auctioning of allowances in the Community greenhouse gas emission allowance trading system (EU ETS), including auctioning for aviation and maritime transport, should be earmarked for enabling Member States and developing countries to adapt to climate change; takes the view that such provisions should also support sustainable modes of transport in Europe, such as rail transport; calls for the funding already earmarked from the EU ETS for the purpose of solidarity and growth in the Community (revenues deriving from 10% of the total quantity of allowances to be auctioned) to be distributed among lower income-level Member States, equally between adaptation and mitigation measures;
103	Calls for the allocation of funds derived from the ETS and other Community sources to help Member States adapt to climate change to take into account the vulnerability to climate change of each Member State or region;
104	Recognises the historical responsibility borne by the industrialised countries for the current increase in global temperatures; reiterates the statements it made in its resolution of 10 February 2010, including that EU commitments to finance climate efforts in developing countries should be new and additional to existing ODA commitments and independent of annual budgetary procedures in the Member States;
105	Reiterates the need to include adaptation measures in all EU external policies, in accordance with point 8 of the Copenhagen Accord;
106	Emphasises that the value of ecosystem services and resilience is even more significant in the least developed countries(13); stresses that climate adaptation policies, and especially ecosystem resilience policies, should be duly taken into account in all international negotiations, including trade negotiations;
107	Is firmly convinced of the need for the European Union to retain and reinforce its leadership role in the international fight against global warming, and believes that any delay in taking such action will heighten the risk of adverse environmental, economic and social effects and be likely to generate higher costs;
108	Stresses that, when it comes to ensuring the successful implementation of the European Framework for Action on Adaptation, a decisive factor will be its inclusion as part of a cohesive and ambitious worldwide agreement (with legally binding objectives) on measures to combat climate change, and that the EU must take the lead in this direction;
109	Calls on the Commission to consider increasing the public funds devoted to international cooperation in the forthcoming 8th Framework Programme (FP8), in:
110	Supports the proposal of the Commission to set up an impact and adaptation steering group; stresses that it is important for this group to involve regional and local actors in addition to state representatives; asks the Commission to ensure that this group includes representatives of Parliament as observers , as well as private stakeholders in an expert capacity; calls on the Commission to ensure that the steering group pays particular attention to the most severe health impacts of climate change, such as increases in weather-related deaths and vector-borne disease;
111	Calls on the Commission to report to the European Parliament by 2012 on progress made to implement the above-mentioned White Paper;
112	Instructs its President to forward this resolution to the Council and Commission and to the governments and parliaments of the Member States.
