A	whereas the treaties commit the European Union to base its external action on the principled foundation of democracy, the rule of law, the universality and indivisibility of human rights and fundamental freedoms, respect for human dignity, the principles of equality and solidarity, and respect for the principles of the United Nations Charter and international law;
B	whereas justice, rule of law, accountability for all crimes including the most serious crimes of concern to the international community, fair trials, and an independent judiciary are indispensible elements in the protection of human rights and the pillars of sustainable peace; 
C	whereas democracy and the rule of law are the best safeguards of human rights and fundamental freedoms, non-discrimination in all its forms, tolerance vis-à-vis individuals and communities, and equality for all;
D	whereas the lessons learned from the Arab Spring events must continue to provide impetus for the EU to review, improve and ensure coherence between its policies on, inter alia, human rights defenders, international humanitarian law, human rights dialogues with third countries and civil society, including NGOs and grassroots movements, and social media;
E	whereas the EU is bound to help countries with which it has signed international agreements, including trade agreements, to implement all these fundamental principles, and in particular by ensuring strict compliance with the human rights and democracy clauses in said agreements;
F	whereas internet access is a key enabler of access to information, free expression, press freedom, freedom of assembly, and economic, social, political and cultural development; whereas human rights need to be protected and promoted by the EU, both offline and online;
G	whereas violations of freedom of thought, conscience, religion or belief, perpetrated by governments and non-state actors alike, are increasing in many countries of the world, resulting in discrimination and intolerance both against certain individuals and against religious communities, including minorities and non-believers;
H	whereas the role of women and their full participation in the political, economic and social spheres is essential, especially in postwar peace-building processes, democratic transition negotiations and conflict resolution, reconciliation and stabilisation processes;
I	whereas the Annual Report on Human Rights and Democracy in the World, and the EU's policy on the matter, should not only be a reflection and review of past achievements and flaws, but should also serve to inspire the EU's human rights and democracy strategy and action plan; whereas each successive Annual Report should, ideally, tangibly and regularly contribute to improving the EU's human rights policy in the world;
1	Welcomes the adoption of the EU Annual Report on Human Rights and Democracy in 2011; welcomes the fact that the Vice-President of the Commission/High Representative (VP/HR) was able to present the Annual Report in the June plenary of Parliament and thereby return to the normal practice;
2	Notes the positive steps taken in recent years to develop the Annual Report, but stresses the potential for further improvement;
3	Believes that the Annual Report should be an important tool in communicating the EU's work in this field and should help raise the visibility of the EU's actions; invites the VP/HR, when drafting future Annual Reports, to consult actively and systematically with Parliament, and to report on the way that Parliament's resolutions have been taken into account;
4	Welcomes the adoption of the EU strategic framework for human rights on 25 June 2012; urges the EU institutions to work together to ensure its timely and proper implementation in order to credibly meet the EU treaty commitment to pursue external policies based on human rights, democratic values and the rule of law in a principled and unfaltering manner by avoiding double standards;
5	Urges the Council, the Commission, the European External Action Service (EEAS) and Parliament to maintain and honour EU's role as a leading defender of human rights by cooperating closely in implementing a coherent, ambitious and effective EU human rights policy in the world based on this strategic framework, making use of our development aid and opportunities offered by EED;
6	Recommends that the Council and the EEAS carry out a mid-term assessment of the new human rights package, particularly of the Action Plan; insists that Parliament be extensively consulted and regularly informed and that civil society be integrated in this process;
7	Welcomes the mandate of the thematic EU Special Representative (EUSR) on Human Rights and the planned creation of a Brussels-based Council Working Party on Human Rights (COHOM); looks forward to their close co-operation with Parliament, in the first case also in line with the provisions of Article 36 of the TEU;
8	Expects COHOM to enhance co-operation with the Council Working Party on Fundamental Rights (FREMP) to address the issue of consistency between the EU's external and internal human rights policy; underlines the importance of having within the European Union coherent, consistent and exemplary policies in line with fundamental values and principles in order to maximise the European Union's credibility globally and the effectiveness of EU human rights policies and to show genuine respect for the universality of human rights;
9	Welcomes the positive impact on coherence of EU internal and external policies of the EU's exercise of its legal personality created by the Lisbon Treaty to ratify the United Nations Convention on the Rights of Persons with disabilities (UNCRPD) in December 2010; calls for a similar approach to be taken to other international human rights treaties and conventions; calls for the Council and Commission to take a proactive approach in this area in order to address the negative effects of the piecemeal signature and ratification among EU Member States of other important external treaties and conventions;
10	Urges the VP/HR, the EEAS, the Council and the Commission, for the sake of efficiency, to ensure coherence and consistency between the various external financial instruments and existing or planned EU benchmarking, monitoring and evaluation activities and methodologies regarding human rights and democracy situations in third countries, including: the human rights and democracy sections in the enlargement and neighbourhood policy progress reports; the assessment of the ‘more for more’ human rights and democracy principle set out for the European Neighbourhood Policy; the planned inclusion of human rights in impact assessments carried out for legislative and non-legislative proposals and for trade, partnership and association and cooperation agreements, both regional and bilateral; the Commission plan to introduce human rights assessment in the deployment of EU aid modalities (in particular regarding budget support); the strengthened implementation of the monitoring mechanism to scrutinise respect for human rights conventions in the GSP+ countries; the aim of systematising the follow-up use of EU Election Observation Mission reports; and the EU Council's emphasis on benchmarking as well as on continued and systematic consideration of aspects relating to human rights, gender and children affected by armed conflict in the lessons-learned documents of the CSDP missions;
11	Welcomes the adoption of human rights country strategies for individual countries to implement policies in the most appropriate and effective way; recognises the key role played by the local EU delegations in developing and following up on the country strategies tailored for the specific circumstances, but stresses the coordinating responsibility of the EEAS in ensuring the coherent application of EU human rights policy priorities set out in the human rights strategic framework and in the EU Guidelines; stresses the importance of completing the network of focal points on human rights and democracy in EU Delegations and CSDP missions and operations; urges the VP/HR and the EEAS and the Member States to adopt as best practice the method of working on human rights issues locally through human rights working groups formed among EU delegations and embassies of EU Member States; urges also that regular contacts be maintained with civil society representatives, human rights defenders and members of national parliaments; supports the EEAS aim to provide training on human rights and democracy for all EEAS, Commission, EU delegation and CSDP mission staff, and for the staff of European Union agencies – FRONTEX in particular – that have relationships with third countries; asks for great attention to be paid, in particular, to protecting human rights defenders; takes the view that human rights country strategies should be mainstreamed in the EU's CFSP, CSDP, trade and development policies, both in geographic and thematic programmes, to ensure greater efficiency, effectiveness and coherence;
12	Welcomes EU efforts to support and revitalise the human rights work within the UN system, including the conclusion of the review of the UN Human Rights Council in 2011; stresses the continued importance of supporting the independence of the Office of the High Commissioner for Human Rights, and the role of the thematic and country-specific UN Special Rapporteurs on human rights, and looks forward to their close cooperation with the newly appointed EU Special Representative for Human Rights; emphasises the significance of the European Union accession of 22 January 2011 to the UN Convention on the Rights of Persons with Disabilities (CRPD) as the first UN human rights convention ratified by the European Union as a legal entity;
13	Stresses the importance of, and strong support for, the EU's active participation in the work of the UNHRC by means of co-sponsoring resolutions, issuing statements and participation in interactive dialogues and debates;
14	Welcomes the leadership shown by EU Member States to support the credibility of the UN human rights system by jointly extending a standing invitation to all UN Special Procedures on Human Rights, by initiating a UN Human Rights Council (HRC) Special Session on Libya, where the historic recommendation of Libya's suspension from the HRC was made, and by taking the lead in efforts that led to the establishment of the Independent Commission of Inquiry on the human rights situation in Syria;
15	Recognises the EU's potential for outreach and creative coalition-building as exemplified by EU action which paved the way to the passing of the landmark HRC resolution on human rights, sexual orientation and gender identity, which was supported by states from all regions, and the consensus-building in Geneva and New York regarding the need to fight religious intolerance and protect freedom of religion or belief whilst avoiding a potential detrimental effect on other core human rights, such as freedom of expression;
16	Reiterates its opposition to the practice of regional groups arranging uncontested elections to the Human Rights Council;
17	Recommends following up on the Universal Periodic Review (UPR) recommendations by including them systematically in EU human rights country strategies as well as in human rights dialogues and consultations;
18	Recalls the need for sufficient funding to keep the regional offices of the Office of the United Nations High Commissioner for Human Rights (OHCHR) open;
19	Recalls the adoption by the UN General Assembly of Resolution 65/276 on the participation of the EU in the work of the UN, recognising it as a modest start to the greater endeavour of upgrading the role of the Union in the human rights work of that organisation;
20	Regrets that selective justice frequently manifests itself in new and transitional democracies under the guise of the rule of law and war on corruption; regrets that selective justice has become little more than a means to seek political revenge and to settle accounts with political dissenters by intimidating and marginalising opposition, media workers and human rights defenders, especially in the run-up to elections; remains concerned about the crime allegations and politically motivated charges against members of the opposition in Ukraine, and urges the Ukrainian authorities to put an end to the ongoing harassment of the opposition which is a serious obstacle in the country's efforts to guarantee rule of law and democratic values;
21	Regrets that, despite many calls from international bodies to Russian authorities, no progress has been made in the investigation of Sergei Magnitsky death; urges, therefore, the Council to impose and implement an EU-wide visa ban on officials responsible for the death of Sergei Magnitsky and to freeze any financial assets they or their immediate family may hold inside the EU;
22	Remains disappointed about the proceedings against Mikhail Khodorkovsky and Platon Lebedev, which proceedings are perceived internationally as being of a political nature;
23	Celebrates the 10th anniversary of the entry into force of the Rome Statute of the International Criminal Court (ICC); welcomes its ratification by Cape Verde and Vanuatu; recognises the ICC as a mechanism of ‘last resort’, which is responsible for the enforcement of justice for the victims of crimes against humanity, genocide and war crimes, as laid down by the principle of complementarity in the Rome Statute;
24	Reiterates its strong support for ICC in the fight against impunity for the most serious crimes of international concern; calls on the EU and its Member States to continue their political, diplomatic, logistical and financial backing of the ICC and other international criminal tribunals, including the ad hoc international tribunals for the former Yugoslavia and Rwanda, the Special Court for Sierra Leone, the Extraordinary Chambers in the Courts of Cambodia, and the Special Tribunal for Lebanon;
25	Welcomes the inclusion in the EU Strategic Framework and Action Plan on Human Rights and Democracy of reference to the need to fight vigorously against impunity for serious crimes, not least through a commitment to the ICC, and the understanding that it is the primary duty of states to investigate grave international crimes, promote and contribute to strengthening the capacity of national judicial systems to investigate and prosecute these crimes;
26	Welcomes the commitments made in the Council Decision 2011/168/CFSP on the ICC, adopted on 21 March 2011, and the subsequent Action Plan adopted on 12 July 2011, and recommends that the EU and its Member States ensure their implementation through effective and concrete measures to promote the universality and integrity of the Rome Statute, to support the independence of the Court and its effective and efficient functioning and to support the implementation of the principle of complementarity; calls on the EUSR for human rights to implement the actions related to the ICC contained in the EU Strategic Framework on Human Rights and Democracy;
27	Recognises the efforts of the Commission to establish an ‘EU Complementarity Toolkit’ aimed at supporting the development of national capacities and generating political will for the investigation and prosecution of alleged international crimes, and stresses the importance of thorough consultations with the Member States, Parliament and civil society organisations in order to finalise the toolkit;
28	Reiterates its recommendation that the Rome Statute be added to the package of international treaties on good governance, and that the rule of law be ratified by third countries admitted to the System of Generalised Preferences Plus (GSP+); supports consistent inclusion of an ICC clause in EU agreements with third countries; calls for the mainstreaming of the ICC in all EU foreign policy priorities, by, in particular, systematically taking into account the fight against impunity and the principle of complementarity;
29	Stresses the importance of strong EU action to anticipate and thereby avoid or condemn instances of non-cooperation, such as invitations of individuals subject to an ICC arrest warrant and failure to arrest and surrender such individuals; calls again on the EU and its Member States to comply with all the requests by the Court to provide assistance and cooperation in a timely manner, to ensure, inter alia, the execution of pending arrest warrants; reaffirms the need for the EU and its Member States, with the help of the EEAS, to put in place a set of internal guidelines outlining a code of conduct for contact between EU/Member State officials and persons wanted by the ICC;
30	Expresses its deep concern over the outcome of the budget discussions of the 10th session of the Assembly of State Parties (ASP) on 12-21 December 2011, which threatened to leave the Court underfunded; deeply regrets that some European States Parties to the Rome Statute push for the adoption of a zero growth budget/lower budget, and that the Assembly did not agree to provide the Court with sufficient resources to effectively fulfil its judicial mandate and deliver justice in a robust, fair, effective and meaningful manner; calls on the Member States to show robust support for the functioning of the Court at the ASP, and reject the proposals for a zero nominal growth of the Court's budget as this would undermine its ability to deliver justice and to respond to new situations;
31	Emphasises that the EU's support to the fight against impunity should cover a number of initiatives that include, among others: increased efforts to promote wider ratification and implementation of the Rome Statute and of the Agreement on Privileges and Immunities (APIC) in order to make the Court truly global and universal; enhanced efforts to secure full cooperation with the Court, including through enacting relevant national legislation on cooperation and concluding framework agreements with the ICC for the enforcement of the Court's sentences, the protection and relocation of victims and witnesses, etc, in order to facilitate adequate and timely cooperation with the Court; and determined political and diplomatic support, in particular with regard to the execution of pending arrest warrants;
32	Underlines, further to the Arab Spring, the importance of developing a coherent and nuanced EU policy on transitional justice in addition to the reinforcement of the independence of the judiciary, including the linkage to the ICC as a court of last resort, to help countries in transition address the past human rights violations, fight against impunity and avoid recurrence of human rights violations;
33	Stresses that the digital collection of evidence and dissemination of images of human rights violations can contribute to the global fight against impunity; considers that assistance is needed in making materials admissible under international (criminal) law as evidence in court proceedings;
34	Welcomes the inclusion, for the first time, of a dedicated section on IHL in the 2011 Annual Report on Human Rights and Democracy and the EU's efforts to ensure accountability by documenting any abuses of IHL and supporting accountability mechanisms, as well as its pledges to combat enforced disappearances, continue support for the ICC, work towards further participation in the principal IHL instruments, promote respect for fundamental procedural guarantees for all persons detained in armed conflict, and support international instruments seeking to address humanitarian hazards of explosive remnants of war, cluster munitions, improvised explosive devices and anti-personnel landmines;
35	Regrets, however, that overall awareness and implementation of EU guidelines on promoting compliance with international humanitarian law remain markedly lower compared with other guidelines; calls on the EU to give more political prominence, and devote more resources, to the implementation of these guidelines, especially by ensuring that IHL is mainstreamed in crisis-management operations, and by proactively fighting impunity and ensuring individual responsibility;
36	Recalls that in order to avoid human rights breaches in the first place, respect for international law must be at the core of any EU strategy aiming to enhance human rights and democracy in the world, particularly in its relationships with those partners that are parties to an armed or frozen conflict; recalls the need to end any EU support to parties to a conflict, whether financial, logistical or tactical, including through the supply of weapons, munitions or any other type of military equipment, as laid down in the EU Common Position on arms exports;
37	Further emphasises the need to ensure that the issue of the fight against impunity for crimes against humanity, war crimes and genocide is addressed more systematically in the EU's bilateral relations with relevant countries, including by raising it in public statements, and that the EU addresses impunity more consistently at multilateral level, for instance at the UN General Assembly and Human Rights Council;
38	Reiterates its commitment to the principle of the ‘Responsibility to Protect’ (R2P), stressing the importance that the international community, including the EU, assumes responsibility for addressing gross human rights violations in third countries when the governments of these countries are unable or unwilling to protect their own citizens; stresses that this action of the international community implies humanitarian intervention and appropriate diplomatic pressure and, only as a last resort, the collective use of force, under the auspices or authorisation of the UN; urges the EU to actively engage and promote the urgent reform of the UN Security Council, so as to avoid the obstruction of R2P;
39	Commends, in this context, the actions of the European Union and the several EU Member States which took the lead in preventing further violence against civilians in Libya during the course of 2011 , but regrets the lack of a concerted response at EU level;
40	Is deeply concerned about the human rights situation in Libya, notably regarding the conditions of detention and the treatment of detainees held by various militias without effective and serious control by the Interim Government over these brigades, and requires increased alertness and sustained assistance by the international community, as stated by the High Commissioner for Human Rights before the UN Security Council on 25 January 2012;
41	Notes the efforts made by the European Union and the international community in Syria but regrets that those efforts have not translated into an improvement of the situation on the ground; expresses again its deep concern over the situation in Syria, especially regarding the continuing human rights and humanitarian emergency; condemns in the strongest terms the widespread brutal repression and systematic violations of human rights and fundamental freedoms by the Syrian regime against its population, including children and women; calls on the Syrian authorities to bring an immediate end to human rights violations and to comply with their obligations under international human rights law in order to allow a peaceful and democratic transition; reiterates its strong support for the UN-Arab League Special Envoy, and urges the UN Security Council to take necessary steps to end the massacre of civilians and to refer to the ICC those responsible for the grave war crimes and human rights violations in Syria;
42	Welcomes the new EU Aid Volunteers initiative that, in the initial programme period of 2014-2020, will create opportunity for some 10 000 Europeans to participate worldwide in humanitarian operations in areas where aid is most urgently needed and to demonstrate European solidarity by providing practical assistance to communities struck by natural or man-made disasters;
43	Argues that private military and security companies (PMSCs) should be held accountable for any violations of human rights and humanitarian laws committed by their personnel; calls on the EU and the Member States, in light of the widespread use of PMSCs, to step up their efforts to find a credible regulatory solution to avoid legal loopholes in terms of accountability;
44	Emphasises the significance of the 2011 uprisings in the Arab world both as an expression of the desire for freedom, justice and dignity and as a major challenge to EU policy in the region and beyond; recognises that the EU has stepped up its political engagement in both the Eastern and Southern Neighbourhood, but stresses the need to learn from past policy mistakes and chart a new policy aligned with respect of human rights and support of democratic values;
45	Welcomes the new emphasis in EU policy towards the Southern Neighbourhood on mutual accountability and a shared commitment to the universal values of human rights, democracy and the rule of law; calls for consistency in EU's human rights policy approach to the South and the East; underlines the need to avoid in the East the same kinds of policy mistakes that were made in the South prior to the Arab Spring of 2011;
46	Recalls its resolutions of 25 November 2010 on the situation in Western Sahara
47	Underlines the importance of the role of women, and of their full participation in political and economic decision-making, especially in post-war peace-building processes, democratic transition negotiations and conflict resolution, reconciliation and stabilisation processes, in terms of the goal of increasing awareness and attention with a view to eliminating the discrimination suffered by women in the democratisation processes under way in many third countries;
