A	"	whereas the primary objective of the above-mentioned Commission Communication entitled ""Towards an EU Strategy on the Rights of the Child"" is to promote the positive affirmation of children's rights, in particular the right to their own identity, the right to grow up in secure conditions/the right to care, the right to a family, the right to be loved and to play, and the right to health, education, social inclusion, equal opportunities, sport and a clean and protected environment and the right to obtain information on such issues, with a view to establishing a child-friendly society, in which children can feel protected and actively involved,"
B	"	whereas Article 24 (3) of the Charter of Fundamental Rights of the European Union (the Charter of Fundamental Rights) states that ""every child shall have the right to maintain on a regular basis a personal relationship and direct contact with both his or her parents, unless that is contrary to his or her interests"","
C	"	whereas, pursuant to Article 24 of the Charter of Fundamental Rights and Article 12 of the UN Convention on the Rights of the Child, it is important to guarantee all children the right of ""participation"" so as always to take account of their experience of and opinions on all matters affecting them, giving due weight in accordance with the age, maturity and intellectual development of the child; whereas that right is absolute and may not have limitations placed on it, and whereas ways must be found of communicating with all children, even children who express themselves in a way that is not easy for adults to understand, for example very young children, children with disabilities and children who speak a different language,"
D	"	whereas it is essential that children's rights be incorporated and protected (mainstreamed) in all EU policies affecting children directly or indirectly),"
E	"	whereas for children, the poverty and social exclusion of their parents represent serious obstacles to exercising their rights, and whereas there are also many other factors that prevent children from exercising their rights, such as parents who fulfil their parental role less than satisfactorily, the necessity for children to be represented by adults in legal matters, or the fact that the right to health care can  be exercised only with the consent of the person who has custody of the child,"
F	"	whereas adults should provide children with favourable conditions to enable them to have their say, so that they express their views and can be heard; whereas adults should promote children's gestures of peace and friendship and encourage them to associate with other children; whereas time is an important factor in creating conditions conducive to an open attitude and to giving children their say, and not merely at specific events, and whereas the funding of public programmes should take that into account,"
G	"	whereas the abuse of children's rights, violence against children and trafficking in children for illegal adoption, prostitution, illegal work, forced marriages, street begging, or any other purpose, remain a problem within the EU,"
H	"	whereas increasing numbers of children suffer from chronic illnesses such as neurodermititis and allergies, and from respiratory diseases and noise,"
I	"	whereas children's environmental rights are enshrined in the UN Convention on the Rights of the Child,"
J	"	whereas the family environment provides a favourable framework for protecting children's rights, ensuring the healthy development of their personalities, developing their skills and enabling them to acquire the necessary knowledge to exercise their rights and become aware of their duties, and, consequently, every effort must be made to support families by means of appropriate public policies, but whereas, in the absence of such a framework, all children, including orphans, the homeless and refugees should, in accordance with the UN Convention on the Rights of the Child, have access to protection within a replacement framework that allows them to grow up without being discriminated against in any way,"
K	"	whereas the EU strategy on the rights of the child should be rooted in the values and principles laid down in the UN Convention on the Rights of the Child,"
L	"	whereas the rights of children as autonomous legal beings should be recognised, yet, despite national and international legislation, girls and women are often victims of legal, social and economic inequalities, which affect the exercise of their positive and fundamental rights, such as equal access to education, training and healthcare, safe food and clean water and reproductive rights for adolescents,"
M	"	whereas fundamental rights and values, including gender equality, should be an essential component of education during childhood and should form the basis of all the other stages of life, "
N	"	whereas gender mainstreaming must be applied to all policies affecting children, since gender equality begins with the recognition of the equal rights of male and female children, starting from the first years of life,"
O	"	whereas human rights violations against immigrant women and girls in the form of so-called honour crimes, forced marriages, genital mutilation, or other violations cannot be justified on any cultural or religious grounds and should in no circumstances be tolerated,"
P	"	whereas children in Europe are exposed at an early age to depictions of horror, pornography and violence in the media, and this can have devastating psychological and social effects on children, such as anxiety, depression, increased aggressiveness and problems at school,"
1	Welcomes the Commission's initiative, which makes it quite clear that all conventions on fundamental human rights apply equally to children and adults, as do a series of additional rights, including those enshrined in the UN Convention on the Rights of the Child, which was drawn up with particular reference to the special situation of children and young people;
2	Welcomes the IGC decision of 19 October 2007 to incorporate children's rights as one of the objectives of the EU in the Treaty of Lisbon, thus providing a new legal framework for children's rights;
3	Welcomes the development of the Commission's Action Plan on Children in External Relations, which will come under the approved framework and commitments of the EU strategy on the rights of the child;
4	"Notes that a growing number of areas within the EU's competence affect children's rights directly or indirectly, and calls on the Commission to incorporate into the impact assessment provided for in its communication of 27 April 2005 entitled ""Compliance with the Charter of Fundamental Rights in Commission legislative proposals − Methodology for systematic and rigorous monitoring"" ("
5	Calls on the Commission to put forward a proposal to create a specific budget line for children's rights, in order to finance work to implement the above-mentioned Commission Communication entitled 'Towards an EU Strategy on the Rights of the Child', and child-specific projects, such as a European early warning system on child abductions, and a coordination body made up of representatives of the central authorities of Member States mandated to reduce the number of cases of child abduction; the budget line should also include subsidies for NGO networks working in this field and ensure children's participation in the work to implement that Communication and those projects;
6	"Calls for an effective monitoring system backed with financial means and annual reports to ensure the implementation of the commitments set out in the above-mentioned Commission Communication entitled 'Towards an EU Strategy on the Rights of the Child"" and the future strategy on the rights of the child;"
7	Recalls that the success of the future strategy requires long-term commitment and action, increased and effective monitoring of the implementation of children's rights through the development of indicators and the involvement of NGOs and parents' and educational associations and coordination with national and international children's rights initiatives and policies; 
8	Calls on the Commission to draw up a comprehensive European Union Child and Youth Report every two years, beginning in 2008;
9	Applauds the Commission's plan to introduce an EU-wide child helpline telephone number and points to the need for this service to be free of charge and available 24 hours a day; calls on the Member States to inform children, through informational measures, about the possibility of using this service;
10	Awaits with interest the Commission's report on the implementation by Member States of the above-mentioned 2003 Framework Decision on combating the sexual exploitation of children and child pornography;
11	Calls for the protection of children's rights, as laid down in the UN Convention on the Rights of the Child, to be included among the priorities Multiannual Framework of the European Union Agency for Fundamental Rights (the Agency), and for the Agency to set up a network for cooperation with international institutions, particularly ombudspeople for children and NGOs working in this area as soon as possible in order to take full advantage of their experience and the information available to them;
12	Calls on the Commission, the Agency and the Member States to work in cooperation with relevant UN agencies, international organisations and research centres towards improving the gathering of comparable statistical data on the situation of children in the EU, if necessary by extending Eurostat's mandate, with a view to developing and including a larger number of indicators relating specifically to children, on child poverty and social exclusion, for example; children's participation in the collection of data should be ensured;
13	Asks the Commission to provide a breakdown by gender and age of data on all types of discrimination and violence against children, to integrate equality between women and men into all the policies and instruments of its future strategy, including the activities of the Forum on Children's Rights, and to follow up and evaluate these policies, inter alia, by means of gender budgeting;
14	Calls for children's rights to be mainstreamed in the external policies and actions of the EU, including the European Neighbourhood Policy and the Strategic Partnership with Russia, as set out in the forthcoming Commission Staff Working Paper on 'A European Union Action Plan on Children's Rights in External Relations', and in the enlargement process, recognising that these policies are powerful tools providing opportunities to promote children's rights'; calls on the Commission to translate these opportunities into specific objectives in the external work of the Community and the Member States;
15	Calls on the Commission to submit a report on the possible inclusion in all international agreements between the EC and third countries of a specific and legally binding clause on respect for children's rights, as defined at international level;
16	Calls on the Commission to redouble its efforts to assist developing countries in translating the provisions of the UN Convention on the Rights of the Child and the Optional Protocols thereto into their national legislation;
17	Calls for consideration to be given to the EU's accession to the UN Convention on the Rights of the Child and the two Optional Protocols thereto, as well as the Council of Europe conventions on the rights of the child, including the ECHR, and those on the exercise of children's rights, adoption, exploitation and sexual abuse, and calls on the Council to adopt a position of principle to enable the EU in future to take part in negotiations on conventions relating in particular to children's rights;
18	Points out that any strategy on the rights of the child should be rooted in the values and four basic principles enshrined in the UN Convention on the Rights of the Child: protection against all forms of discrimination; the best interests of the child as a primary consideration; the right to life and development; and the right to express an opinion and to have that opinion taken into account, in any matter or procedure affecting the child;
19	Considers it regrettable that not all Member States have yet established an ombudsperson for children's rights, as called for by the UN Committee on the Rights of the Child, to promote the upholding of children's rights and the further implementation of the UN Convention on the Rights of the Child, and calls on those Member States who have not yet done so to take this step as soon as possible; takes the view that the EU should make financial support available to the European Network of Ombudspeople for Children (ENOC), so that ENOC is able to address more intensively and on an EU-wide basis issues that relate to the rights of the child;
20	Points out that the implementation by the national authorities of Council Regulation (EC) No 2201/2003 of 27 November 2003 concerning jurisdiction and the recognition and enforcement of judgments in matrimonial matters and the matters of parental responsibility
21	Emphasises the importance of full implementation by the Member States and candidate countries of existing international commitments, in particular those under the UN Convention on the Rights of the Child, the UN Convention on the Rights of Persons with Disabilities, which contains specific provisions for children with disabilities, and ILO conventions on child labour;
22	Urges those Member States which have not yet done so to ratify the Hague Convention of 19 October 1996 on Jurisdiction, Applicable Law, Recognition, Enforcement and Cooperation in respect of Parental Responsibility and Measures for the Protection of Children; urges the EU institutions to promote the third-country ratification of the main international child protection instruments, especially those tending to improve the situation of immigrant children;
23	"Urges the EU to take an active part in promoting awareness and dissemination of the UN Convention on the Rights of the Child inside and outside the EU by the use of ""soft power"";"
24	Reminds the Member States of the need to comply forthwith with their European and international undertakings regarding the protection of children's rights;
25	Urges the Member States to set up exchange programmes for teachers and pupils with countries outside the EU, particularly in the Middle East and developing countries, and to disseminate and promote children's rights, drawing attention to the right to education and gender equality;
26	Emphasises the imperative for a differentiated consideration of children's needs, a good example for such a differentiated scale being the Report Card 7 by the UNICEF INNOCENTI Research Centre, with six dimensions of child well-being, including material well-being, health and safety, educational well-being, family and peer relationships, behaviour and risks and subjective well-being;
27	Urges the Commission and the Member Sates to take action to ensure observance of the rights of mentally disabled children, with particular reference to their right to freedom, education and access to the courts, and to protect them from torture and cruel, inhuman or degrading treatment;
28	Calls on all the Member States to ensure that children have effective and independent representation in any judicial or quasi-judicial proceedings concerning them and have a legally appointed guardian where no responsible, competent and appropriate adult family member is able to fulfil such responsibilities;
29	Emphasises that, since the vast majority of children, especially young children, are cared for in a family, a strategy on the rights of the child must include provisions to promote the welfare of families; 
30	Calls on the Commission to develop policies and carry out comprehensive, cross-cutting action aimed at the protection of children's rights so as to achieve inter-territorial equity and equal opportunities for children; 
31	Proposes that the EU define as 'children at risk' all children who are victims of a social situation that threatens their mental or physical health and/or exposes them to the risks of delinquency, both as actors and as victims;
32	Calls on the Commission and the Member States to take measures (information campaigns, exchanges of best practice, and so on) to prevent children from being put 'at risk', including the prevention of juvenile delinquency;
33	Recalls that the right to education and training is a basic social right, and calls on all Member States and candidate countries to guarantee this right, whatever the child's or his parents' social or ethnic background, physical condition or legal status;
34	Asks that the future EU strategy on the rights of the child include measures for the prevention of gender-based violence focusing, inter alia, on awareness campaigns regarding equality between men and women, which target girls and boys, parents, educators and vulnerable communities, and have the aim of emancipating girls, securing their equal opportunities and improving the defence of their rights; calls for the promotion of the active participation of boys and men in the above-mentioned preventive measures; calls on the Commission to make its development aid policy and trade agreements conditional on the implementation of legislation guaranteeing equality between men and women and the abolition of all types of violence against women and children;
35	Calls on the Commission, in its relations with third countries, to encourage ratification of the international treaties on ending discrimination against women and to promote women's participation in economic, social and political life, thus enhancing their children's wellbeing;
36	Welcomes the fact that the Commission has launched a Forum bringing together representatives of the Member States, Parliament and the Commission, non-governmental organisations, national and international organisations working in the field of children's rights, and children; believes that child participation should be one of the main aims of the Forum; calls on the Commission to ensure the participation of children and also of ombudspeople for children's rights in the Member States, as well as that of parents' and family associations;
37	Welcomes the fact that the Commission has established an inter-service group and appointed a coordinator for children's rights and calls for the establishment of a coordination unit in Parliament in accordance with the provisions of the Treaty of Lisbon, to act in liaison with the Commission's inter-service group and to link up and rationalise all Parliamentary initiatives and activities relating to children's rights; takes the view that such bodies should also provide a network for the exchange of information and good practices, in relation to the national strategic plans on children being implemented by some Member States; calls for these bodies to establish direct contact with child and youth-led organisations in order to develop, implement, monitor and ensure the meaningful and effective participation of children in all decision-making that affects them;
38	Recalls that children and young people, regardless of age, have the right to express their views; considers that girls and boys alike are entitled to have their say and that that right should be guaranteed in the work undertaken to develop an EU strategy on the rights of the child and that an equal participation of girls and boys should be ensured;
39	Recognises that active participation is closely linked to information; welcomes the establishment of a communication and information strategy that will publish EU measures in a child-friendly manner, accessible to all;
40	Awaits with interest the publication by the Commission in 2008 of its study assessing the impact of existing EU actions affecting children's rights and a consultation document aimed at establishing the main priorities of the EU's future action in the field of children's rights, with the goal of adopting a White Paper; calls on the Commission to take account of the results of the above-mentioned consultation carried at the beginning of 2007 out by Save the Children and Plan International among some one thousand children, which showed that the priority issues, in their view, are violence against children, discrimination, social exclusion and racism, the effects of drugs, alcohol and smoking, prostitution, child trafficking and environmental protection; believes that, in addition to these specific priority issues, children's rights to participation and influence must be the comprehensive goal of the strategy; therefore calls on the Commission to develop a process in which all stakeholders involved, including children, are able to take part in the consultation leading up to the definition of the EU strategy on the rights of the child;
41	Regards it as highly important that information on children's rights is disseminated to children in a child-friendly way and via suitable means; calls on the Commission to:
42	Affirms that no forms of violence against children in any setting, including the home, can be justified and that all violence must be condemned; therefore calls for Community legislation that prohibits all forms of violence, sexual abuse, degrading punishment and harmful traditional practices; condemns all forms of violence against children including physical, psychological and sexual violence, such as torture, child abuse and exploitation, child abduction, trafficking in or sale of children and their organs, domestic violence, child pornography, child prostitution, paedophilia, and harmful traditional practices such as female genital mutilation, forced marriages and honour crimes; 
43	Recalls the recommendations contained in the above-mentioned UN Secretary-General's Study on Violence against Children on preventing and responding to all forms of violence against children; in particular, acknowledges the need to prioritise preventive policies and reinforce social services, with special reference to family mediation services, to improve the support offered to victims of violence, to hold perpetrators accountable and to strengthen the collection and analysis of data on this hidden problem; calls for the promotion, within the framework of policies to prevent violence against children, of awareness-raising, information and education campaigns and capacity-building activities for professional groups working with and for children;
44	Calls on the Member States either to implement specific legal provisions on female genital mutilation or to adopt laws under which any person who carries out genital mutilation may be prosecuted;
45	Calls on the Member States to act against honour crimes, irrespective of the reason, be it in connection with homosexuality, religion or gender identity, arranged marriages or marriages with minors; 
46	Urges the Member States to raise medical practitioners' awareness of harmful traditional practices and to ensure that crimes are punished consistently under the legislation in force, with particular attention being paid to vulnerable groups including immigrant girls and women, those from ethnic minorities and disabled girls;
47	Calls on the Member States to introduce compulsory recording by healthcare workers of all cases of female genital mutilation, and also to record cases where there is a suspicion that genital mutilation may take place;
48	Calls on the Member States to speak out against tradition-based violence against women, to condemn family-induced violations of immigrant girls' human rights, and to check which laws may be applied to hold family members responsible, especially in cases of so-called honour crimes;
49	Maintains that, if violence against and abuse of children is to be diagnosed and tackled at an early stage, a specific procedural protocol must be introduced for the registration and treatment of such incidents, together with training measures for the medical and healthcare personnel responsible for matters relating to the physical and mental health of children;
50	Supports the appointment of a Special Representative of the UN Secretary-General on the Elimination of Violence against Children, with the mandate and resources required to enforce global commitments to end violence against children;
51	Stresses that a legal framework should be established on sexual exploitation and child abuse and that judicial cooperation should be strengthened between Member States, Europol, Eurojust and all competent international bodies;
52	Calls on the Member States to allocate funds for educational and media campaigns targeting parents and professionals and to ensure provision of child-friendly legal, medical and psycho-social services; 
53	Calls on all the institutions and the Member States to take an active part in combating child sexual exploitation, child trafficking, paedophilia, the sexual abuse of children via the Internet, child prostitution and sex tourism involving children, taking all the necessary measures to complete the approximation of national legislation based on common minimum principles adopted in the above-mentioned Framework Decision 2004/68/JHA, and also in other legislative instruments providing for the involvement of all public and private stakeholders, as set out in the above-mentioned Commission Communication entitled 'Towards a general policy on the fight against cyber crime'; 
54	Affirms that the sexual exploitation of children should be considered equivalent to the crime of rape insofar as concerns penal sanctions; considers that aggravating circumstances should be taken into account when a child is a victim of sexual exploitation or abuse; 
