49	Invites Member States to take full advantage of the Community state aid guidelines concerning employment costs and taxation, with particular emphasis on the tonnage tax system; considers that the LeaderSHIP 2015 Progress Report has had a positive impact, and that the maritime sector must be kept eligible for state aid in order to promote innovation;
50	Calls for the trans-shipment of oil, or other toxic cargoes, by sea to be limited in future to carefully designated zones under surveillance so as to facilitate the identification of who is liable in the event of a discharge of pollutants into the sea; notes that shipping contributes to marine pollution, and potentially to the disturbance of ecosystems through the introduction, into the seas and oceans, of alien species which are found in discharged ballast water and the use of chemicals in anti-fouling paints that affect the hormones of fish; emphasises that oil slicks are also a major maritime hazard;
51	Calls for training and information to be provided by compiling, analysing, and disseminating best practice, techniques, instruments for monitoring tank-emptying and innovation to combat pollution by oil and noxious and hazardous substances, and for technical solutions, using inspection and satellite-based surveillance, to be developed for the purpose of monitoring accidental or deliberate spillages;
52	Underlines the importance of the contribution that territorial cooperation and coastal regions networking can make to a holistic maritime policy through the promotion of joint strategies for the competitiveness of coastal zones; considers therefore that the participation of regional and local stakeholders is essential for the success of a European maritime policy; therefore welcomes the fact that European coastal regions are developing ever closer mutual cooperation and networks;
53	"Takes the view that the Commission, the Member States and the regions should make a particular effort to increase awareness of maritime topics; believes this could include, for example, recognition of good examples of tourism projects, environmentally sound shipping or particular contributions to education about the sea; in this regard, proposes that prizes be awarded to exemplary maritime regions as a way of promoting best practice; emphasises the significance of its initiative, which should be promoted by the Commission, regarding the establishment of a European Maritime Day in celebration of the maritime sector; stresses that pilot courses on ""maritime education"" should be introduced in secondary schools with the support of the Commission;"
54	Stresses that it is of the greatest importance for the development of islands and coastal areas that quantitative restrictions be placed on the discharge of phosphorus and nitrogen into the Baltic Sea, in view of the fact that the condition of the sea is fundamental to tourism and related business; emphasises that there is a need for a clear, easily understandable set of rules and a manual clearly explaining the incentives and their consequences;
55	Encourages regions and Member States to use cohesion policy instruments in order to achieve further integration in maritime and coastal policy, promote entrepreneurship and set up SMEs, thus helping to overcome the problem of seasonal employment; calls, in particular, for the creation of a network of regions of maritime excellence in the framework of the European Territorial Cooperation Objective;
56	Considers it to be of major importance that early warning systems be developed along Atlantic coasts which are potentially exposed to tsunamis;
57	Emphasises the fundamental importance of ports and the role they play as funnels for international trade, as economic drivers and job creators for coastal regions and as transit centres for fisheries, as well as being essential security-control points;
58	Calls on the Member States and the Commission, in view of the air pollution in many port cities and regions, to significantly increase incentives for the use of land-based power supplies to  ships in port when this is cost-effective and results in environmental benefits; calls, therefore, for Council Directive 2003/96/EC of 27 October 2003 restructuring the Community framework for the taxation of energy products and electricity
59	Calls for the revision of Directive 2000/59/EC of the European Parliament and of the Council of 27 November 2000 on port reception facilities for ship-generated waste and cargo residues
60	Considers that, in future, goods transport bottlenecks are more likely to occur in the connections between ports and European land transport networks, rather than in the reception capacities of ports; considers that, if the best use is to be made of the maritime transport possibilities, European ports must have the best possible hinterland connections available to them, and therefore calls for them to be developed where necessary, giving priority to more environmentally friendly modes of transport, such as rail and inland waterways;
61	Believes, given the huge importance of waterborne transport both within the internal market and between the Union and its trading partners, that a new EU maritime strategy should contain a port strategy allowing ports to develop in response to market developments and demand while respecting relevant legislation with a view to establishing a favourable climate for investment in order to facilitate sufficient port capacity to accommodate increasing maritime cargo traffic flows; insists that such a strategy be developed in coordination with the current debate on a European Ports Policy, in order to avoid the duplication of work;
62	Notes that Europe is a popular region for yachting tourism, cruiser tourism and sub-aqua tourism; encourages the maritime regions to invest in their marina infrastructure and other related infrastructures in order to benefit from this growing market whilst ensuring the protection of habitats, species and marine ecosystems in general; calls on the Commission to help set harmonised standards for facilities and technical equipment so as to ensure a high level of service quality throughout the Union;
63	Favours the creation of more maritime clusters which take advantage of the positive experience gained and good practices already being carried out in this domain, and believes that these examples should be followed and promoted; calls on the Member States to take measures to enhance the economic competitiveness of coastal regions by encouraging research, the creation of centres of maritime excellence and technological development and innovation as well as inter-business cooperation (networks, clusters, public partners) and the provision of improved support services aimed at reducing the dependence of those regions on a very limited number of (traditional) economic activities;
64	Reconfirms its position of 14 November 2006 on the Marine Strategy Directive
65	Is thus convinced that renewable resources of the marine environment can and should be used sustainably so that their exploitation, and the resulting economic benefits, can continue in the long term; stresses the need, therefore, for the various policies concerned  to be adapted to the requirements of a healthy marine environment; calls in this connection also for greater use of onshore and offshore wind power in order to exploit sustainably its potential from the point of view of employment and economic policy;
66	Insists, however, that coastal zone management must have, as one of its core objectives, the conservation of the marine environment, rather than setting aside a few sample areas as a token gesture to conservation efforts, particularly in the light of Recommendation 2002/413/EC of the European Parliament and of the Council of 30 May 2002 concerning the implementation of Integrated Coastal Zone Management in Europe
67	In this context, agrees with the Commission that there is a natural limit to the amount of human activity, in terms of population density and industrial activity, that coastal zones can support without suffering severe and possibly irreversible environmental degradation; supports, therefore, the Commission's view that a comprehensive study is needed in order to be better able to identify these limits and to forecast and plan accordingly;
68	Points out that three-dimensional mapping of the seabed will be of immense value not only to the fishing industry but also to the energy sector, conservationists and even defence interests; considers that the significant commercial value of such maps is evident and thus they may help to solve the question of funding for this activity; believes improved data across the maritime sector could include better weather forecasting, information on anticipated wave heights and a range of factors which would enhance safety and development;
69	Calls for the development of all necessary measures to prevent and manage the risks of damage to coastal areas by natural disasters such as floods, erosion, storms and tsunamis; further stresses the need to adopt Community measures in order to deal with dangers to European coastal ecosystems, engendered by various human activities;
70	Considers that building sea defences to protect against rising sea levels can lead to a loss of habitat, while the rise itself causes a 'coastal squeeze' of salt marshes and mudflats and the erosion of sand dunes all of which are rich habitats for plants and animals; calls for a long-term strategy to maintain coastal defences, protect against rising sea levels and minimise habitat loss;
71	Encourages the development of new networks for the implementation of projects and activities in the form of partnerships between the private sector, NGOs, local authorities and regions, with a view to achieving greater dynamism, innovation and efficiency and improving the quality of life in coastal areas;
72	Stresses the need to make coastal regions more attractive not just as places of leisure but as places in which to live, work and invest, by improving accessibility and internal transport infrastructure; further calls for the adoption of measures to improve services of general interest (health, education, water and energy, information, communication technologies, postal services, waste water and waste treatment), taking into account seasonal demographic changes;
73	Urges the Member States, in view of the fact that a significant proportion of the overall pollution of European seas originates from the land, to rapidly  implement all current and future European legislation in this area; in addition, calls on the Commission to put forward an action plan in order to reduce this pollution; takes the view that financial support for projects to reduce pollution in third countries is also important, as in these countries the level of filter and purification systems is often far below European standards and therefore financial investment can have a  greater effect;
74	Notes that most pollution in the marine environment originates from land-based sources, including, but not limited to, agricultural run-off and industrial emissions, which have an especially deleterious impact on closed and semi-enclosed seas; stresses that the EU must pay particular attention to these areas and take measures to limit and prevent further pollution; also considers that the new GMES technology (Global Monitoring for Environment and Security) could be successfully used for that purpose;
75	Takes into account that the maritime sector is one of the few areas in which the 'polluter pays' principle is not adhered to; believes that effluent-discharging industries, industries involved in sand and gravel extraction, maritime energy concerns and any other businesses which, though based on land, can be viewed as a source of pollution of the marine environment, should contribute to an EU fund geared towards the conservation of marine flora and fauna, including the replenishment of fish stocks, and that the Commission should make an effort to ensure a more uniform and effective application of the 'polluter pays' principle;
76	Calls on the Commission to take action to control pollutants (environmental pollution of the seas) from agricultural run-off, sewage or industrial effluents and litter which is often plastic and which can choke sea mammals, turtles and birds; stresses that such pollutants are becoming an increasing hazard, impacting severely on the fisheries sector and on tourism as well as reducing the quality and health of fisheries products destined for human consumption; calls on the Commission, with regard to ocean-going vessels, to urge Member States to implement Annex V of the MARPOL Convention, which prohibits the discharge of plastic waste and ash from plastic incineration into the sea; calls on the Commission to amend Directive 2000/59/EC on port reception facilities in order to improve the adequacy and availability of such facilities in the EU and ultimately reduce the discarding of refuse into the sea;
77	Urges the EU, in the context of international maritime policy, and the UN Convention of 10 December 1982 on the Law of the Sea and the Agreement of 28 July 1994 relating to the implementation of Part XI thereof
78	Encourages the Commission to undertake specific science-based environmental and socio-economic statistical and other studies of the maritime regions in order to monitor and control the effects that the development of economic, sports, and recreational activities have on those regions;
79	Is concerned at the lack of well-trained personnel in important land-based sectors of the maritime economy; considers that, employment campaigns, run jointly by the Member States and the enterprises concerned, can help to alleviate the problem;
80	Calls on the Commission and the Member States to involve all relevant stakeholders concerned in all stages of the process of improving EU maritime policy, both in implementing and enforcing existing legislation and in drafting new initiatives;
81	Stresses the fact that, if developed wisely, tourism is a sustainable source of income for local economies, ensuring the protection and enhancement of the environment as well as the promotion and preservation of cultural, historical and environmental features, crafts, and sustainable maritime tourism; therefore particularly urges investment in tourism infrastructure in connection with sailing, diving and cruises, and the protection and promotion of archaeological marine treasures;
82	Emphasises that the subsidiarity principle applies to tourism; stresses the need to respect national plans based on experience and best practice;
83	Stresses the fact that the lack of appropriate and comparable data is one of the key problems in obtaining reliable data on the employment situation in the coastal tourism industry;
84	Also considers that a clean environment and good air and water quality are vital for the sector's survival and that, therefore, all future European tourism projects should be considered with a view to ecological acceptability and sustainability;
85	Notes that Europe is a favourite destination for cruises; stresses that the supply of services should be organised in such a way that it guarantees open competition and that the need for better infrastructure regarding this activity must be met;
86	Takes the view that traditional seasonal business should be developed into a year-round activity; stresses that the sector should make use of the opportunity to invest in sustainable, year-round tourism activities; considers that extending the season can create jobs and bring about economic success; emphasises that, in terms of sustainability and environmental education, examples of best practice can have a significant influence on the concept of tourism; highlights that the main objective is that the sector and the coastal environment benefit from extending the seasonal business period;
87	Believes that European Agenda 21 for the sustainability of European tourism must take into account the specificity of coastal tourism, and island tourism, and present useful initiatives and share good practices that are efficient in fighting seasonality, such as, for example, developing tourism geared towards senior citizens;
88	Calls on the Commission to propose a sustainable European maritime tourism strategy that adopts an integrated policy approach;
89	Recalls its resolution of 14 November 2006 on a Thematic Strategy on the Protection and Conservation of the Marine Environment
90	Recognises that a healthy marine environment constitutes the basis for sustainable development of the shipping sector in the EU and recalls the EU's commitment to incorporate the environmental dimension into all aspects of Community policy;
91	Insists that a clean marine environment, with sufficient biodiversity to ensure the proper functioning of its component ecosystems, is essential for Europe; further insists that, because of the intrinsic value of maritime areas, the benefits of a good marine environmental status in the EU extend well beyond the potential economic gains to be made from exploiting the various components of the seas, coastal waters and river basins and that, therefore, the conservation and, in many cases, rehabilitation of the EU's marine environment is imperative;
92	Recalls the principle underpinning the ecosystem approach to the management of human activities as one of the key elements of the Thematic Strategy on the Marine Environment; insists that this principle also be applied with regard to maritime policy;
93	Stresses in the strongest possible terms that the criteria used to define good environmental status must be sufficiently far-reaching since these objectives, which pertain to quality, will probably constitute the benchmark for action programmes for a long time to come;
94	Also considers that measures to improve water quality must be taken swiftly and is, therefore, concerned at the extended timetable proposed in the proposal for a directive on a marine strategy;
95	Insists that the implementation of a network of marine protected areas be accelerated;
96	Is convinced that a clean marine environment is critical for marine species, including both commercial fish and fish that are not commercially exploited, and that the replenishment of depleted fish stocks depends on a reduction in marine pollution as well as in fishing levels; considers that, in order to ensure that fishmeal used in the EU is not contaminated, it is imperative to reduce marine pollutants;
97	Draws attention to the sometimes disastrous impact of exotic organisms in the marine ecosystem and recognises that invasive alien species are a significant threat to marine biodiversity; calls on the Commission to take urgent measures to prevent the transfer of organisms in ballast water and to introduce effective controls on the discharge of ballast water within EU waters;
98	Considers that the concept of clustering could have a positive impact on the marine environment if habitat conservation, pollution control, and other environmental technologies are incorporated into the design and implementation of clusters from the planning stages onwards;
99	Welcomes the recognition by the Commission that a comprehensive system of spatial planning is necessary in order to ensure a stable regulatory environment and a legally binding basis for decision making; considers that an essential criterion for effective ecosystem-based spatial planning must be to organise activities in such a way as to reduce the impact of environmentally damaging activities on ecologically sensitive areas while simultaneously using resources in all other areas in an ecologically sustainable manner; in this context insists on the use of the Strategic Environmental Assessment instrument under Directive 2001/42/EC of the European Parliament and of the Council of 27 June 2001 on the assessment of the effects of certain plans and programmes on the environment
