55	"	Calls on the Member States to consider gender-neutral legislation when it comes to sexual violence and to consider that buying sex from a child (i.e"	a minor) should be criminalised in accordance with Article 1 of the Optional Protocol to the UN Convention of the Rights of the Child on the Sale of Children, Child Prostitution and Child Pornography adopted by the UN General Assembly on 25 May 2000; stresses that public awareness is crucial in order to combat and reduce demand for child prostitution and child pornography;
56	"	Recalls its recommendation of 16 November 2006 to the Council on fighting trafficking in human beings – an integrated approach and proposals for an action plan"
57	Urges the Member States to take effective legislative and other measures, including the collection of data broken down by age and sex in order to prevent and eliminate all types of violence committed within their territories, in both the private and public spheres;
58	Calls also on the Commission to support the rapid ratification of the above-mentioned Optional Protocol to the UN Convention on the Rights of the Child and the Optional Protocol to that Convention on the Involvement of Children in Armed Conflict;
59	Calls on all the EU institutions and Member States to ensure full protection and assistance for victims of trafficking, with particular regard to finding appropriate durable solution for child victims of trafficking;
60	Calls on all the institutions and Member States to take an active part in combating trafficking in children for all forms of exploitation including labour (e.g	child labour
61	Calls on the Commission to proceed immediately with an evaluation of the national implementing measures taken under Framework Decision 2004/68/JHA with a view to a proposal for the immediate amendment of national provisions which are contrary to that Decision, and supports the commitment shown by the Commission which, in conjunction with the main credit card issuing companies, is assessing the technical feasibility of excluding websites involved in online sales of child pornography material to be excluded from the online payment system or introducing other restrictions; calls likewise on other economic players such as banks, bureaux de change, Internet service providers and search engine operators to take an active part in efforts to combat child pornography and other forms of commercial exploitation of children; calls on the Council and the Commission, with regard to Directive 2007/65/EC of the European Parliament and of the Council of 11 December 2007 amending Council Directive 89/552/EEC on the coordination of certain provisions laid down by law, regulation or administrative action in Member States concerning the pursuit of television broadcasting activities
62	Draws attention to the exploitation of children and minors in fashion, music, film and sport;
63	Calls for the creation, in the interests of the defence of children's rights, of an adequate, effective and proportionate regulation system in dialogue with providers, the media (public and private television companies, advertisers, the press, video games, mobile telephone operators and the Internet) and industry, aimed, among other things, at prohibiting the broadcasting of harmful images and content (including cyber bullying) and the marketing of violent video games, which, by encouraging violence and sexism, may cause harm to children's physical and psychological development; points with concern, moreover, to the growing problem of MMS exchanges of pornographic or child-abuse related images; expresses its support for the Safer Internet plus Programme through the implementation of operational and technical measures, especially for the protection of children; within this framework, also calls on the Member States and Internet service providers, in collaboration with search engine companies and the police, to implement blocking technology to stop Internet users from accessing illegal sites related to child sexual abuse and prevent the public from accessing material depicting the sexual abuse of children; 
64	Welcomes the beginning of the implementation of a European framework for the safer use of mobile telephones by adolescents and children, which was adopted as a self-regulatory code between leading companies in this sector in the EU and which will be followed by the adoption of corresponding national self-regulatory codes; emphasises that this framework constitutes a first important step towards ensuring the protection of minors from specific dangers arising from the use of mobile phones, but that it is essential that the Commission constantly monitor and evaluate its implementation at national level with the aim of evaluating its results and examining the need to adopt a Community legislative initiative;
65	Supports the creation of a uniform classification and labelling system in the EU for the sale and distribution of audio-visual content and video-games intended for minors, so that the European standard serves as a model for countries outside the EU;
66	Recalls that a special label for online games was recently added to the existing European system for age-classification of computer and video games (PEGI); takes the view that the Commission and the Member States should encourage and give greater support to self-regulation of this kind in the labelling of games, in order to provide better protection for minors from inappropriate content and to inform parents of possible risks associated with the games, as well as drawing good examples to their attention;
67	Calls on the Member States to tighten their controls over the content of television programmes shown at a time when the number of child viewers is at its highest and to aid parental control by providing adequate, homogenous information about television programmes; emphasises that information technology gives further possibilities for children to access television programmes at any time, from any computer with an Internet connection; points out that greater consideration is needed to review the mass media's unrestricted right of access to children and the right of the child to access the mass media without restriction;
68	Points out that there has been an alarming increase in all Member States in the phenomenon of juvenile delinquency involving juvenile perpetrators and - in most cases - victims, a situation which calls for an integrated policy, not only at national, but also at Community level; recommends therefore, as a necessary measure, that an authoritative survey of the problem be compiled without delay and that a framework programme integrated at Community level then be drawn up, grouping together measures around three guidelines: preventive measures, social integration measures for juvenile perpetrators and judicial and extrajudicial intervention measures;
69	"Emphasises that the promotion of ""children's culture"" by the European Media and Culture Programmes must be stepped up and calls on the Council and the Commission to use innovative projects in child-friendly form to encourage a delight in European culture and European languages and stimulate children's willingness to learn at an early age; also underlines the importance of media literacy to promote more informed use of the various media with the introduction of educational content;"
70	Calls on the Member States and the Commission, in its future strategy, to draw up a comprehensive prevention plan against youth crime and bullying in schools and other harmful behaviour and the specific problem of youth gangs involving in particular families and schools, the social services working in support of families, sports and youth centres, young people themselves, with a focus on providing opportunities and promoting their active participation in society; recommends that the Member States share their good practices with each other;
71	Calls for the establishment of safe, well-publicised, confidential and accessible mechanisms for children, their representatives and others to report violence against children; all children, including those in care and justice institutions, should be aware of the existence of complaint mechanisms;
72	Calls for the Member States to introduce a system of access to information on child abuse convictions to ensure that people who, as a result of convictions on sex abuse charges, should be considered as unsuited to working with children can be excluded, ultimately throughout the Union, from access to certain occupations involving contact with children, in accordance with its position of 1 June 2006 on the initiative by the Kingdom of Belgium with a view to the adoption by the Council of a framework decision on the recognition and enforcement in the European Union of prohibitions arising from convictions for sexual offences committed against children
73	Calls for efforts to tackle the sale and consumption of drugs and alcohol in educational establishments and in their vicinity, and for children to be provided with information about the dangers they present;
74	Requests that the Member States determine a common understanding of what constitutes child abuse, given that they have differing legislation concerning the age of consent, for example;
75	Calls for the effective protection of children against sexual exploitation including by considering sex tourism involving children as a crime in all the Member States and by making it subject to extraterritorial criminal laws; calls for any citizen of the Union committing a crime in a third country to be dealt with under a single set of extraterritorial criminal laws applicable throughout the EU, in accordance with the Optional Protocol to the UN Convention on the Rights of the Child on the Sale of Children, Child Prostitution and Child Pornography; 
76	Calls for Europol to be duly mandated to cooperate with the police forces of Member States and countries affected by this type of tourism in order to conduct investigations with a view to identifying those responsible for such crimes and to this end calls for the creation of European liaison officer posts; calls for adequate measures for the rehabilitation and social integration of the victims of sexual exploitation who have been liberated from their exploiters; calls as well for more comprehensive information on child sex tourism in the Member States; 
77	Encourages Member States to set up a legislative framework to penalise child sex tourists and calls on the Member States and the Commission to explore the possibility of adopting a concerted EU strategy against child sex tourism and to sign and promote codes of conduct in the hotel and tourism industry, such as the ECPAT
78	Highlights the fact that a large majority of child victims of trafficking for commercial sexual exploitation reasons such as prostitution and the production of child pornography, as well as in the case of forced marriages, are teenage girls, which consequently makes human trafficking a major gender issue; emphasises, moreover, that even within groups involved in attempts to control and stop human trafficking, conventional attitudes about the relationship between the sexes and traditional perceptions of the roles of women and girls are still present;
79	Calls on all Member States to regard a child who has witnessed domestic violence as a victim of crime;
80	Calls on all Member States that have not yet done so to ratify the Protocol to Prevent, Suppress and Punish Trafficking in Persons, Especially Women and Children, supplementing the UN Convention against Transnational Organized Crime, adopted by the UN in Palermo in 2000 and to take all necessary measures to provide protection for child victims of human trafficking, inter alia by permitting victims of trafficking to remain in their territory on a temporary or permanent basis;
81	Recommends that the future EU strategy should attach particular importance to the medical, psychological and social care of children who are victims of neglect, abuse, ill treatment, exploitation and direct and/or indirect violence, taking the best interests of the child and the gender dimension into account; recalls that the impact of indirect violence on children's well-being and prevention of such violence should be included in the Commission's work; stresses that these issues are often linked to poverty and social exclusion among families and that new social policies with a greater stress on solidarity are needed if these problems are to be tackled;
82	Calls on the Commission and the Member States to investigate the role played by demand for both sexual exploitation of children and other forms of exploitation of children; calls, once this is ascertained, for measures to be taken to reduce this demand, inter alia by campaigns directed at the public; looks on trafficking in children as a form of organised crime, and therefore calls for joint efforts by the Member States to combat such crimes; calls on the Member States to give priority to children's right to protection;
83	Calls on all the Member States to recognise that girl children are disproportionately represented among the sexually exploited and that efforts to end the sexual exploitation of children  must therefore implement a gender perspective;
84	Takes the view that gender relations between girls and boys in the early stages of life pave the way for gender equality in other phases of the life cycle;
85	Calls for alternatives to imprisonment to be provided for in relation to minors, with due consideration for the seriousness of the offence committed, and for re-education measures
86	Notes that the age of criminal responsibility is not currently the same in all the Member States and requests that the Commission undertakes a study concerning the differing views among Member States of the age of criminal responsibility, their treatment of young offenders and their effective strategies concerning the prevention of juvenile delinquency;
87	Stresses the need to provide legal practitioners in the youth justice sector (judges, lawyers, social workers and police officers) with specific training;
88	Expresses the wish that a specialised section on children's rights be set up in the European Court of Human Rights;
89	Calls on the Member States to implement serious measures to ban all different forms of exploitation of children including exploitation for prostitution or other forms of sexual exploitation, forced labour or services, slavery or practices similar to slavery or servitude, use of children associated with begging, illegal activities, sport and related activities, illicit adoption, forced marriage or any other forms of exploitation;
90	Calls for action to be taken on the problem of the international abduction of children, who are often fought over by parents following separation or divorce, giving prime consideration in all circumstances to the best interests of the child;
91	"Stresses that Article 3 of the UN Convention on the Rights of the Child states that ""In all actions concerning children, whether undertaken by public or private social welfare institutions, courts of law, administrative authorities or legislative bodies, the best interests of the child shall be a primary consideration""; under the 1980 Hague Convention on the Civil Aspects of International Child Abduction (the Hague Convention), the interests of the child are understood to mean a rapid return after abduction; however, the interests of the child encompass more than simply a rapid return, for example a secure direct physical environment, a climate of affection, a supportive, flexible family structure, appropriate role-modelling by parents, continuity of upbringing and care, as well as decent living conditions; the Hague Convention takes no account of these criteria; for example, it does not consider who the abducting parent is, whether or not that parent has parental responsibility, how old the child is, how long the child has already spent in the other country, whether the child goes to school and has made friends there, etc.; it may be concluded that despite the ""good"" intentions of the Hague Convention and Regulation (EC) No"	2201/2003, the rights of the child are often not well protected; calls on the Commission to take action to protect the rights of the child better here too, and urges it to make proposals to that effect;
92	Calls for appropriate and swift measures to be taken to look for and identify missing and abducted children, including the use of the Schengen Information System to prevent them from crossing borders; welcomes the European communications hotline for missing children and the corresponding action of NGOs and encourages the Commission to promote the creation of a European open telephone agency for children and young people with problems;
93	Calls on the EU institutions and the Member States to implement UN General Assembly resolutions A/RES/46/121, A/RES/47/134 and A/RES/49/179 on human rights and extreme poverty, A/RES/47/196 on observance of an international day for the eradication of poverty, and A/RES/50/107, on observance of the International Year for  the Eradication of  Poverty and  proclamation of the first  United Nations Decade for the Eradication of Poverty, and UN Economic and Social Council documents E/CN.4/Sub.2/1996/13, E/CN4/1987/NGO/2, E/CN4/1987/SR.29 and E/CN.4/1990/15, on human rights and extreme poverty, E/CN.4/1996/25, on the right to development and E/CN.4/SUB.2/RES/1996/25 on the realisation of economic, social and cultural rights;
94	Recalls that 19% of children in the EU live below the poverty line and that appropriate assistance measures geared to the needs of children must therefore be taken, including measures to support their families, and calls on the Member States to adopt ambitious and achievable targets for reducing - and eventually eradicating - child poverty;
95	Advocates the creation of suitable structures in the Member States for helping children and parents adapt to changed family circumstances;
96	Calls on the Commission to take steps to allow children to enjoy their childhood years and take part in children's activities without suffering social discrimination or exclusion;
97	Calls on the Commission to seek the integration of strategies specifically addressing child poverty, youth unemployment and social inclusion of minorities within all relevant development strategies including Poverty Reduction Strategy Papers and Indicative Programmes;
98	Calls on the institutions concerned to provide children with an opportunity to make a real contribution to fighting poverty; calls, with a view to combating child poverty more effectively, for all the parties concerned, including the poorest children, to be given a genuinely active part in the planning, setting up and evaluation of such projects to eradicate extreme poverty;
99	Stresses that action against the commercial sexual exploitation of children – i.e	trafficking in children for sexual purposes, child pornography and child sex tourism should be made one of the strategy's major objectives for action both within and outside the European Union, in particular in the light of the Millennium Development Goals (MDGs); points out that poverty is often one of the many causes of and reinforces social exclusion, discrimination and endangering of children; takes the view, however, that commercial sexual exploitation of children has its true origin in the demand for sex with children and in organised crime, which is prepared to exploit situations that place children at risk;
