78	Is aware of the benefit of coach holidays for tourists with lower incomes and for the development of tourism in regions which are not serviced by regional airports or railways; draws attention to the special situation of small and medium-sized coach companies vis-à-vis  Regulation (EC) No 561/2006 of the European Parliament and of the Council of 15 March 2006 on the harmonisation of certain social legislation relating to road transport
79	Stresses that small and medium-sized enterprises should have greater involvement in tourism-related entrepreneurship and that possibilities for simplifying procedures to obtain financial support should be found; further stresses  that EU sponsored training and best practice adoption courses should be introduced in regions, especially in the new Member States;
80	"Suggests that the Commission study the possibility of a ""Youth Transport Pass"" for young Europeans receiving Erasmus, Leonardo or Comenius grants or carrying out voluntary civilian service in the EU, so as to make it easier for them to travel and familiarise themselves with their host country;"
81	Stresses that, on the basis that the Leonardo da Vinci programme is one of a kind in the tourism sector of numerous countries, these opportunities should be developed and promoted; emphasises that this would lead to a vast improvement in the educational programme; highlights that, in addition to the implementation of the programme, research into results achieved should be carried out;
82	Draws attention once more, given the scale of forthcoming change in the demographic structure of the EU, to the need to implement a European tourist programme for retired people out of season, which would improve the quality of life of senior citizens in the EU, create employment and generate greater demand and growth in the European economy; believes that this could be called the Ulysses Programme;
83	Approves the Commission's plans to facilitate the cooperation of actors that foster the acquisition of knowledge, such as universities, research institutes and public and private observatories in the field of tourism, and to encourage mobility across Europe through the support of trans-national training and work placements and exchanges and through the development of training methods, materials and contents;
84	Calls on the Commission to request that an overall impact assessment be carried out in relation to the idea of staggering European holidays in terms of dates and on a regional basis;
85	Stresses the need for Community assistance for Member States whose tourist sector has been affected by natural disasters;
86	Stresses the importance of multilingualism in tourism policy and recommends that information be provided, in as many Member State languages as possible, on sites which can be visited;
87	Instructs its President to forward this resolution to the Council, the Commission and the governments and parliaments of the Member States.
