A	whereas the European Union is facing the biggest economic and financial crisis since the depression of the 1930s and whereas unemployment rates in all Member States, and especially the southern Member States, have risen significantly as a result of this crisis; whereas the effects of this crisis are particularly serious for vulnerable people, and in particular for women, who are affected directly – through loss of their jobs or pay cuts or loss of job security – and indirectly through budget cuts in public services and welfare; whereas, this being the case, it is essential among other things that the dimension of gender equality in the handling of this crisis and the development of solutions be very seriously examined;
B	whereas the right to work is an essential precondition if women are to enjoy effective equal rights, economic independence and professional fulfilment; whereas the current crisis is not only a financial and economic crisis, but also a crisis for democracy, for equality, for social welfare, and for gender equality, and is also being used as an excuse to slow down or even halt crucial efforts to tackle climate change and the environmental challenges ahead;
C	whereas recent studies have shown that only 5 % of decision-makers in the EU's financial institutions are women, while all 27 central bank governors in the Member States are men; whereas gender studies have shown that women manage in a different way by avoiding risk and focusing more on a long-term perspective;
D	whereas at the beginning  the economic crisis had a greater impact on men than on women,; whereas unemployment has risen since then at different rates for men and women; whereas women were not hit initially by the crisis but are now increasingly feeling its effects (higher and increasing number of precarious and part-time jobs
E	whereas women play a critical role in driving economic development; whereas further empowering women can have the economic effect of lifting communities and families out of poverty;
F	whereas in a crisis situation labour market policy tends to focus on influencing the general level of employment, and not on economically inactive women;
G	whereas it should be noted that unemployed women are often not included in official statistics and that gender inequalities in terms of inactivity rates are often underestimated as women tend more frequently to withdraw from the labour market for various reasons (pregnancy, family responsibilities, time constraints) and to perform unpaid or informal work, often in the home or caring for dependents or serving the shadow economy, while few studies currently exist concerning the impact of cuts in public expenditure relating to gender equality;
H	whereas budget cuts by governments implementing austerity plans are mostly affecting the public sector and its welfare services, which are staffed and benefited mainly by women – who make up some 70 % of public-sector employees – but also the private sector, with women now becoming the main victims of austerity measures; whereas to date no country has assessed the impact of the proposed cuts in public spending and of the consequences of fiscal consolidation from a gender perspective, be it the impact of the individual measures or their cumulative impact;
I	whereas women are more dependent on social benefits which are being cut as part of austerity measures;
J	whereas a crisis situation like the current one calls for deep structural reforms in the job market;
K	whereas for women a fall in the number of jobs frequently goes hand in hand with the readjustment of work schedules, including longer working hours often involving different shifts; whereas it is extremely likely that recovery will be felt more rapidly in the industrial sector, thereby bringing about recovery in male employment, which will pick up faster than female employment; whereas austerity measures in the public services will have a more lasting effect on female employment, thus jeopardising in the long term the progress that has been made in the field of gender equality;
L	whereas the crisis is leading to increasing exploitation of women in both the legal and the illegal economy; whereas its effects will impact in the longer term on those women who have a non-linear career path (including those in poorly paid temporary, part-time, intermittent, atypical, or even informal employment), often with part-time working imposed, resulting in women having an incomplete pension contributions record and in a higher percentage of women at risk of poverty; whereas women may end up with entitlement only to a very small pension and thus be pushed below the poverty line; whereas there is a risk of the emergence of a whole ‘lost generation’ of  young people, both men and women, deprived of job opportunities, secure employment and, often, educational opportunities because of economic hardship;
M	whereas the crisis is adding to the difficulties of reconciling career and family roles; whereas the impact on employment of having children differs between women and men; whereas the labour market participation rate for mothers is 12 % lower than that for women without children, while the employment rate for fathers is 8,7 % higher than for men without children;
N	whereas the gender dimension has not been taken into consideration in the current and planned initiatives and policies aimed at exiting the crisis;
O	whereas female employment is affected by gender stereotypes, such as the notion that male unemployment is a ‘more serious’ issue than female unemployment, adding to the already significant collection of gender stereotypes which impact negatively on women's chances of employment; whereas in practice the approach to male unemployment is different from that to female unemployment, since men are still considered as the breadwinners and women as the main family caretakers; 
P	whereas approximately 23 % of EU citizens were at risk of poverty or social exclusion in 2010
Q	whereas the crisis has further aggravated the social end economic condition of many disadvantaged communities and has contributed to an increased school dropout rate among girls and an even greater vulnerability to trafficking;
R	whereas cutbacks in services and benefits have compromised women's economic independence, as benefits often constitute an important source of their income and as women tend to use public services more than men; whereas single mothers and single female pensioners face the biggest cumulative losses;
S	whereas rising numbers of women are taking informal and  unpaid work (voluntary or otherwise) with less social protection in order to escape the crisis; whereas according to an OECD study
T	notes that the decrease in the employment gap between men and women is more a reflection of a general degeneration in living and working conditions than of progress towards increased gender equality;
U	whereas women entering working life are playing a leading role in the return to growth; whereas they enable the family income to rise, which brings about a rise in consumption and helps boost the economy; whereas gender equality therefore has a positive impact on productivity and economic growth;
V	whereas the recent secondary analysis of the 5th EWCS (‘Women, men and working conditions in Europe: Secondary analysis of the 5th European Working conditions survey’, Eurofound 2012, to be published in 2013) shows that gender segregation is detrimental for both male and female workers; whereas both men and women report increased wellbeing at work and greater job satisfaction where they work with colleagues of both sexes; whereas scope nonetheless remains for combating gender segregation on the labour market, occupational gender polarisation, and the existence of ‘mono-gendered’ workplaces (given that three-fifths of workers in Europe are employed at a single-sex workplace);
W	whereas gender equality measures have been cancelled or delayed and potential future cuts in public budgets will have a negative effect on female employment and on the promotion of equality;
X	whereas the economic downturn should not be used as an excuse to slow down progress on work/life policies and to cut budgets allocated to care services for dependents and leave arrangements, affecting in particular women's access to the labour market;
Y	whereas violence against women is a widespread phenomenon in all countries and all social classes; whereas economic stress often leads to more frequent, more violent and more dangerous abuse, and whereas studies have also shown that violence against women intensifies when men experience displacement and dispossession as a result of economic crisis;
Z	whereas women benefited most from job creation in the EU between 1998 and 2008 (the respective female employment rates in the EU being 55,6 % and 62,8 %)
AA	whereas in 2011 31,6 % of women worked part-time as opposed to 8,1 % of men;
1	Recalls that gender equality is one of the core objectives of the European Union and that it must be a key consideration when defining the response to the current economic and financial crisis, including investment in the public sector, the welfare sector, and environmentally sustainable housing, transport, etc, as well as  generating state revenue through more efficient taxation policies; deplores the fact that policy responses to the crisis, including recovery packages, have failed to acknowledge, analyse and rectify the gender impact of the crisis; condemns the fact that there has been virtually no mainstreaming of the gender perspective into the post-Lisbon strategy, and hence calls on the Council, the Commission and the Member States to mainstream gender equality, via specific targets in the macroeconomic and employment guidelines;
2	Invites the Commission to integrate the gender dimension into all policies, in particular those concerning: impact of austerity measures and recovery from the crisis; economic governance; sustainable development and green jobs; vocational education and training; migration, cooperation and development; health and safety; and measures to be planned or implemented to counteract or limit the effects of the crisis;
3	Calls on the Member States to review and highlight the immediate and long-term impact of the economic crisis on women, with particular reference to whether and how it is worsening existing gender inequalities, and to related consequences such as increased risk of gender-based violence, declining maternal and child health, and poverty among older women;
4	Recalls that, having seen the employment rate for women climb steadily for over ten years to reach a level of 62,8 % in 2008, the EU has now seen that rate fall slightly since the beginning of the economic crisis, to 62,3 % in 2011; stresses, therefore, the need for lasting responses that take the gender equality dimension into consideration in both EU and Member State policies to safeguard employment and renew growth;
5	Invites the Commission to consider a further adaptation of the Structural Funds, in order to ensure additional support for areas of women's employment likely to be affected by the crisis, as well as support for childcare, training and access to employment;
6	Stresses the importance of the flagship initiative ‘Platform against Poverty and Social Exclusion’; invites the Member States to make full use of the Europe for Citizens Programme and the upcoming Programme for Social Change and Innovation, especially with regard to the effective implementation of gender equality objectives; stresses the importance of the Daphne III programme, especially with regard to the protection of women against all forms of violence and the need to achieve high levels of health protection, wellbeing and social cohesion; 
7	Stresses the fact that, despite unemployment rates for men and women being comparable, the crisis affects women differently; points out that working conditions for women have become considerably more insecure, especially with the increasing prevalence of atypical forms of contract, and that women's incomes have fallen significantly thanks to a number of factors, including the persistent wage gap (nearly 17 %) between men and women and the resultant inequality in their respective levels of unemployment benefit, the rise in compulsory part-time working, and the rise in the number of temporary or fixed-term jobs to the detriment of more stable employment; whereas with the persistent gender pay gap and the resultant inequality in unemployment benefit levels, the crisis has worsened women's situation in the labour market; points out that the experience of previous crises shows that the male employment rate generally recovers more quickly than that for women; 
8	Calls on the Commission to submit, as soon as possible, a proposal for a directive setting out measures for overcoming the gender pay gap for equal or equivalent work;
9	Recalls that very wide disparities still exist between Member States, with the employment rate for women varying between 48,6 % and 77,2 %, and that the contrast in these situations calls for specific, tailor-made responses as part of an overarching European approach; emphasises, moreover, the need to have reliable common indicators, and thus reliable comparable statistics, so that differing situations can be assessed, needs determined and suitable responses found;
10	Recalls that even before the economic crisis, women were in the majority in temporary and part-time employment, and that the crisis has reinforced this trend, hence placing many women at a heightened risk of social exclusion; notes that this has been particularly the case in the southern Member States;
11	Notes with concern that female youth unemployment increased from 18,8 % in 2009 to 20,8 % in 2011, and that the crisis will impact especially harshly on disadvantaged groups of women, including inter alia women with disabilities, immigrant women, women belonging to ethnic minorities, women with few qualifications, women who are long-term unemployed, single mothers, women without livelihoods and women caring for dependents; welcomes the Commission's package of measures aimed at tackling the present unacceptable levels of youth unemployment and social exclusion and offering young people jobs, education and training;
12	Believes that the right to work is an essential precondition if women are to enjoy effective equal rights, economic independence and professional fulfilment, and therefore insists that precarious employment should be eradicated by recognising and enhancing the right to jobs with rights;
13	Calls on the EU and the Member States to reformulate their current responses to the economic crisis in order to ensure that the measures undertaken are long-term in scope and do not undermine the welfare policies and public sector structures that are a precondition for greater gender equality, such as social services and care facilities, healthcare, education, and workers' rights;
14	Recalls that it is becoming increasingly difficult for women to make the transition from education to employment, and that this will ultimately lead to divergences in men's and women's assessment of their own skills;
15	Considers that the structural reforms arising from the handling of the current crisis offer an opportunity to correct certain types of gender discrimination which remain too common on the European job market;
16	Emphasises that women account for a larger proportion of the informal economy than men, partly because there is greater deregulation in the sectors in which women traditionally work, for example domestic service or care work; notes, on the other hand, that the informal economy has grown as a result of the crisis, although it is very difficult to obtain a clear picture of it in the absence of reliable data on incidence and impact;
17	Stresses that women have played a vital role in resisting the crisis; firmly believes that women offer considerable potential for the improved competitiveness and performance of business, particularly where they are in management posts; considers that involving women in the drawing-up and management of recovery plans to encourage social cohesion is, therefore, a matter of particular urgency;
18	Insists on the need to ensure that the current economic and financial crisis and the consequent budget restrictions do not jeopardise the progress achieved by policies promoting gender equality and do not serve as a pretext for reducing efforts in this respect; believes it should, rather, encourage Member States to incorporate gender equality policies into their employment policies, considering the latter as part of the solution to the crisis, in terms of harnessing and fully exploiting the skills and abilities of all Europeans; calls on the Member States to ensure that a gender mainstreaming aspect is included in all planned fiscal policies;
19	Stresses that women's rights should not be seen, understood or pursued as competing with men's rights, since the improvement of care services and public services for families is a precondition for both men's and women's participation in the labour market; points out that there is a need to promote the sharing of family and household responsibilities; invites the Member States to introduce measures or develop existing measures aimed at overcoming gender discrimination and the unequal assignment of roles, such as encouraging men in their right to care for children and sick or disabled relatives;
20	Stresses that the falling birth rate in the EU has been exacerbated by the crisis, given that unemployment, precarious situations and uncertainty regarding the future and the economy have led couples, and younger women in particular, to delay having children, thereby further reinforcing the trend to demographic ageing in the Union;
21	Stresses the importance of reforming macroeconomic, social and labour market policies in order to guarantee economic and social justice for women, develop strategies to promote the fair distribution of wealth, guarantee a minimum income and decent wages and pensions, reduce the gender pay gap, create more high-quality jobs for women coupled with rights, enable women to benefit from public services of a high standard, and improve welfare provision and neighbourhood services, including creches, kindergartens and other forms of pre-school education, day centres, community leisure and family support centres, and intergenerational centres;
22	Recalls that cuts in public budgets are not gender-neutral but are, rather, the result of the Union's macrostructural economic policies, in particular the implementation of the measures contained in ‘economic governance’ and financial adjustment programmes which are causing and will continue to cause increasing gender inequalities, female unemployment and the feminisation of poverty; believes that a change in policy is therefore required, since women are in the majority in public-sector employment and are the principal beneficiaries of social policies; calls, therefore, for the relevant budget headings to be increased;
23	Calls on the Member States and the Union institutions to undertake gender impact assessment when planning austerity measures, so as to ensure that their effects are as gender-neutral as possible;
24	Calls on the Member States to introduce gender budgeting in order to analyse government programmes and policies, their effects on resource allocation and their contribution to equality between women and men;
25	Stresses that women face a greater risk than men of slower career development as a result of accepting starting positions at lower levels or working part-time, and that women in this situation are, therefore, more vulnerable, have unsatisfactory income levels and suffer more from poverty;
26	Calls on the Member States and regional and local authorities to ensure the proper provision of affordable, accessible and high-quality care services for children and other dependents, and that these are compatible with the full-time working schedules of men and women;
27	Stresses the importance of immediate action to implement ‘return-to-work’ policies and business sector insertion schemes for these public-sector employees, the majority of whom are women, whose jobs are under threat from cuts in the public-sector budget;
28	Calls on the Commission and the Member States to mainstream the global approach to gender equality in all employment policies, to take the measures needed to assist women in their return to work, not only at lower-level posts but also at management level, and to incorporate this approach in the Union's employment guidelines; insists on the need for proper gender budgeting, especially in the context of the Multiannual Financial Framework for 2014-2020, in order to reach the objectives set in the Gender Equality Pact as well as in the 2020 Strategy;
29	Regrets the failure to include increasing the labour market participation of women in the Annual Growth Survey 2013 despite the fact that this is one of the EU 2020 headline targets; calls on the Council to add promoting female labour market participation as a priority when adopting this year's economic policy guidance in the framework of the European Semester;
30	Calls on the Member States to include and systematically address the issue of gender equality in all future national reform programmes;
31	Calls on the Member States to promote an active labour market policy, a strong social dialogue, job standards and social protection in order to safeguard the rights of women, including migrant women, fight against forced labour and combat undeclared work;
32	Calls on the Member States to take measures to encourage mothers to enter the labour market, for instance through teleworking, vocational training or reskilling policies, with a view to promoting an ‘assisted’ return to work after maternity leave;
33	Welcomes the proposal for a directive on a better gender balance  among non executive directors of companies listed on stock exchange  enabling women to enter higher-skilled and better-paid jobs, and calls on  the Member States to support  and prepare for its implementation; calls for similar binding legislation to be adopted by other employers, including European, national, regional and local public institutions, administrations and bodies, since these should set the example as regards gender equality in decision-making;
34	Calls on the Commission and the Member States to develop a strategy for promoting gender balance for small and medium-sized enterprises not covered by the above directive; condemns the fact that women are under-represented on the governing boards of financial institutions and are hence virtually excluded from the decision-making process in the financial field; calls on the Council, the Commission and the Member States to improve women's participation at all levels of decision-making, especially in the areas of budgeting and of governance arrangements for European financial systems, including in the European Central Bank; stresses, in this context, the need to promote financial literacy for girls and women;
35	Calls on the Member States to introduce policies for extensive training for employees of those sectors that are more affected by the negative consequences of the crisis or of globalisation in order to prepare them for job changes and new jobs, bearing in mind the specific place of women and the fact that women are more frequently than men forced to interrupt their careers to look after children or older or sick family members, which has an impact on their career paths; calls for training plans to be implemented systematically in businesses in order to prepare employee retraining, propose individual job transfers, and offer training suitable for jobseekers and low-skilled workers; calls also for the creation of a complete register of labour shortages, broken down per sector, in order to allow women to prepare and search for jobs in a targeted manner;
36	Calls on the Member States to review their social protection systems with a view to individualising pension rights and rights under social security schemes in order to eliminate the ‘breadwinner advantage’, thus guaranteeing equal pension rights;
37	Underlines that the expenditure cuts in the care sector de facto redistribute work on to the shoulders of women and undermine gender equality; and calls on all Member States to develop plans for the provision of care services that can generate social justice and gender equality;
38	Calls on the Commission and the Member States to promote vocational training policies and programmes for women of all age groups, paying particular attention to the urgent need for lifelong learning programmes and the need to acquire new skills in new technologies and in the IT sector, in order to improve women's access to and increase their participation in the various business sectors, including the economic and financial sectors where women employees are few, also envisaging specific support measures so that women are able to combine workload, training and family life; recalls the important role played by the European Social Fund in assisting entry into employment through training policies, and suggests that Member States and local authorities promote recourse to this fund for the benefit, especially, of women who are more affected by the economic crisis;
39	Underlines the importance of investing in women and gender equality;
