60	Emphasises the importance of developing of a pan-European Energy Community Treaty;
61	"Welcomes, in the context of the green paper, the Commission's recent initiative to undertake a study ""addressing the interlinkages between natural resource management and conflict in the Commission's external relations"", and stresses in particular the links between energy security and climate security; "
62	Asks the Commission to formulate, as the supreme aim of the EU's external energy policy, a reduction in the dependence on fossil fuels from a few big suppliers and to diversify the sources of energy, and, for this purpose, believes that a long-term plan with indicative dates should be presented to Parliament and Council; 
63	Stresses the fact that a new form of political dialogue and cooperation among consumer countries has become indispensable, especially with the US, China, India and Japan; notes that a similar dialogue between key consumer and producer countries has also become necessary in order to develop a global approach to energy; believes that these new forms of global energy dialogue should aim at making global energy markets stable, secure and transparent, and at the same time provide a continued boost in favour of clean energy sources and energy efficiency;
64	Calls on the Commission and the Council to develop a strategic energy partnership with countries such as China, India, South Africa, Brazil and Mexico to technically assist them in developing sustainable energy strategies and thereby secure their participation in climate change mitigation efforts;
65	Calls on the Commission, as a matter of urgency, to focus not only on closer cooperation with Russia, but also to step up cooperation with other energy exporters, the CIS and particularly the OPEC countries; welcomes the planned development of an EU-wide energy community; 
66	Urges the Commission and the Member States to take very seriously the real danger of a deficit in gas supplies from Russia after 2010 due among other things to a lack of investment, excessive leakage and energy waste in the Russian domestic market; insists that Member States make plain that the kind of investment necessary is more likely to be forthcoming if there is a higher degree of security for investments since these will not be made without long term contracts; insists that the Member States and the Union, in its energy-related discussions with Russia, demand the ratification of the Transit Protocol and the Energy Charter Treaty, something which is instrumental to ensuring future much-needed foreign investment in Russia's energy infrastructure and ensuring an adequate gas supply to the EU in the future; 
67	Notes that the informal European Council meeting in Lahti agreed that the principles of the Energy Charter and the G8 conclusions should be incorporated in the forthcoming agreement between the EU and Russia, which should, inter alia, include:
68	Stresses that a precarious energy and climate security situation is frequently the trigger for international crises and conflicts, which have consequences for democracy, human rights and poverty;
69	States that last winter's failure in the gas energy market of several Member States has already resulted in the relocation of enterprises in energy intensive industries; considers it necessary in this context to examine opportunities for promoting solidarity between Member States and considering how to deal with this issue as a priority in order to ensure the proper operation of both existing and future interconnectors; 
70	Calls on the EU to seek to include provisions governing energy trade in WTO regulations, enabling that organisation to become an international mediator able to resolve disputes concerning the delivery and distribution of energy; 
71	Believes that the EU has a responsibility to develop with the countries concerned decentralised energy solutions adapted to rural areas;
72	Calls upon the Commission to analyse and address the issue of technical failures in third countries that affect cross-border supplies to the Member States, such as the disruption of the oil supply from the Druzhba pipeline;
73	Stresses the need to increase diversity in the EU's gas market by seeking ways of securing greater energy supplies directly from producers in Central Asia, i.e	Kazakhstan, Azerbaijan, Turkmenistan and Uzbekistan; 
74	Calls for steps to be taken to ensure that the Pan European Energy Community (PEEC) is developed, extending the Energy Community Treaty to include Turkey, and examining the possibility of the Mashreq and the Maghreb joining the PEEC;
75	Calls upon the Member States to recognise that the EU energy market is still not fully liberalised and that full implementation is imperative; is of the opinion that a clear and stable political framework and a competitive and fair energy market is needed to establish a high degree of energy independence, long-term stability, efficiency, environmental sensitivity and security of supply; thus calls upon the Commission and the Member States to carefully assess the need for regulatory intervention against this background;
76	Notes that Member States have been encouraging energy market liberalisation policies in different ways and that differences can also be seen in their regulatory frameworks;
77	Calls for the 2007 Spring European Council to provide a broader vision of the common European interest in the energy field, in order to place the completion of the internal market in a clear political framework, something that is currently lacking; 
78	Calls on the Commission to use its powers under Article 86(3) of the EC Treaty to increase its efforts to unbundle gas infrastructure in order to promote competition in the gas transit network sector and incentivise operators to open markets to operators other than the traditional gas suppliers; 
79	Congratulates the Commission on the energy sector inquiry; calls on the Commission to pursue enforcement action including fines against companies which breach competition rules; encourages the Commission to pursue Member States which unduly protect national energy champions, and attempt to re-regulate end prices at a level below the market price, or attempt to block mergers and acquisitions as such behaviour would impede the development of the internal market; requests the  Commission to provide guidance on the appropriate form of long term supply contracts and conditions under which arrangements are acceptable; 
80	Considers that Member States and regions should ensure that small and medium-sized energy producers and large producers are treated equally on the market, with a view to protecting energy consumers against the effects of market monopolies;
81	"Urges the Commission in its appraisal of National Allocation Plans (NAPs) to reject the market distortions arising from NAPs and insists on the harmonisation of NAPs, many of which currently undermine the ""polluter pays"" principle;"
82	Calls on the Commission to put an end to regulated energy prices because these undermine the very essence of open energy markets; calls on the Commission above all to address regulated energy price systems for energy intensive industries because these undermine not only the EU energy market but also the internal market in other commodities; accepts that special measures might be necessary for EU energy intensive industries which are exposed to global competition, but that these measures must be taken in an coordinated way across the EU; urges therefore DG Competition to propose a clear set of criteria to define what are energy intensive industries exposed to global competition and to use these criteria to assess the validity of special national energy regimes for energy intensive industries;
83	Urges the Commission to take further steps to address concentrations in the energy market in case of abuse of market dominance;
84	Proposes significant increases in the powers of Member State regulators, who should be fully independent of government and industry, and the harmonisation of their powers  which could be achieved via the establishment of common rules on transparency, disclosure and accountability, which should be monitored by the Commission and annually by the European Parliament, and the setting of minimum binding guidelines on the procedure for the appointment of regulators; believes that national energy regulators should be given the role of advising competition authorities in the Member States and of ensuring that energy companies have a statutory obligation to give energy saving advice to customers;
85	Calls on the Commission to prepare a review of the power and independence of national regulators and only afterwards to prepare a recommendation on the harmonised development of regulation in the internal market;
86	Calls on the Member States to grant powers to national regulators, agreed at EU level, to deliver on cross–border electricity and gas transmission, including non–discriminatory grid access, transmission tariffs, capacity allocation, congestion management procurement and network operating, and a clear timetable for bids in the energy market; considers that national regulators should also insist on the need for network operators to act in the interests of European consumers; considers that, before a European regulator is established, the areas of responsibility of Member State regulators should be harmonised in order to ensure greater consistency of action aimed at improving the way the market works;
87	Urges the Commission and Member States to promote improved cooperation by Transmission System Operators (TSOs), especially in areas such as cross-border capacity allocation, transparency, intra-day markets, planning of grids and investments relevant to development of regional markets; asks the Commission to prepare, together with the TSOs, a European grid code;
88	Calls on the Commission to provide a solution to the problems relating to independence/conflicts of interests and transparency with regard to TSOs and to put forward proposals that enable TSOs to aquit themselves of their responsibility as market facilitators and to harmonise the international regulations for TSOs so as to improve cross-border transport; 
89	Calls on the Commission to ensure that there is strict compliance by the Member States with the conditions set out in Article 7(6) of Directive 2001/77/EC, namely that the transmission charges applied by operators for the transport of electricity through the grid do not discriminate in one form or another  against  electricity from renewable energy sources produced in peripheral regions, such as island regions and regions of low population density; urges the Commission to take further steps to end existing discrimination within Member States;
90	Calls upon the Commission and the Member States to carefully assess whether new institutions like a European Centre for Energy Networks are needed to create a level-playing field, given the already significant number of existing institutions which could be built upon;
91	Urges the Commission to provide greater support to interconnectors across the Member States and particularly within the Member States, thereby giving island and remote energy suppliers better access to the mainland grid;
92	Calls on the Commission to analyse precisely the existing problems in granting planning permission at borders and to submit a report to the European Parliament; calls on the Member States to grant planning permission at borders within a period of four years from presentation of an application; adds that one possible way to achieve this might be the introduction of legislation, where necessary; 
93	Takes the view that the establishment of regional energy markets should help to speed up the integration of EU energy markets and that, under no circumstances, should further barriers to the integration of all energy markets be raised;
94	Calls on the Commission to ensure that greater use is made of market-based allocation systems where cross-border transmission capacity is limited;
95	Calls on the Commission to make the establishment of well functioning harmonised regional electricity markets by 2009 a priority, with a view to integrating the markets with the biggest potential for development at European level by 2012 and to advancing the establishment of a single European energy market and grid ;
96	Notes that cross-border interconnections will require special measures, e.g	the preferential treatment of funding or tax exemptions; urges the EU to rapidly advance with its trans-European energy network (TEN) projects; notes that completing the missing links in TEN will improve security of supply as well as contribute to the completion of the internal market;
97	Considers it appropriate that the possible expansion of the regulatory framework must be deferred and that, instead, the implementation of existing EC rules in the Member States must be accelerated; considers that additional regulatory measures such as full ownership unbundling should be considered only if the mechanisms envisaged in the existing legislation relating to the internal market prove ineffective in practice; emphasises the importance of  improving the effectiveness of regulation and of ensuring proper, coherent implementation of the provisions relating to the separation of activities laid down in existing directives;
98	Urges the Commission to fully consider the recent reports by UCTE and ERGEG on the November 2006 electricity blackout caused in Germany when establishing its position on the future management and ownership of power grids and the need for new legislative initiatives to better regulate the EU power sector;
99	Believes that transmission systems in the energy sector should undergo full ownership unbundling immediately the Commission analyses that existing legislation is ineffective since this would prevent conflicts of interests from arising between competing energy companies;
