71	Reiterates its position that mainstreaming cannot replace the provision of new and additional resources which the EU and other donors have committed towards developing countries climate change mitigation efforts and adaptation needs; stresses that this approach must adopt a local and/or regional approach to addressing specific problems faced in these areas recalls that climate change financing –  and public goods in general – is not to be financed from ODA and must therefore be new and additional to Member States' commitments of 0.7 % of GNI to ODA;
72	Stresses the importance of promoting sustainable urban development as a part of the international agenda as well as implementing it at local, regional and national levels, which would have a beneficial impact on the quality of the life of all people in the world and, in particular, in developing countries;
73	Notes that sustainable development can only be achieved by enhancing recipient countries' capacity building and by improving basic infrastructure;
74	Demands the inclusion and implementation of Article 8(j) of the Convention on Biological Diversity, which is a pillar of sustainable development, in country and regional strategy papers;
75	Recognises that deforestation and unsustainable timber import onto the EU market have contributed to natural disasters and the vulnerability of poor countries, and calls therefore on the EU Commission and Council to integrate in their new development policy strategy a full-scale ban on circulation of illegal timber in the EU;
76	Reiterates its position that the EU should focus its development assistance on safeguarding the food security of developing countries and promoting sustainable, local, small-scale and organic agricultural production; emphasises the need to ensure, in particular, access for small farmers to the means of production (land, secured title deeds, seeds, training, credit, consultancy and advisory services), to processing and marketing opportunities and to local and cross-border markets;
77	Calls, in accordance with the IAASTD report, for support for a switch to organic and ecologically sustainable farming, which both takes account of the experience of small-scale farming and constitutes an effective means of adjustment to climate change;
78	Stresses the importance of specific support to women in agriculture, since research shows that closing the gender gap in agriculture could raise the total agricultural output in developing countries by 2.5-4 percent and that women spend a larger portion of income on food, health, clothing and education for their children; calls for the elimination of all forms of discrimination against women and for agricultural policies and programmes to be gender-aware; underlines that women must be seen as equal partners in sustainable development for agricultural development and food security;
79	Insists that the EU should also address the root causes of food insecurity, including weak accountability for the right to food, food-price speculation and ‘land grabbing’; reiterates that the reform of the Common Agricultural Policy must take into account the Treaty obligation of PCD strengthening, fair competition, supporting developing countries' ability and their own productive activity; calls for action aimed at eliminating land grabbing, unsustainable use of land and water, securing the property rights of smallholders and indigenous farmers and their access to farm land, and ending seed monopolies and dependency on specialised pesticides;
80	Notes that, in order to feed a world population expected to surpass 9 billion in 2050, agricultural output will have to increase by 70 % between now and then, using less land, less water and fewer pesticides; notes that global food security is a question of the utmost urgency for the European Union and calls for immediate and consistent action to ensure food security both for EU citizens and at the global level;
81	Underlines that tackling food insecurity means implementing many measures in diverse sectors, such as the management of local natural resources, the reinforcement of production and manufacturing, training, the structuring of professional organisations, the implementation of a safety net for the most vulnerable, the education on nutrition and also the diversification of rural jobs beyond agriculture to enhance the income of rural families, who are the first victims of hunger;
82	Points out that it is necessary to introduce better agricultural production methods, including low-cost technologies, provide research in agriculture and strengthen the productivity-efficiency ratio in developing countries in order to enhance sustainability;
83	Calls on EU and developing countries to promote land ownership as a tool for reducing poverty, by strengthening property rights and facilitating access to credit for farmers, small businesses and local communities;
84	Expresses its deep concern about the current farmland acquisition by government-backed foreign investors, particularly in Africa, which risks undermining local food security and causing unforeseen and far-reaching social unrest if it is not properly handled;
85	Underlines that the EU's Fisheries Partnership Agreements (FPAs) should help consolidate the fisheries policies of partner countries and strengthen their capacity to guarantee sustainable fishing in their own waters and local employment in the sector;
86	Stresses that adequate protection from water-related disasters and diseases, as well as access to a sufficient quantity and quality of water at affordable cost without compromising the sustainability of vital ecosystems, in order to fulfil the basic food, energy and other requirements essential to leading a healthy and productive life, should be a pivotal aspect of development policy;
87	In order to increase transparency and public acceptance of development projects funded fully or partially by the EU or the Member States, calls for creating an electronic data base that provides information on ODA; believes that this data base should enable users to track all EU donors' and, if applicable, United Nations Agencies' projects and programs in all recipient countries, who finances them, and which organization implements them; takes the view that it should be user-friendly and accessible to all through the Internet and that it should have a function which makes it easy to search for specific information through a set of predefined criteria (donor, DAC sector, location, project status, funding type and MDGs) and offer tables and geographic maps for analysis; notes that this kind of data base is also essential for strengthened coordination and harmonization among donors and alignment with the government of the recipient country;
88	Instructs its President to forward this resolution to the Council and the Commission.
