92	Regrets that persecution and marginalisation of human rights defenders remain a widespread tendency all over the world, particularly in China and Russia, and in all other countries that still mistakenly regard high human rights standards as an imposition by the EU and the UN and by global human rights organisations; regrets that the fate of disbarred lawyers and politically persecuted journalists and media workers in China is regarded as an internal affair; notes the restrictions of democratic space;
93	Welcomes the EU co-sponsored UN General Assembly Third Committee resolution of November 2011 on human rights defenders, and the public support given by the EU to the UN Special Rapporteur on Human Rights Defenders and relevant regional mechanisms to protect human rights defenders;
94	Supports the plans to establish a voluntary European initiative to provide temporary shelter to human rights defenders in need of urgent relocation from their countries of origin under the EIDHR; stresses that this initiative should be carried out in a manner that will complement the shelter schemes which already exist;
95	Notes that it is the human rights defenders working in remote areas and conflict zones that are the most exposed to threats and dangers, and in least contact with EU staff; urges all EU delegations to develop local human rights strategies for maintaining regular contacts with human rights defenders on the ground and for providing them with necessary assistance and protection, as required by the EU Guidelines on Human Rights Defenders (HRDs);
96	Stresses the importance for the EU to take proactive action (reaction and support to HRDs under threat; observation of trials brought against HRDs; prompt, vocal and visible reaction to restrictions to the freedoms of expression, association and assembly) and systematically to provide HRDs and/or their families with information on actions undertaken on their behalf, as prescribed in the EU Guidelines on HRDs; calls, in this context, for a reinforcement of the EIDHR mechanism aimed at providing urgent protection measures with human rights defenders in danger or at risk;
97	Regrets that its call to enhance visibility of the annual Sakharov Prize is not taken on board as the Sakharov Prize is only mentioned in a declarative manner in the section on the European Parliament in the Annual Report; underlines once more that a proper follow-up by the EEAS is needed on the well-being of the candidates and laureates, and on the situation in their respective countries; reiterates its call on the EEAS and the Commission to stay in regular touch with the candidates and laureates of the Sakharov Prize to ensure continuous dialogue and monitoring of the situation of the human rights situation in the respective countries, and to offer protection to those suffering persecution; calls on the EEAS to include the Sakharov Prize in the section on human right defenders in the Annual Report on Human Rights;
98	Calls on the Commission and Council to support, train and empower human rights defenders, civil society activists and independent journalists, to ensure their security and freedom online and to assert the fundamental rights of free expression, freedom of assembly and freedom of association online;
99	Reiterates its unfaltering stance against the death penalty in all cases and circumstances, and strongly supports EU efforts to pass a strong resolution on the death penalty moratorium at the 67th session of the UN General Assembly, also with a view to gaining momentum in the run-up to the World Congress against the Death Penalty; underlines the fact that the EU is the leading actor in and the largest donor to the fight against death penalty;
