48	Reiterates its view that the ‘more for more’ approach should be based on clearly defined criteria with specific, measurable, achievable and transparent time-bound benchmarks; calls on the EEAS and the Commission to implement this approach systematically in the Neighbourhood Policy progress reports;
49	Welcomes the enhanced EU outreach to civil society, and emphasises the need for civil society to contribute more systematically and regularly to the elaboration of human rights country strategies and assessments required for a proper implementation of the new ‘more for more’ approach in EU policy;
50	Welcomes also activities undertaken under the Eastern Partnership initiative in promoting human rights, democracy, fundamental freedoms and the rule of law in partner countries; calls on the European Union to use the transitional experience of its own Member States of moving from authoritarian to democratic regimes, and to translate the lessons learned from these experiences into concrete, results-oriented programmes in the Union's Eastern partner countries; urges the EU to take a more active and coherent stance while promoting human rights, democracy and the rule of law in partner countries;
51	Regrets, however, that the Eastern Partnership policy at times remains open to misinterpretations, becoming rather a policy of all-permissiveness and forgiveness, and of double standards that are frequently applied with regard to the Eastern partner countries;
52	Remains extremely concerned at the lack of democracy, rule of law, fundamental freedoms and the respect for human rights in Belarus, the only European Neighbourhood country not to fully participate in the Eastern Partnership and the work of the Euronest Parliamentary Assembly, especially in the aftermath of the presidential elections in December 2010 and the subsequent violent crackdown on protesters and political opposition, including trials of activists in 2011 which did not conform to international standards and saw disproportionately harsh sentences handed down; commends the EU's unity in response to the expulsion of EU diplomats from Belarus in February 2012; urges the Union and all of its Member States to remain coherent and consistent in their policies towards Belarus, and to keep up the pressure on the political regime, including through sanctions, among others against enlisted officials, while reaching out to civil society through such tools as enhanced visa facilitation and increased education, training and other exchange opportunities; expresses strong concern over Ales Bialiatski's imprisonment since 4 August 2011; regrets the actions of the Polish and Lithuanian officials who allowed Ales Bialiatski to be arrested through the forwarding of banking information, and calls for utmost efforts by all actors in the EU to prevent a repetition of such mistakes;
53	Urges the EU to apply the same consistent approach towards human rights abuses in all third countries, both partner countries and countries with which the EU has a less-developed relationship; insists that the EU be vocal in pointing out and condemning human rights violations whenever and wherever they occur, regardless of the level or strategic importance of partnership with the country concerned; emphasises that the EU should use financial aid and economic relations as a leverage mechanism to ensure the commitment to the universal values of human rights of all its partners;
54	Emphasises the mutually reinforcing nature of human rights and democracy, as it is through respect for human rights that societies create the free political space needed for peaceful democratic contestation; welcomes in this regard the increased EU focus on democracy support as illustrated by the recently established European Endowment for Democracy;
55	Underlines that a longer-term approach covering the whole election cycle is required to appropriately follow up on the reports and recommendations of the EU Election Observation Missions; stresses the importance of drawing up realistic and achievable recommendations and of ensuring that these recommendations are monitored – and become part of the political dialogue and assistance offered – by the EU delegations; considers that Parliament's standing delegations and the joint parliamentary assemblies should also play an enhanced role in following up these recommendations and analysing progress with regard to human rights and democracy; encourages EU election observation missions (EOMs) to reinforce their coordination with other international election observation missions so as to improve the coherence of EU action in this respect; stresses that the EU needs to invest in the training of local observers in order to build sustainable and autonomous electoral processes in third countries; outlines the fact that the transition to democracy, as well as progress in promoting human rights, calls for long-term strategies and may not yield visible results in the short term; encourages, therefore, the Commission and the EEAS to monitor more than one election cycle in detail by deploying EU EOMs to countries that move from authoritarian regimes to democratic regimes or that register serious lapses in their progress towards democracy;
56	Reiterates its call on the Council and the Commission to develop a coherent, long-term strategy in relation to each EU election observation mission, followed up by an assessment of democratic progress two years after the mission, with due involvement of the concerned election observation Chief Observer, to be debated during Parliament's annual human rights debate with the VP/HR; recalls the commitment of the VP/HR to focus, in election observation missions, on the participation – both as candidates and as voters – of women and national minorities as well as of persons with disabilities;
57	Emphasises that the EU must engage with political parties, so as to allow stakeholders to share tools and techniques that can be used to develop stronger ties to the public, mount competitive electoral campaigns and perform more effectively in the legislature; underlines that democratisation is a process which must also engage citizens, grass roots movements and civil society; believes, therefore, that the EU should finance programmes that foster civic participation, voter education, organisation of advocacy actions, freedom of the press and of expression, and that generally ensure political oversight and help citizens exercise their rights; 
58	Considers that equitable participation of women in politics and government is essential to building and sustaining democracy; stresses, therefore, that EU programmes in the field of human rights and democratisation should consider, as a priority, the engagement and build-up of capacities of women in legislatures, political parties and civil society as leaders, activists and informed citizens; takes the view that the EU must continue to support and encourage women to run for political office and participate meaningfully in every facet of civic and political life; points out that the full participation of women in politics is not limited to statistical objectives regarding the number of candidates and elected officials, and that ensuring gender equality entails both taking the problems of women's rights into consideration in policymaking and ensuring the free and effective participation of women in all aspects of public, political and economic life;
59	Recalls that building legitimate democratic foundations, a properly functioning civil society and a democratic, rights-based community is a long-term process that needs to be built up from below and requires national, regional, local and international support;
60	Welcomes the creation of the Democracy Support Directorate within Parliament and the broadening of the mandate of its Election Coordination Group (ECG), which has now become the Democracy Support and Election Coordination Group (DSECG); expects Parliament's democracy support activities, including the political groups, to be further enhanced, not least via its Office for the Promotion of Parliamentary Democracy and its Election Observation Unit; 
61	Recognises the potential inherent in comprehensive human rights dialogues with third countries, especially if they are effectively combined with the implementation of the human rights country strategies; emphasises that the dialogues should not, however, be instrumentalised in order to marginalise human rights discussions at other, higher levels of political dialogue such as summits; urges, likewise, that human rights considerations be central to relations with third countries;
62	Recommends that human rights country strategies be made public; stresses that public strategies would provide visibility to the EU's commitment to human rights in third countries and provide support to those struggling to exercise and protect their human rights;
63	Stresses that it is important that the EU uses these dialogues to raise individual cases of concern, particularly for prisoners of conscience who have been imprisoned for practising the peaceful right to freedom of speech, assembly and religion or belief, and calls upon the EU to effectively follow up these cases with the countries in question;
64	Reiterates its concern, however, with the persistently disappointing lack of progress in a number of human rights dialogues, and the lack of transparent benchmarks to genuinely assess improvements or deterioration in human rights; notes the continued EU difficulties to negotiate improved modalities for its human rights dialogues in particular with China and Russia; calls on the newly appointed EUSR for Human Rights to take the lead in these and other human rights dialogues and to pursue a new, result-driven approach in this regard through ongoing cooperation with Parliament ;
65	Stresses the fact that, while the Chinese authorities have take some steps in the right direction, the human rights situation in China continues to deteriorate and is marked by widening social unrest and the tightening of control and repression of human rights defenders, lawyers, bloggers, and social activists, as well as by targeted policies aimed at marginalising Tibetans and their cultural identity; urges the Chinese authorities to engage seriously with the Tibetan people in order to assess the underlying causes of the self-immolations of Tibetan monks and nuns, to cease harassing and intimidating Tibetans who exercise their rights to freedom of expression, assembly and association, to end all use of unnecessary excessive force in facing protestors, to investigate all instances of human rights violations, and to allow independent monitors into areas of protest;
66	Reiterates its call for the need to appoint an EU Special Representative for Tibet who would be responsible for the defence of human rights and, among other topical issues, the right to freely practice one's religion and culture in China;
67	Remains disappointed that there has been no systematic involvement of Parliament in the assessment of human rights dialogues, including those with Russia and China; calls for Parliament's access to these assessments to be formalised, and recalls that the EU Guidelines on Human Rights Dialogues state that ‘civil society will be involved in this assessment exercise’;
68	Reiterates that the situation for and promotion of women's rights, gender equality and efforts to combat violence against women must be taken into account, in a systematic manner, in all human rights dialogues conducted by the EU with third countries with which cooperation or association agreements have been signed;
69	Welcomes the commitment in the EU Human Rights Action Plan to develop a methodology to improve the analysis of the human rights situation in third countries in connection with the launch or conclusion of trade and/or investment agreements; calls on the EU to ensure that the granting of GSP+ status is firmly linked to a country's ratification and implementation of key international human rights instruments, enabling a regular evaluation of such obligations, paying particular attention to the respect of freedom of expression, assembly, association, and religion or belief, and the rights of minorities, women and children; stresses in particular the need for transparency in defending immigrants' human rights;
70	Welcomes the EU's efforts to include a human rights and democracy clause in all EU political framework agreements, but reiterates its call for all contractual relationships with third countries – both industrialised and developing, and including sectoral agreements, trade and technical or financial aid agreements – to include clearly worded conditionality and clauses on human rights and democracy, without exception; considers that the current threshold in Generalised System of Preferences (GSP) schemes that could trigger action on the human rights clauses is high but should be adjusted to each country concerned; notes the new GSP reform proposal from 2011 which suggests that the consultation procedure should be widened and which contains provisions to ease investigations of human rights violations in the GSP Committee; expresses, in this regard, deep concern about the deteriorating human rights situation in Cambodia where land grabbing has lead to increasing poverty and to the violation of human rights clauses which are part of agreements in force between EU and Cambodia; warns that the lack of consistency in the implementation of the human rights clause can undermine the credibility and effectiveness of the EU's conditionality policy;
71	Welcomes the measures undertaken and plans developed in 2011 by EU institutions and Member States aimed at creating a more coherent and coordinated policy as regards corporate social responsibility (CSR), i.a	in support of human rights in the world, and the implementation of the UN Guiding Principles on Business and Human Rights from 2011;
72	Stresses the importance of anchoring CSR in free trade agreements with third or developing countries in order to promote human rights and social and environmental standards; suggests including a comprehensive human rights chapter, in addition to social and environmental chapters, in all future free trade agreements; calls as well on the Commission to use free trade agreements to promote the four core labour standards, namely the freedom of association and the right to collective bargaining; the elimination of all forms of forced labour; the abolition of child labour; and the elimination of discrimination in the area of employment; stresses also that the monitoring and enforcement mechanisms of the GSP+ scheme should be further strengthened;
73	Reiterates that the consistent application of the human rights clause of agreements is fundamental in relations between the European Union and its Member States and third countries; stresses the importance of reviewing how Member States have cooperated with the apparatus of repression in the name of countering terrorism; underlines, in this respect, the need for the newly revised European Neighbourhood Policy to focus on providing support for security sector reform and, in particular, to ensure a clear separation of intelligence and law enforcement functions; calls on the VP/HR, the EU Special Representative on Human Rights, the EEAS, the Council and the Commission to step up their cooperation with the Committee for the Prevention of Torture, and with other relevant Council of Europe mechanisms, in the planning and implementation of counter-terrorism assistance projects with third countries, and in all forms of counter-terrorism dialogues with third countries;
74	Emphasises the importance of continuing the work on global practices relating to secret detentions in the context of countering terrorism; stresses that combating terrorism can under no circumstances be used as a justification for violations of human rights, whether in third countries or in the EU; draws attention, in this respect, to the adoption of its resolution of 11 September 2012 entitled ‘Alleged transportation and illegal detention of prisoners in European countries by the CIA: follow-up to the European Parliament TDIP Committee report at the request of the Member States and implementation of its recommendations’;
75	Insists on the importance for the EU to fully abide by and implement its international obligations, policies and foreign policy instruments, such as the torture guidelines and human rights dialogues, so that it can be more credible in its call for the rigorous implementation of human rights clauses in association agreements, and to urge its major allies to respect their own domestic and international laws;
76	Recommends, in order to enhance the credibility of the human rights clause and the predictability of EU action, that the clause be further developed to include political and legal procedural mechanisms to be used in the event of a request for the suspension of bilateral cooperation on the grounds of repeated and/or systematic human rights violations in breach of international law;
77	Calls on the European Union to ensure that all trade agreements it signs with third countries include clauses which promote social cohesion, ensure respect for social, environmental and labour standards and the sound management of natural resources, in particular land and water; notes that the EU is developing a human rights monitoring mechanism to be included as part of new partnership and cooperation agreements, and other trade agreements, with a number of countries; stresses that these monitoring mechanisms are not ambitious enough and not clearly defined, compromising the EU's treaty commitment to the promotion of human rights and democracy in the world; is particularly concerned in this regard about the Partnership and Cooperation Agreement (PCA) with Uzbekistan and the pending PCA with Turkmenistan;
78	Reiterates its recommendation that the EU adopt a more consistent and efficient policy on EU sanctions and restrictive measures, providing clear criteria for when these are to be applied and what type of sanctions should be applied, and including transparent benchmarks for their lifting; calls on the Council to ensure that there are no double standards when deciding on restrictive measures or sanctions and that these are applied regardless of political, economic and security interests;
79	Calls on the Commission and the Member States to address violence against women and the gender-related dimension of human rights violations internationally, in particular in the context of the bilateral association and international trade agreements in force and those under negotiation;
80	Notes that the Arab Spring demonstrated how the new global information and communication architecture is not only creating new channels for freedom of expression but also enabling new forms of political mobilisation that bypass traditional methods; points out, in this context, that rural areas are often inadequately connected to modern communication technologies; calls on the EU institutions and the Member States to harness the positive potential of the new technologies in EU foreign policy while stressing that only organised groups disposing of a clear and coherent political agenda shall be granted financial assistance; calls on the EU institutions and the Member States to address the danger of internet censorship and repression; welcomes the launch, in December 2011, of the ‘No Disconnect Strategy’ to develop tools that allow the EU, in appropriate cases, to assist civil society organisations or individual citizens to circumvent arbitrary disruptions to access to electronic communications technologies, including the internet;
81	Recognises that increasing dependence on information and communications technology infrastructure is likely to create new vulnerabilities and security concerns internationally; recalls, however, that many of the decentralised characteristics that make the internet a cyber-security concern are also the very reasons that it is a powerful tool for human rights defenders living under repressive regimes; stresses, therefore, the importance of a comprehensive Digital Freedom Strategy with a clear human rights dimension, including an impact assessment on human rights consequences, in the development of policies and programmes relating to cyber security, the fight against cyber crime, internet governance and other EU policies in this area; calls in this regard on the Commission and the EEAS to take a proactive approach and to mainstream the aspect of cyber security in its interaction with third countries;
82	Stresses that the repression and control of citizens and businesses involves a growing technological component, through the blocking of content and the monitoring and identification of human rights defenders, journalists, activists and dissidents, as well as through the criminalisation of legitimate expression online and the adoption of restrictive legislation to justify such measures; recommends that the promotion and protection of digital freedoms should be mainstreamed, and reviewed annually, so as to ensure accountability and continuity in all EU external actions and financing and aid policies and instruments; calls on the Commission and Council to unequivocally recognise digital freedoms as fundamental rights, and as indispensable prerequisites for enjoying universal human rights such as freedom of expression, freedom of assembly and access to information, and for ensuring transparency and accountability in public life;
83	Welcomes the commitment of the EU Human Rights Action Plan to develop new public guidelines on freedom of expression online and offline, including the protection of bloggers and journalists, human rights defenders and opposition-parties;
84	Stresses the importance of encouraging an independent free press and media, which are crucial actors in preserving the rule of law and fighting corrupt practices;
85	Notes with concern the worrying trend of increased attacks and intimidation against journalists and media workers in the world; calls for a stepping up of EU efforts to promote their safety in dialogues with the Union's partners and other countries;
86	Is gravely concerned about developments which restrict the freedom of expression and assembly for reasons based on misconceptions about homosexuality and transgenderism; recalls that  laws and proposals to such effect are inconsistent with the International Covenant on Civil and Political Rights, which precludes discriminatory laws and practices based on sexual orientation; calls on the VP/HR and the Special Representative for Human Rights to raise these concerns systematically;
87	Deplores the use of EU-made technologies and services in third countries to violate human rights through censorship of information, mass surveillance, monitoring and the tracing and tracking of citizens and their activities on (mobile) telephone networks and the internet; is concerned by reports of certain EU companies cooperating with authoritarian regimes in providing them with free unlimited access to their networks and databases under the excuse of following the local law, as was the case with the EU-based company TeliaSonera in several former Soviet countries; is convinced that European companies and their subsidiaries and subcontractors should play a key role in the promotion and dissemination of social standards worldwide, and they should therefore act in accordance with European values and never compromise human rights in their efforts to expand their markets abroad;
88	Welcomes Council decisions to ban the export of certain information technologies and services to Syria and Iran, and urges the EU to consider these cases as precedents for future restrictive measures against other repressive regimes; strongly supports the proposal to include human rights violations in the EU dual-use export control system as a reason for which non-listed items may be subject to export restrictions by Member States; draws attention, in this context, to its position to adopt Regulation amending Council Regulation (EC) No 428/2009 setting up a Community regime for the control of exports, transfer, brokering and transit of dual-use items;
89	Emphasises the development of a strong and vibrant civil society as a key factor allowing for democratic progress and improved protection of human rights; stresses that the mobilisation of civil society was at the root of the historic changes of the Arab Spring;
90	Acknowledges EU efforts to step up support to civil society organisations; values particularly the ability of the European Union to engage directly with civil society through the EIDHR, the Civil Society Facility and the EED; regrets, however, that EU does not have a stronger systematic policy to persuade partner countries to abolish undue legal and administrative restrictions that limit the universal rights of assembly and association; calls for such policy guidelines be developed;
91	Reiterates its support for the implementation of the concept of democratic ownership in EU development cooperation, and considers the role of civil society crucial in that context; emphasises the need for all EU staff to work closely with civil society in the countries of their posting; outlines the fact that a closer cooperation with the civil society would considerably contribute to drawing up feasible and realistic human rights country strategies, tailored to the priorities of these countries;
