47	Calls on the European Council to expand the list of Iranian individuals with links to Iran's nuclear and ballistic programmes and their attendant procurement networks; calls on the relevant authorities to move quickly to freeze their assets and prevent them from entering EU territory and using EU jurisdictions to conduct any activity related to those programmes;
48	Calls on the High Representative to keep the Iranian nuclear dossier and the human rights of the Iranian people high on the agenda, and on Iran to engage in meaningful negotiations with a view to securing a comprehensive and long-term settlement of the nuclear issue;
49	Condemns in the strongest possible terms the desire expressed by Iranian President Ahmadinejad to ‘wipe out’ Israel and his anti-Semitic rhetoric, especially his denial of the Holocaust and his underlying agenda of delegitimising the Israeli state; reaffirms its full support for the existence of Israel and a two-state solution for Palestine;
50	Calls on the Council and the Commission to closely monitor the situation in the Gulf region and to do their utmost to promote peace and stability in this region;
51	Recognises Turkey's role as an influential regional actor and commends its joint efforts with Brazil to bring about a negotiated settlement of the Iranian nuclear issue; notes with regret, however, that the terms of the tripartite agreement of 17 May 2010 only partially meet the requirements laid down by the IAEA; calls on the Turkish authorities to follow the European approach towards the Iranian nuclear threat; encourages Turkey to include the human rights situation in its dialogue with Iran;
52	Underlines the fact that Russia has been one of the major suppliers of modern weapons and enriched uranium to Iran; welcomes the decision by the Russian Federation this year to halt the sale of the S-300 to Iran and its support for the UN sanctions against Iran over its nuclear programme; calls forcefully on Russia to stop any kind of weapons proliferation and uranium exports to Iran, so that the effectiveness of the sanctions against Iran and the fulfilment of the NPT requirements may be ensured;
53	Encourages the High Representative to enhance transatlantic coordination and complementarity regarding Iran and to consult on action towards Iran with the permanent members of the UN Security Council and all relevant global and regional partners sharing concerns on Iran;
54	Takes note of the EU's and Iran's shared interest in securing peace and stability in Afghanistan; welcomes the constructive role being played by Iran in refurbishing infrastructure and reviving the economy, as well as in preventing drug trafficking from Afghanistan; stresses, however, that sustainable peace and stability in Afghanistan will require all neighbours to refrain from political interference in the country;
55	Calls on the High Representative to open an EU delegation in Tehran, now that the European External Action Service has taken over responsibility from the rotating Presidency for representing the European Union in third countries;
56	Calls on the Commission and the Council to encourage Iran to play a constructive role with regard to the future development of Afghanistan, and emphasises the shared goals of the EU and Iran as regards the stability of Afghanistan and taking effective action to combat opium production and drug trafficking;
57	Instructs its President to forward this resolution to the Council, the Commission, the governments and parliaments of the EU Member States and the government and parliament of the Islamic Republic of Iran.
