47	Emphasises that information is another vital component of an effective disaster prevention and response policy at all levels and that the changing risk scenario requires a continuous updating of knowledge, solid and comparable data on the frequency of occurrence, risks and the associated consequences of disasters and related analytical tools; therefore calls for coordinated action, greater availability and systematic dissemination of technical and scientific information and expertise and the sharing of best practices, including studies and putting into practice lessons learnt, such as the experience gained through projects implemented in the past under the Community's INTERREG initiative;
48	Highlights the need to raise awareness of the procedures to be adopted when faced with disaster situations, paying particular attention to training young people, from school age on; calls on the Commission to foster, with the involvement of schools and specific voluntary associations, the culture of planning, prevention and resilience which is a prerequisite for optimising civil protection work;
49	Points to the key role of regional and local authorities, which are in the front line when disasters – above all, cross-border disasters – occur, and whose involvement can raise the EU's visibility among its citizens; therefore calls on the Commission to ensure that the Member States involve their regional and local authorities in disaster response from an early stage, building on the multi-level governance model applied in the area of cohesion policy, through a win-win communication strategy for all the actors involved in the response mechanism;
50	Calls on the Commission and Member States to develop a clear information and prevention system for all European citizens when they travel, both within the EU and outside the Member States; proposes, to this end, that European passports bear the 112 emergency number with clear indications of its EU-wide accessibility, so that it may be used by travellers within the EU, as well as a reference to Article 23 of the Treaty on the Functioning of the European Union, which lays down that ‘every citizen of the Union shall, in the territory of a third country in which the Member State of which he is a national is not represented, be entitled to protection by the diplomatic or consular authorities of any Member State (...)’, which can be used by travellers to non-Member States;
51	Calls for efforts to communicate the pan-European emergency call number ‘112’ more effectively to European citizens and third-country nationals in the EU, particularly by making use of written and audiovisual media and public notices, so that all citizens can use it automatically to report any disaster that occurs in the territory of the EU;
52	Considers that the dedicated training of European staff and experts in disaster response would make it possible, through ‘common core’ training and specialised modules, to develop awareness of common European working methods and response procedures; in this framework, recommends joint disaster response exercises between civil and military logistic units;
53	
54	Reiterates its position that, in view of the interconnections between drought, forest fires and desertification, the Commission should present a proposal, similar to the Floods Directive, to promote the adoption of an EU policy on water scarcity, drought and adaptation to climate change; also reiterates, in this context, the importance of establishing the European Drought Observatory, which would be responsible for studying, mitigating and monitoring the effects of drought;
55	Reiterates, likewise, its call for the Commission to adopt a directive on preventing and managing fires, which should include the regular collection of data, preparation of maps and identification of areas at risk, preparation of fire risk management plans, identification by the Member States of the resources allocated and facilities available, coordination of the various administrations, minimum requirements for training crews and establishment of environmental responsibility and the corresponding penalties;
56	Considers that further exploitation of the opportunities offered in the context of the European Territorial Objective is of crucial importance; believes, in this connection, that the European Grouping of Territorial Cooperation (EGTC) can constitute an important instrument for further strengthening transnational, cross-border and interregional cooperation, even with countries which are not EU Member States; sees the development of interregional cooperation across national borders as evidence of the particularly important contribution made by the regions to rapid assistance for the purposes of civil protection; considers that this fruitful cooperation extends, inter alia, to the shared aim of mapping risks and assessing potential threats, and that it is here that the EU can make a valuable and visible contribution to even more effective and efficient cooperation, above all by improving coordination;
57	Points out that, in the European Year of Volunteering, it would be symbolic and worthwhile to support those countries which seek to promote such activities and organisations;
58	Invites the Commission to bring forward ambitious legislative proposals to that effect as quickly as possible but not later than by the end of 2011;
59	Instructs its President to forward this resolution to the Council and the Commission.
