1	Welcomes the Commission's green paper on a European strategy for sustainable, competitive and secure energy, but emphasises the need to acknowledge the ever changing conditions in the broader global energy market and highlights the importance of extending the producer perspective to a systematic approach that takes account of production, distribution and consumption in order to develop a European energy policy securing affordable energy as far as possible from low-carbon sources in the short term and carbon free sources in the medium term and indigenous resources, respecting market mechanisms, whilst protecting the environment, combating climate change and promoting energy efficiency;
2	Stresses that the Commission stated in its green paper that EUR 1 trillion needs to be invested in the European energy market in order to secure energy supplies in Europe in the long term; also notes that it cannot be assumed that these resources can be funded from the public purse and that it is therefore important to involve energy industry operators in the European Union in the further development of the consensus on energy policy; 
3	Urges the 2007 Spring European Council to adopt an action plan, which should at least contain the following elements: for consumers to be placed at the centre of energy policy, a radical reform of the EU Emissions Trading Scheme (ETS) to guide the market into investment in a low carbon economy which should be driven by a set target for EU carbon emissions by 2020 including a target of 25% of energy from renewable sources by 2020 and a binding target for car emissions, a step change in energy efficiency, reinforced efforts to implement unbundling in letter and spirit, including full ownership unbundling of energy networks in the event that other measures do not prove effective, minimum binding guidelines set out for regulators, including a procedure for the nomination of regulators, independence, transparency and accountability, an ambitious R&D strategy on clean energy technologies, a common foreign energy policy strategy and full implementation of all current EU energy legislation;
4	"Recognises that climate change is causing serious environmental problems requiring immediate EU and international action; believes that by 2050 the overwhelming proportion of EU energy needs must come from carbon free sources or be produced with technologies which withhold greenhouse gas emissions, with a focus on energy saving, efficiency and renewable energies and that there is therefore a need to set out a clear roadmap for attaining this objective; urges EU leaders to agree by the end of next year on a binding 2020 CO2 target and an indicative 2050 CO2 target and further believes that: 
"
5	Calls for the 2007 Spring European Council to ensure that the future energy policy of Europe is backed up by an ambitious R & D strategy in the field of energy including more adequate public funding and strong incentives for increased private R & D funding, fulfilling corporate social responsibility obligations; encourages Member States to set out a strategy for increasing the budget for energy research, especially when there is a mid-term review of the budget for the Seventh Framework Programme for research, technological development and demonstration activities (FP7) and for the Intelligent Energy − Europe Programme; calls for a European strategic energy technology plan and hopes that its content will cover research fields focusing on new energy technologies in the medium and long term, including in particular energy storage;
6	Calls on the Commission to ensure that the contribution of hydrogen and fuel cells applications to accelerating the transition from fossil fuels to an efficient and CO2 lean energy and transport system is reflected in EU's short term energy and transport policy actions and by supporting bodies;
7	Recalls that the EU must remain a key player in initiatives such as the International Partnership for the Hydrogen Economy (IPHE)
8	Calls on the Commission and the Member States to create a road map for climate-friendly and environmentally-friendly innovation based not only on technological innovation but also on developing strategies to increase the market penetration of the best available technologies and organisational improvements, e.g	in the logistic sector;
9	Calls on the Commission to carry out an energy audit on existing technology platforms in order to improve coordination and the exchange of expertise;
10	Notes that research in the field of energy technologies is an important step to opening up export markets; therefore calls on the Commission to continue supporting research into all sources of energy (conventional, nuclear and renewable) so that Europe, as well as exploiting such research for its own purposes in the Member States, may also open up export markets;
11	"Recalls the need for significant investment in electricity and gas infrastructure in order to secure energy supply in Europe; requests the Commission to:
"
12	As electricity networks will have to adapt to the growing share of renewable energies and decentralised generation, calls upon the Commission and the Member States to further promote research into the necessary information and communication technologies;
13	Encourages the involvement of regional stakeholders in energy issues, as many problems find their solution through investment at regional and urban level, especially solutions favouring the use of diverse and renewable energy sources; emphasises the potential for SME entrepreneurship in energy investments and the role that sustainable energy investments (i.e	"in biomass, biofuels and district heating) can play in regional and urban development;
 therefore asks Member States and the Commission to involve regional and local authorities in these issues so as to commit even more strongly to the promotion of renewable energy sources within the overall energy mix;"
14	Draws attention to the problems that border regions encounter because of the differences in national energy policies, the lack of information-exchange between Member State energy providers and the lack of a harmonised EU energy policy;
15	Stresses the positive impact that the promotion and development of renewable energy technology has on the creation of new, long-term and highly-skilled jobs; 
16	Calls on the Council and Commission to adopt measures to make the EU the most energy efficient economy in the world by 2020 and to set energy efficiency measures as a horizontal priority for all policy sectors in the EU; calls on the Commission to ensure timely implementation of EC directives in the field and urges the Council to adopt the proposals in the energy efficiency action plan and Member States to use best practice as a basis for their national energy efficiency action plans, to be submitted by June 2007; urges the Commission to make available enough staff at all levels to transform the measures proposed in the action plan into concrete actions; recalls that if Member States were to fully implement existing EU legislation, 50% of the EU target to save 20% of energy by 2020 would already be met; calls on the President of the Commission to promote a global energy efficiency agreement;
17	Points to the fact that there are very promising technologies available for use in combined heat and power and cooling processes and that district heating also offers an infrastructure for future renewable energy sources; urges therefore national governments to fully implement the existing directive on combined heat and power and to put in place the necessary legal and financial conditions to fully use the potential for combined heat and power, as identified in the national potential studies;
18	Recalls that 40% of all EU energy is used in buildings and that there is a huge potential to reduce this consumption when planning new buildings and modernising existing buildings; urges the Commission to revise the existing buildings directive in order to include buildings below the 1000m² threshold; calls on the Commission to ensure that all EU institution buildings set an example by achieving carbon neutral status by 2012; believes that Member States should commit to ensuring that this is achieved also in all national government buildings and that this goal should be extended to local authority and regional buildings by 2015; urges the Commission to implement a programme aimed at the large scale deployment of passive and net positive energy houses and buildings in the EU; 
19	"Calls on the President of the Commission to host a meeting of representatives of the Member States"" biggest cities for the purpose of exchanging their experience of local energy-reduction projects in an endeavour to reduce and make more efficient urban energy consumption; believes that serious efforts should be made to increase the power derived from combined heat and power and cooling production and district heating; adds that these technologies are very promising for increasing the use of biomass and biofuels and emphasises that district heating offers an infrastructure also for future renewable energy sources; believes that the Commission should work closely with the Committee of the Regions on this matter;"
20	Calls on the Commission, by spring 2007 at the latest, to submit implementing measures regarding energy-efficient products under Directive 2005/32/EC of the European Parliament and of the Council of 6 July 2005 establishing a framework for the setting of eco-design requirements for energy-using products
21	Requests the Commission to help industry to develop and roll out smart metering and charging systems, possibly via intelligent metering system managed by remote mechanisms; calls upon the Commission to carry out a thorough cost-benefit analysis of these measures, taking on board changes in the behaviour of consumers;
22	Considers that taxation plays a prominent role in enhancing energy efficiency; believes that efforts should be made so that Member States' national tax systems discriminate in favour of energy efficient practices;
23	Draws the Commission's attention to the need for EU structural funds to be used, particularly in the new Member States, in the large-scale modernisation of the thermal insulation of housing, which will bring significant reductions in energy consumption and CO2 emissions; 
24	Calls for a comprehensive EU strategy in the transport sector, aiming at the phasing out of fossil fuel use, a reduction of EU dependency on oil and a gradual shift to clean energies for transportation; favours a shift towards the most energy efficient and clean transport modes, to be achieved notably through new legislation, including legislation relating to the automotive industry, and improving the market penetration of plug-in hybrid cars and fully electric vehicles;
25	Regrets that the Commission has enormous problems linking transport with the energy question; recalls that the transport sector is the cause of Europe's biggest security of supply problem and intense oil dependency, and that climate changing emissions from the transport sector are rising steeply, notably from aviation;
26	Stresses that many outlying and outermost regions have considerable potential in terms of renewable energies, linked to their geographical or climate-related characteristics (sunshine, wind, biomass, wave energy); hopes that more use will be made of this outstanding opportunity, particularly in order to make an active contribution to achieving the Kyoto objectives;
27	Calls on the Commission and the Member States to adopt practical measures to improve the energy efficiency of small and medium-sized businesses, including, in particular, measures to increase awareness and action to ensure easier access to funding, including funding from the structural funds, the EBRD and the EIB, to enable such businesses to invest in reducing energy consumption; 
28	Hopes that greater energy efficiency will be encouraged in third countries and endorses the Commission's proposal to work towards the adoption of an international energy efficiency agreement;  
29	Takes the view that the benchmark system agreed in Directive 2006/32/EC of the European Parliament and of the Council of 5 April 2006 on energy end-use efficiency and energy services
30	Believes that the diversification of energy sources along with increased use of indigenous sources and decentralised energy production will improve security of supply, but acknowledges the fact that decisions on energy mix in one Member State can affect security of supply in other Member States; regards the EU's dependency on a limited number of energy producers and supply routes as a serious risk to its stability and prosperity; welcomes the introduction of a mechanism able to ensure solidarity and rapidassistance to Member States facing difficulties following damage to their infrastructure; 
31	Considers it vital that the European energy strategy be based on maximum subsidiarity and that decisions concerning the energy mix should remain the prerogative of the Member States;
32	Welcomes the high efficiency and high renewables scenario from July 2006 presented by DG TREN of the Commission and the study commissioned by Parliament's Committee on Industry, Trade, Research and Energy on security of supply presented to that committee on 9 October 2006; urges therefore the Commission to take both scenarios as a basis for the energy review scheduled for January 2007;
33	Asks the Commission and the Member States, without neglecting short and medium-term costs, to give priority to those forms of energy which reduce import dependency,  especially imports of fossil fuels, that support the environment, are sustainable and reduce risks of continuous supply, not least because of the decentralisation of production;
34	Calls on the President of the Commission to carry out the plan to publish monthly figures on European stocks, imports, and exports of oil and petroleum products, broken down by product type (crude, petrol, diesel oil, heating oil, and others); believes that figures of this kind (which would be in the public domain, as they are in the United States) would give a clearer idea of the pressures being brought to bear on the world market and a clear picture of European consumption, as well reducing the obsession which operators have with American stocks and consequently helping to make oil prices less volatile;
35	Calls on the Commission to conduct a transparent and objective debate on the future energy mix, taking into account the advantages and drawbacks of all forms of energy, including economic and environmental costs and consequences;
36	Urges the Commission to finalise by the end of 2008 at the latest a new energy and transport modelling tool for the EU; believes that such a bottom-up model should be developed in close collaboration between the Commission services, the IEA and national governments and aim at streamlining all statistical energy and transport data in Europe, that the model would then replace the multitude of models existing today within the different Commission services and also harmonise energy statistics all over Europe; further believes that the model should be in the public domain and could, as it is the case today in the US, be used on demand by the different stakeholders to develop different scenarios for the EU energy future;
37	Proposes, in order to boost the diversification of energy sources, that the EU set a long-term stable policy framework in order to create the necessary investment climate; believes that such a framework should contain an EU target for energy efficiency improvements of at least 20% by 2020, and asks the Commission to propose a framework for options of harmonised support schemes for renewable energies as part of the renewable energy roadmap and, furthermore, set binding sectoral targets for renewables in order to achieve 25% of renewables in primary energy by 2020 and a road map at Council and Commission level for reaching a target for renewables of 50% by 2040, an EU 30% reduction of the CO2 target for 2020 and a 60-80% reduction for 2050; 
38	Stresses that the need to change the current energy production mix is not a burden but an opportunity; the use of solar, wind, biomass, hydro or geothermal energy and more energy efficiency technologies will help to fulfil the commitments made in Kyoto and under the UN Framework Climate Change Convention and also strengthen innovation, job creation and competitiveness in Europe;
39	Believes that the proposed Strategic Energy Review (SER) should integrate the work of the proposed Energy Supply Observatory (which should not be an independent body) and that it should analyse security of supply on a regular basis; considers that the SER's remit should involve strategic analysis of the problems confronting the EU in the energy sector, including the external aspects; encourages the Commission to use the SER to develop a formula that enables Member States to analyse the trade-offs between different policy options with regard to the environment, security of supply, competitiveness and job creation and that thus helps to minimise risks; welcomes the Commission's effort to undertake a detailed study of the subsidies and costs of all energy sources, including the internalisation of externalities within the SER, applying the life-cycle and well-to-wheel approach; requests the publication of such a study in order to raise public awareness; proposes that a Europe-wide forward study of supply and demand in the medium and long-term be conducted in order to identify investment needs, especially on the production side, and raise the profile of operators; proposes that a cost-benefit analysis should focus on the contribution of each energy source to the EU's three objectives in the energy field, namely security of supply, competitiveness, and environmental sustainability;
40	Believes that the SER should also cover trade issues, meaning that it should analyse the impact of international cooperation and long-term contracts already signed or to be signed and assess consistency between policies pursued by business and national and EU policies;
41	Recalls that oil is still the most important primary energy source in the EU, for which the EU depends almost completely on imports; regrets the lack of attention paid in the Commission's green paper to the fact; calls upon the Commission and Member States to take into account the need for diminishing the use of oil, decreasing import dependency and contributing to reducing CO2 emissions;
42	"Insists that Member States develop a systematic approach, including economic, ecological and technological aspects of the production, distribution, consumption and market penetration of liquid and gaseous biofuels, in particular those used in transport, in order to improve access to and promote trade in biofuels; insists on the full implementation of existing binding legislation;
 urges the Commission to remove technical and administrative barriers to blending levels and to ensure consistency between different policy areas, e.g"	transport, agriculture, trade, and that recognition is given to both liquid and gaseous biofuels as an option for the  transport sector and not just as a fuel for generating electricity; encourages Member States to take into account a mandatory and comprehensive certification scheme to be introduced by the Commission allowing the sustainable production of biofuels at all stages, as well as for the overall life-cycle greenhouse gas balance for biofuels produced within and imported into the EU;
43	Calls on the Commission to present a proposal for a directive on heating and cooling from renewable energy sources as soon as possible and recalls its resolution of 14 February 2006 with recommendations to the Commission and Council on heating and cooling from renewable sources of energy;
44	Calls on the Commission to recognise in the medium term the important role of fossil fuels and the possibility of undertaking further studies to reduce their carbon intensity in line with the 2° C degree target for CO2 reduction; considers that this should include continuous modernisation and improvement of their efficiency, development of a new generation of installations based on gasification and parallel electricity and chemical production, the further development of an economical method of carbon capture and storage in relation to coal and gas and oil, in accordance with the decisions taken by the European Technology Platform for Zero Emission Fossil Fuel Power Plant, and the removal of barriers posed by EU legislation;  
45	Calls on the Commission and the Member States to recognise the socio-economic importance of local and indigenous sources of energy in the EU and to encourage their development as a means of contributing to the security of energy supply in Europe;
46	Calls on the Commission to implement the trans-European energy networks and establish a priority interconnection plan, in view of the recently amended decision laying down the guidelines for trans European energy transmission networks, without neglecting the liquefied natural gas reception regasification infrastructure and storage facilities; in addition, believes that all energy sources including renewables should be given fair and non-discriminatory access to the power grids so as to further the integration of markets and ensure security of supply; considers that offshore wind power installations should be integrated first into a regional grid and ultimately into the trans-European energy network;
47	Asks the Commission to give special consideration to developing marine-based renewable energies (offshore wind, wave power, tidal) in particular in the North Sea, the Baltic Sea, the Irish Sea and the Mediterranean, and solar, in particular in the Mediterranean region, so as to ensure that these resources are included in the 2007 road map on renewable energy sources and are fully and rapidly developed;
48	Calls for a review of existing EU legislation that prevents the development of the energy policy priorities set out in this resolution, including the future development of large scale tidal projects;
49	Believes that nuclear energy is a part of the European political debate on the energy mix; recognises the role that nuclear energy currently plays in some Member States in maintaining security of electricity supply, as part of the energy mix and as a way of avoiding CO2 emissions; considers that decisions on whether nuclear energy production should continue to play a role in some Member States can only be taken at Member State level, in accordance with the principle of subsidiarity; 
50	Urges the Commission to investigate the development of nuclear energy in Member States, taking account of both the benefits of that technology (low volatility of production costs and no CO2  emissions) and the risks linked to the existence of nuclear power stations (failures and waste disposal);
51	Draws attention to the fact that, in view of the high level of EU dependence on imports, it is particularly important to increase the diversity of countries of origin and transit routes;
52	Recognises that decisions about the make-up of the energy mix must take account of specific national and regional circumstances; considers, therefore, that the promotion of renewables must be geared to relevant geographical, climatic and economic conditions;
53	Calls on the Member States to implement their political commitments regarding the development of the missing energy interconnections, paying special attention to the isolated and border regions of the EU, such as the Baltic States; recalls the necessity of investments to achieve this goal, and requests the Commission to propose measures to establish a favourable investment climate in order to ensure that markets send the right signals to investors; calls on the Member States and the Commission to thoroughly consider the environmental aspects before approving further major infrastructure investments, such as the planned North European Pipe line − North Stream;
55	Believes that development of a common stance in the EU in the dialogue with third countries will increase the EU's ability to negotiate with energy producing and consuming countries and that the Commissioner responsible for energy should follow a well-defined mandate which sets out a long-term European energy planning vision;
56	Urges Member States, mindful of improving cooperation with EU institutions, to set down a list of priority areas where they have reached agreement in terms of external energy policy, including:
57	Calls on the Commission and the Member States to support investment in the European Union, and the acquisition of market share here, by firms from energy-producing countries only on the condition of reciprocity, i.e	security of investment in those countries, and with a strategy that combines the transfer of best available technologies with the creation of an international ruled-based, stable framework for investment that draws on WTO and bilateral economic agreements;
58	Regards it as vital for the EU to continue to lead the global fight against climate change and to strive for achievement of the Kyoto protocol targets; considers it necessary to integrate the EU's endeavours in the development of renewable and clean energy resources and technologies for energy saving and efficiency into all external relations, in line with the global sustainable development agenda agreed in Johannesburg in 2002;
59	Stresses the need to create a common energy policy with regard to internal market regulations as well as external aspects that takes into account the political and economic interests of all the Member States;
