61	Emphasises that IPR are a fundamental asset for creative companies and an incentive for individual creativity and investment in creation; calls, therefore, for schemes to help CCI adapt to the digital shift via new online services based on new forms of rights management promoting authors' rights; calls, further, for a balanced regulatory framework governing the protection and enforcement of IPR;
62	Emphasises the need for effective enforcement of IPR in both the offline and online environments, and stresses in that connection that all measures should be carefully evaluated in order to guarantee their efficiency, proportionality and compatibility with the Charter of Fundamental Rights of the European Union;
63	Calls on the Commission to adapt copyright to the digital era allowing CCI to reap the benefits created by digital technology and media convergence and to consider specific ways of facilitating the use of creative content and archived material and easy, one-stop-shop systems for the clearance of rights;
64	Stresses, in this context, the essential role of collecting societies for the development of European creativity and the digital economy; calls on the Commission, in the context of the ongoing drafting of a proposal for a directive on collective rights management, to establish an appropriate legal framework for collecting societies and the reaggregation of copyright repertoire;
65	Calls on the Commission to enable the viability of a pan-European licensing system that builds on the existing multi-territory individual and collective rights licensing models and facilitates the launch of services with a wide choice of content, hereby increasing legal access to online cultural content;
66	Calls on the Commission and Member States to promote the exchange of best practices on effective methods to raise public awareness regarding the impact of infringements of IPR;
67	Urges the Commission and Member States in association with stakeholders to organise a campaign to raise awareness at European, national and local level, especially among young European consumers, of the need to respect IPR;
68	Calls on the Commission and the Member States to tackle abusive commercial practices and violations of IPR, of which CCI can be victims in both the real and digital economy;
69	Stresses the need finally to address the ‘book famine’ experienced by visually impaired and print-disabled people; reminds the Commission and Member States of their obligations under the UN Convention on the Rights of Persons with Disabilities to take all appropriate measures to ensure that people with disabilities enjoy access to cultural materials in accessible formats, and to ensure that laws protecting IPR do not constitute an unreasonable or discriminatory barrier to access by people with disabilities to cultural materials;
70	Calls on the Commission to work actively and positively within the World Intellectual Property Organisation (WIPO) to agree on a binding legal norm based on the treaty proposal drafted by the World Blind Union and tabled at WIPO in 2009;
71	Stresses the need to solve the issue of orphan works; welcomes the Commission's stated intention to present proposals in this area; notes that the problem of orphan works and the ‘black hole of the 20th century’ is not limited to printed works such as books and magazines, but extends to all kinds of works, including photographs, music and audiovisual works;
72	Calls on the Commission to encourage financial support for private-sector initiatives to create widely accessible rights and repertoire databases on musical, audiovisual and other repertoire; such databases would increase transparency and streamline procedures for rights clearance;
73	Calls on the Commission to encourage the setting up of equitable, impartial and effective alternative dispute resolution for all stakeholders;
74	Takes the view that the Commission should take into account the specific problems encountered by SMEs when it comes to asserting their IPR in accordance with the principle of ‘Think Small First’ established by the Small Business Act for Europe, 
75	Welcomes the Commission's revision of the EU trademark system and encourages the Commission to see to it that the relevant steps are taken to ensure that trademarks can benefit from the same level of protection in both the online and offline environments;
76	Recalls that all policies and measures to support and fund CCI must take into account the characteristics of each branch of the sector;
77	Calls on the Commission to grant the CCI SME status in their own right in regard to all arrangements for access to credit, start-up support and employment protection, which should be suitably adapted to the specificities of the sector, with particular reference to low capitalisation, the brand as an asset, the high risk in the early stage, strong IT impact, irregular employment, and the need for centralised services;
78	Calls on all the actors concerned to consider introducing new, innovative financial instruments, both at a European level and at national level, such as bank guarantee measures, repayable advances, risk-capital funds and incentives for the establishment of local partnerships, which take account of the needs of these industries and especially of the fact that creators' only form of capital is, in many cases, non-material;
79	Advocates the mobilisation of, and simplified application for, existing EU funds and programmes (such as the Microfinance Facility) for the development of small and micro-enterprises in the cultural and creative sector, with a view to optimising support for enterprises by facilitating access to information on funding options;
80	Proposes the introduction of short-term microfinancing to encourage experimentation and the development of innovative cultural and creative projects;
81	Recommends that the Commission assess the relevance of the structural funds, as well as current and future programmes in the fields of culture, audiovisual media, youth provision and education, in terms of their potential to further the creative sector, and that it formulate conclusions and act on them with a view to an improved support policy;
82	Recognises, further, the effectiveness of EU programmes such as the Programme for Innovation and Competitiveness in enabling SMEs to access financing, and suggests that the Commission should assess the possibility of devising similar specific programmes for CCI;
83	Calls on the Commission to consider establishing a specific budget line under the ‘Digital Agenda’ flagship initiative to support the changeover to digital in European cinemas, in order to ensure that all EU citizens have access to content reflecting Europe's different identities and make the whole of the European film sector more competitive;
84	Underlines the importance of patronage and public-private partnerships in the financing and support of cultural and creative activities and calls for better access to credit for these sectors and for alternative formulas such as tax relief or tax incentives to be examined in order to encourage patronage by enterprises;
85	Stresses the importance of professionals in the banking sector being trained to advise on financing cultural and creative projects so that there is better access to credit from financial institutions;
86	Stresses the importance of developing finance and business management consultation and advisory services to allow people working in the cultural and creative sector, and particularly SMEs and very small businesses, to understand the tools required for good business management in order to improve the creation, production, promotion and distribution of cultural goods and services;
87	Stresses the need to train professionals capable of ensuring the economic and financial viability of cultural and creative projects in order to improve access to credit when faced with financial and banking institutions that are generally unfamiliar with the specific characteristics of this sector;
88	Calls on the Commission, in the context of the Digital Agenda, to assist SMEs active in CCI in their search for competitive and consumer-friendly innovative online business models based on co-financing and risk-sharing between CCI and intermediaries;
89	Calls, therefore, on the Commission and the Member States to ensure that public procurement procedures do not entail unnecessary costs and red tape for SMEs;
90	Calls on the Commission, in light of the launch in December 2011 of the eighth Research Framework Programme, to provide for funding to implement entrepreneurial projects and start-ups proposed by young people under the age of 35 in the CCI sector;
91	Requests that priority funding be granted under the ENPI RIP 2011-2013 programme to CCI, with particular reference to the audiovisual sector and the production and distribution of audiovisual works in the Euro-Mediterranean region;
92	Suggests using the framework of the ECIA to provide a platform for access to information and advice on investment readiness and long-term business strategies, access to loans, guarantee funds and cross-border private investment, and calls for the possibility of establishing a Creative Industries Bank to be explored;
93	Encourages the Member States and local and regional authorities to create favourable conditions for CCI to establish contact with the organisations likely to provide them with funding, and calls on those authorities to raise awareness among financial organisations of the specific situation of CCI in order to persuade them to invest in these industries, and more particularly in SMEs and very small businesses, on the basis of cultural projects with a strong economic potential;
94	Encourages local, territorial and regional bodies to make the financial institutions more aware of the special features of CCI so they are motivated to invest in these industries and in particular the SMEs;
95	Emphasises that the CCI contribute, in many cases, to the transformation of declining local economies by encouraging the emergence of new types of economic activity, creating new and sustainable jobs and making European regions and cities more attractive, thus serving the interests of social and territorial cohesion;
96	Underlines that culture has an important role to play in terms of the sustainable development of cross-border territories and is aware that CCI infrastructures and facilities can contribute to the achievement of territorial cohesion; believes that stimulating culture and creativity is an integral part of territorial cooperation that should be reinforced;
97	Calls on all the bodies involved at local level to use the territorial cooperation programmes in order to use and transfer best practices for the development of the CCI sector;
98	Recommends, on the one hand, that more intensive research be conducted into the interdependence of cultural provision and the location of cultural and creative businesses, as well as the EU-wide significance of culture as a factor in companies' location decisions; and, on the other, that support be given to academic research into the impact which cultural and creative businesses have on the places where they locate;
99	Calls on the Commission and Member States to map available knowledge of the practices, needs and good experiences of cross-border and territorial cultural and creative cooperation, to acquire specific expertise on culture, creativity and cross-border territories (particularly in little-explored areas such as the link between culture, creativity and economy) and to elaborate cross-border strategies for the management of cultural heritage and resources;
