56	Stresses the importance of encouraging public and political support for the WTO multilateral trading system; notes that companies have a legitimate interest in shaping policies that affect how they do business and that the participation of different groups, including NGOs, is crucial to the WTO's functioning; stresses, however, that corporate and NGO priorities disproportionately influence the WTO's policy agenda and could play a bigger role than democratically elected parliamentarians with regard to the final document; urges the Commission to carefully examine the role of companies and NGOs in the negotiation process; calls for increased transparency and the reduction of corporate and NGO privileges; stresses that better information of the public and wider consultation of civil society are needed; reiterates, in this respect, the important contribution the parliamentary dimension can make as a means of strengthening the WTO's democratic accountability and openness to the citizens;
57	Underlines the need for institutional reforms to improve the functioning of the WTO, on the basis inter alia of the recommendations contained in the above-mentioned Sutherland Report;
58	Stresses the importance of the work of the Parliamentary Conference on the WTO in strengthening the democratic dimension of the WTO; notes, however, the lack of consideration given to its Final Declarations by WTO negotiators; notes the effort made by EU negotiators to address the Parliamentary Conference on the WTO but deplores the lack of engagement of other WTO negotiators;
59	States its willingness to contribute positively to the negotiating process through the various contacts its Members have with their counterparts from countries with which the EU shares common interests;
60	Welcomes the strong spirit of unity among the three major EU institutions present in Hong Kong and underlines the benefit of maintaining a close collaboration between them in these crucial months of the negotiations; calls on the Council and the Commission to continue to keep Parliament properly involved and fully informed on the EU post-Hong Kong strategy and the progress of the negotiations, also during the next General Council meeting in Geneva
61	Stresses the importance of Parliament being represented at all WTO meetings at which major steps in the negotiations are taken and where ministers are involved and not only on the occasion of official Ministerial Conferences; requests, therefore, that a small delegation of members of the Parliament be meaningfully involved in the meetings to be convened in Geneva with a view to meeting the 30 April and 31 July 2006 deadlines set in the Hong Kong Declaration; invites the Council to extend an invitation to such a delegation of members of the Parliament to participate, as observers, in at least one of the meetings of the 133 Committee to be organised in Geneva at the end of April 2006; calls on the Commission to support this initiative and to ensure that members of the Parliament receive appropriate information on the progress of negotiations during their stay in Geneva;
62	Reiterates the importance of a parliamentary dimension of the WTO in order to enhance democratic legitimacy and transparency in the WTO negotiations, since members of parliament can constitute an important link with citizens, in particular as a source of information and response to their concerns; welcomes the results of the Hong Kong session of the Parliamentary Conference on the WTO; calls on the Commission and the Council to support actively a reference in the final document of the Doha Round which highlights the role of legislators in trade policy-making;
63	Instructs its President to forward this resolution to the Council and the Commission and to the parliaments of the Member States, the acceding countries and the applicant countries, the Director-General of the WTO and the President of the Inter-Parliamentary Union.
